"Title","Categories: Sub","ASIN"
"RoC Retinol Correxion Max Daily Hydration Anti-Aging Face Moisturizer, 1.7 Ounces Retinol Correxion Deep Wrinkle Retinol Face Serum, 1 Ounce Bundle (Packaging May Vary)","Face Moisturizers, Face Care","B0D47RVLBF"
"CeraVe Acne Foaming Cream Wash, Gentle Face and Body Cleanser with Benzoyl Peroxide 10%, Hyaluronic Acid, and Niacinamide, 10% Benzoyl Peroxide Treatment Clears Pimples and Blackheads 5 Oz","Washes, Face Care, Customers' Most-Loved: Beauty, Shop CeraVe Same Day: Available in select metros, Most-loved beauty deals, Customers' Most-Loved Beauty, Best of Skin Care, treat, Allure Best of Beauty","B0C7J25MVB"
"Aveeno Skin Relief Repairing Hand Mask, Moisturizing Gloves with Prebiotic Oat & Shea Butter for Very Dry Skin, Hand Care for Sensitive Skin, Fragrance-Free, 1 Pair of Single-Use Gloves (Pack of 4)","Hand Masks","B0D14WRSFX"
"e.l.f. Lip Plumping Gloss, High-Shine Liquid Lip Color, Creates Fuller Lips & Plumper Pout, Moisturizing Formula, Pink Paloma, 0.09 Fl Oz","Lip Glosses, Glosses, e.l.f., Lips1, Lipstick1","B09JL5DQ45"
"Electric Foot Callus Remover, Rechargeable Portable Electronic Foot File Pedicure Kits, Waterproof Foot Scrubber File, Professional Pedicure Tools, Foot Care for Dead Skin Ideal Gift, 3 Rollers","Foot Files","B0B1M211PJ"
"L’Oréal Paris Le Color Gloss One Step In-Shower Toning Hair Gloss for Bleached Hair, Neutralizes Brass, Conditions & Boosts Shine, Platinum Pearl, 4 Ounce","Hair Color","B09MGFKHVM"
"Lume Invisible Spray Deodorant For Women - Whole Body Deodorant Spray - 72 Hr Odor Control - Ozone Friendly, Natural Propellant - Aluminum & Baking Soda Free, Skin Loving - 2 pack (Unscented)","Deodorant, Deodorants & Shave","B0DG6H553N"
"Neutrogena Hydro Boost Hyaluronic Acid Facial Moisturizer with Broad Spectrum SPF 50 Sunscreen, Daily Water Gel Face Moisturizer to Hydrate & Soothe Dry Skin, Fragrance-Free, 1.7 fl. oz","Face Moisturizers, Face Care, Customers' Most-Loved: Beauty, Most-loved beauty deals, Shop Skin Care, Customers' Most-Loved Beauty, New Year Beauty, Face products","B097NNR535"
"Pooplunch False Eyelashes Russian Volume DD Curl Strip Lashes Cat Eye Fluffy 8D Natural Extension Look Fake Eyelashes Faux Mink Lashes 7 Pairs Multipack","False Lashes","B0BS5C7Z3T"
"Sally Hansen Advanced Hard as Nails, clear, 0.45 Fluid Ounce (Pack of 2)","Nail Strengthening","B0CLRL6SD1"
"Pacifica Island Vanilla Spray Perfume, Fragrances, Euphoria, Sugar, Vanilla, Sandalwood, Lily of the Valley, Clean Perfume, Parfum, Eau de Toilette Vegan & Cruelty-Free","Eau de Parfum","B0CLTDQSHF"
"PRIME PROMETICS PrimeEyes Glide Eyeliner for Mature Women – Waterproof, Long-Stay and Mess-Proof – Gel Creme Texture, Discreet Sharpener and Effective Smudger (Golden Metallic)","Eyeliner","B0DHW6JZ23"
"Glamnetic Press On Nail Remover | Odorless, No Acetone, Gentle Press-On Nail Remover Serum for Fake Nails | 30 ml/1.01 fl. oz.","False Nails & Accessories","B0CSM4KCMS"
"Cliganic Organic Argan Oil Bulk, Gallon Size 128oz, 100% Pure, Non-GMO","Oils","B099K9WHM9"
"Maybelline Super Stay Lumi-Matte Foundation, Lightweight and Buildable Full Coverage Foundation Makeup For Up To 30HR Wear, 128, 1 Count","Foundation, Foundation & Concealer, Foundation & Concealers","B0DLHQKNS4"
"COVERGIRL Cheekers Blendable Powder Blush Soft Sable, .12 oz (packaging may vary), 1 Count (Pack of 3)","Blush, Customers' Most-Loved Beauty v2","B09LKN5T7X"
"Aveeno Stress Relief Body Wash with Soothing Oat & Lavender Scent for Sensitive Skin, Moisturizing Shower Wash Gently Cleanses & Helps You Feel Calm, Sulfate-Free, 18 fl. oz, 2 Pack","Body Washes, Mom's spa night","B0CG2J79XT"
"6 Pcs Shower Caps, Waterproof Bath Caps Plastic Reusable Shower Caps Elastic Band Bath Hair Caps for Women Kids","Shower Caps","B0BMPFW9HK"
"Clean Invisible Loose Powder Translucent Dark","Powder, Customers' Most-Loved: Beauty, Event Deals","B0BBSQVY4F"
"Clairol Professional Shimmer Lights Purple Shampoo, 16 fl. Oz, Neutralizes Brass & Yellow Tones, For Blonde, Silver, Gray & Highlighted Hair Packaging May Vary","Shampoos, Cleansers, 2-in-1 Shampoo & Conditioner, Shampoos, Clairol Professional, Clairol Professional","B084D2165G"
"Double Rhythm 0.5 OZ Cat Eye Gel Polish with Magnet 15ML Holographic Glitter Shimmer Translucent Jelly Color Magnetic Nail Polish Salon DIY at Home (Black-MC1047)","Nail Polish","B0CPP14VGB"
"Burt's Bees Bundle - Superfruit Lip Balm, Grapefruit, Mango, Coconut & Pear, Pomegranate 4 Tubes, 0.15 oz + Rose Water Face Wipes, Micellar Makeup Remover & Facial Cleansing Towelettes, 30 Ct (3-Pack)","Balms & Moisturizers, Face Care, Make Up Removers","B0DCXM2P84"
"Amazon Basics Pony Tail Hair Ties - Black 4 MM Elastics for All Types, 32 Count","Elastics & Ties, Shop Hair Care, Event Deals","B0BMQBL847"
"Premium 20% 𝐯𝐢𝐭𝐚𝐦𝐢𝐧 𝐜 𝐬𝐞𝐫𝐮𝐦 - (2PACK) with Hyaluronic Acid, Retinol & Amino Acids - Boost Skin Collagen,Hydrate & Plump Skin, Anti Aging & Wrinkle Facial Serum","Serums, Most-loved beauty deals, Customers' Most-Loved Beauty","B09TVZNLG4"
"Seraphic Skincare (Original) Premium Exfoliating Mitt for Body (1pc) – 100% Vegan Viscose Traditional Body Scrub Glove Kessa Korean Washcloth – Body Exfoliator for Self-Tan Removal & Keratosis Pilaris","Bathing Accessories","B08YN28CS4"
"Maybelline Fit Me Concealer 20 Sand - 0.23 fl oz 20 Sand","Concealers & Neutralizers, Foundation & Concealer, Foundation & Concealers","B07NDPJ8PD"
"Amazon Basics Moisture Rich Conditioner, 28 Fluid Ounce","Conditioners, Customers' Most-Loved: Beauty, Most-loved beauty deals, Customers' Most-Loved Beauty, BPC 07/23 Reset New","B09HHHH8B3"
"Rose Water For Locs, Daily Moisturizing Refreshing Spray, Rose Water For Hair, Rosewater and Peppermint Hair Scalp Moisturizer. (4 OUNCES)","Styling Products, Categories, Beauty & Grooming, Southeast FBA -Jewelry, Southeast FBA - Kitchen, Maryland, Southeast FBA, Southeast FBA - Beauty","B09QRVFWD6"
"Gillette Foamy Regular Shaving Foam, 2 oz (Pack of 4)","Shaving Creams, Deodorants & Shave","B0BP4KGT2H"
"Amazon Basics Cleanser Face Wash - Renewing Salicylic Acid with Ceramides & Vitamin D, 8 fl oz, 1-Pack","Washes, Our Brands: Personal Care, Face Care, Customers' Most-Loved: Beauty, Event Deals, Most-loved beauty deals, Customers' Most-Loved Beauty","B0BTX4DLHX"
"grace & stella Pimple Patches for Face - Cute Hydrocolloid Dots That Help Protect Acne & Reduce Redness - Fun Zit Stickers to Cover Blemishes - Dermatologist-Tested, Vegan (Multishape, 36 Count)","Pore Cleansing Strips","B0CPJMSNL1"
"Bed Head by TIGI Hairspray Extra Hold Hard Head Hair Care Spray for All Hair Types, 11.7 oz","Hair Sprays, Week 2 Deals","B08X976H6W"
"Jergens Skin Firming Body Lotion for Dry to Extra Dry Skin, Skin Tightening Cream with Collagen and Elastin, Dermatologist Tested, Hydralucence Blend Formula, 16.8 Oz, Pack of 3","Lotions, Mom's spa night","B097YKHYLS"
"SHEGLAM Sun Sculpt Cool Toned Liquid Contour Stick Long Lasting Cream Bronzer Makeup - Tawny Amber","Bronzers","B0BSH9VYDQ"
"L'ANGE HAIR Le Duo Standard 360° Airflow Styler | 2-in-1 Curling Wand & Titanium Flat Iron Hair Straightener | Professional Hair Curler with Cooling Air Vents | Dual Voltage & Adjustable Temp (Black)","Straighteners, Holiday Beauty Haul Coupons, HBH24Couponhub","B0B8TJLH7R"
"Amazon Basics Therapeutic Plus Coal Tar Anti-Dandruff Shampoo Extra Strength 1% Coal Tar, 6 Fl Oz, Pack of 1","Shampoos","B0CCTPJ8DC"
"Sally Hansen Insta-Dri Nail Polish - City Chic Collection - That's A Blazing! - 0.31 fl oz, Shelf Pack of 2","Nail Polish","B09L9V99RS"
"Sally Hansen Insta-Dri Nail Polish - City Chic Collection - My Ca-banana - 0.31 fl oz, (Pack of 2)","Nail Polish","B09LB5D2MR"
"Sally Hansen Insta-Dri Nail Polish - Beach You To It, 0.31 fl oz (Pack of 1)","Nail Polish, Event Deals","B0B9QG9GBZ"
"OGX Thick & Full + Biotin & Collagen Volumizing Shampoo for Thin Hair, Thickening Shampoo with Vitamin B7 & Hydrolyzed Wheat Protein, Paraben-Free, Sulfate-Free Surfactants, 13 fl oz (Pack of 2)","Shampoos","B0D14WL6NK"
"Mast Pro Tattoo Cartridges 20Pcs Disposable Needles Bugpin Round Liner 0805RL","Tattoo Needles","B08F7S6VBQ"
"Redken All Soft Conditioner | For Dry, Brittle Hair | Moisturizes & Provides Intense Softness | With Argan Oil | 10.1 Fl Oz","Conditioners, Beauty Best Sellers, Shop Hair Care, cpf beauty, L'Oreal Haircare Lead Up DOTD 2021, Beauty New Arrivals, Summer Beauty, Shop Premium Beauty, New Year Beauty, Cleansers, 2-in-1 Shampoo & Conditioner, Conditioners, REDKEN, Premium Beauty Best Sellers","B08SSCQH77"
"Living proof Dry Shampoo, Perfect hair Day, Dry Shampoo for Women and Men, 9.9 oz","Dry Shampoos, Shampoo & Conditioner, Deals on premium beauty, Premium Cyber Monday Beauty deals, Beauty Best Sellers, Premium Black Friday Beauty deals, LIVING PROOF, New Arrivals, Premium Beauty","B0BQ3YFRC5"
"Sally Hansen Insta-Dri Nail Polish - City Chic Collection - Instant Coffee - 0.31 fl oz","Nail Polish, Event Deals","B09LBKC6ZR"
"Sally Hansen Insta Dri Nail Polish, City Chic Collection, My Ca-banana, 0.31 Fl Oz","Nail Polish, Event Deals","B09LB736YK"
"Dove Advanced Care Antiperspirant Deodorant Stick Sheer Fresh 4 Count Anti-stain antiperspirant deodorant for soft underarms 72-hour underarm odor protection and all-day sweat control 2.6 oz","Antiperspirant Deodorant","B08VY1TWDN"
"Tub Works® Bath Color Fizzies, 150 Count | Nontoxic & Fragrance-Free | Fizzy, Bath Color Tablets for Kids | Create Fun Bath Colors | Water Tablets in 7 Colors for Variety | Bath Bombs for Kids Bath","Bath Bombs, Mom's spa night, Most-loved beauty deals, Customers' Most-Loved Beauty","B0C7JCXX7K"
"Yamadura Portable Mini Refillable Perfume Atomizer Bottle Refillable Spray, Atomizer Perfume Bottle, Scent Pump Case, Perfume Atomizer Refillable Travel (5ml, 4 Pack)(Red, Rose Red, Purple, Green)","Spray Bottles","B0B7W55H27"
"BEEOS Skinlike Real HD Wig Cap for Women, 24 Pieces Ultra-thin Invisible Brown Sheer Caps for Lace Front Wig Stretchy Stocking Wig Caps Wholesale","Wig Caps","B0C1NKLDX9"
"20 PCS Thick Seamless Hair Ties for Curly Heavy and Long Hair Brown Hair Elastics for Women Men and Girls Big Pony tails Holders (5 cm in Diameter, 1 cm in Width)","Elastics & Ties, Customers' Most-Loved Beauty v2","B07QBF9CNX"
"e.l.f. Power Grip Primer + 4% Niacinamide Mini, Gel-Based & Hydrating Face Primer, Evens Skin & Brightens, Grips Makeup, Vegan & Cruelty-Free","Foundation Primers, Face Care, e.l.f., Foundation & Concealer, Foundation & Concealers","B0CFJQKL2V"
"Curl Defining Brush Pink, Volume Brush for Curly Hair, Curly Hair Brush Defining, Shaping and Styling Women's Curls","Hair Brushes","B0DJ6R3N3X"
"Neutrogena Ultra Sheer Moisturizing Face Serum with Vitamin E & SPF 60, All Day Facial Sunscreen Serum with Broad Spectrum UVA/UVB Protection, Fragrance-Free, Oxybenzone-Free, 1.7 Fl Oz","Face, Facial Sunscreens, Customers' Most-Loved: Beauty, Event Deals, Shop J&J Same Day: Available in select metros, Most-loved beauty deals, Beach Bum Summer Picks, Beauty Summer Sun Care, Shop Skin Care, Sunscreen & Tanning Sample Credit, Customers' Most-Loved Beauty, Beauty Outlet, New Year Beauty, Sun Protection","B09MV3MHJD"
"Kenra Platinum Blow-Dry Spray Bundle | Time-Saving Heat Protectant | Detangles, Smooths, and Softens | Eliminates Frizz & Resists Humidity | Medium To Coarse Hair | 3.4 fl. oz + Travel 1.7 fl. oz","Styling Treatments, Cleansers, Hair Care","B0D2YZDD1F"
"Dove Aluminum Free Deodorant Stick Non irritating for Underarm Care Pear Aloe Vera Kindest, Fresh, 2.6 Oz","Deodorant, Deodorants & Shave, Self-Care Sale","B08TLQH7CG"
"ILNP Tombstone - Bone Grey Holographic Nail Polish","Nail Polish","B09HN4CXY6"
"DAE Hair Cactus Fruit 3-In-1 Styling Cream & Taming Wand - Tame Flyaways, Smooth Frizz, Style Edges (0.6 oz.)","Creams & Lotions","B0DHLR2TJM"
"Vanicream Vitamin C Serum - Free of Dyes, Fragrance, Masking Fragrance, Lanolin, Parabens & Formaldehyde Releasers - For Sensitive Skin - 1.2 Fl Oz","Serums, The Cold & Flu Store, Heart Health Supplements, Immune Support, Energy & Mood Supplements, Supplements Deals, Facial Skin Care Sample Credit, Customers' Most-Loved: Beauty, Most-loved beauty deals, Customers' Most-Loved Beauty","B0BJ4GZTK1"
"L’Oréal Paris Cosmetics Infallible Grip Precision Felt Eyeliner, Smudge Resistant, Long Lasting Waterproof Eyeliner, Black, Black, 0.03 fl oz","Eyeliner","B09S8JWWZ3"
"GOO GOO Clip in Hair Extensions Real Human Hair, Remy Human Hair Extensions Clip ins for Women, Natural Human Hair, 18inch 70g 4Pcs, 4/27/4 Balayage Chocolate Brown to Caramel Blonde","Hair Extensions","B0BB2Q7Y8P"
"OPI RapiDry Nail Polish Top Coat | Quick Drying Top Coat | Quick Dry, High Shine & Glossy, Protects Nails","Top Coat, Nail Art & Polish, Shop Nail, Cleansers, Nail Polish, Top & Base Coats, OPI","B0CQMTX53Z"
"Too Faced Better Than Sex Volumizing Mascara | Dramatic Volume, Length + Peptides Help Condition Lashes, 0.27 Fl Oz, Chocolate","Mascara, Cleansers, Mascara, Eyes, Too Faced","B0BV16N41F"
"Amazon Basics Mens Soap Body Wash, Sport Scent, 18 Fluid Ounce, Pack of 6","Body Washes, Mom's spa night, Event Deals","B09HH955ZK"
"COLOR WOW MONEY MIST – Luxe Leave-in Conditioning Treatment for Glossy, Expensive-Looking Hair | Moisturizes, Defrizzes & Detangles for smooth, silky texture","Conditioners, COLOR WOW, Cleansers, 2-in-1 Shampoo & Conditioner, Conditioners, COLOR WOW","B0D9KSH7HP"
"Yanibest Heatless Hair Curler, No Heat Hair Curlers to Sleep in, Overnight Satin Heatless Curling Set with Hair Scrunchies Clip, for All Hair Types","Hair Rollers","B0D8T1XXB3"
"Bee Bald HEAL Aftershave for Men Healing Balm, Immediately Calms & Soothes Damaged Skin, Treats Bumps, Redness, Razor Burn & Other Shaving Post Shave Irritations, 2 Fl Oz (Pack of 2)","Balms, Deodorants & Shave","B0C6TZMMJB"
"Bundle of La Roche-Posay Pure 10% Vitamin C Serum+ La Roche-Posay Pure Retinol Face Serum for Lines, Wrinkles & Premature Sun Damage to Resurface & Hydrate, Suitable for Sensitive Skin","Serums, Oils & Serums, Facial Skin Care Sample Credit, La Roche-Posay, La Roche-Posay Sampling, Amazon.com: 15% off Professional Skin Care","B0B15FTF8T"
"e.l.f. Camo Liquid Bronzer & Contour, Silky Highly Pigmented Formula, Creates a Long-Lasting Bronzed Glow & Natural Look, Vegan & Cruelty-Free, 10 Rich","Bronzers, e.l.f.","B0DHRR735R"
"IT Cosmetics Your Skin But Better CC+ Cream, Deep Honey - Color Correcting Cream, Full-Coverage Foundation, Hydrating Serum & SPF 50+ Sunscreen - Natural Finish - 1.08 fl oz","CC Creams, Face Care, Beauty New Arrivals, It Cosmetics","B08Y9CJH15"
"Bath & Body Works Fine Fragrance Body Spray Mist 8 oz (You're The One)","Fragrance","B0D464SL5V"
"I DEW CARE Biotin Clarifying Dry Shampoo Refill - Tap Secret Original | Strengthening & Volumizing, Powder Type, Refillable, Travel size, Non-aerosol, Brunette, Korean Ginseng, 0.24 Oz","Dry Shampoos","B0CRHFNY8L"
"CeraVe Hydrating Anti Dandruff Shampoo, 1% Pyrithione Zinc Dandruff Treatment With Ceramides, Niacinamide & Hyaluronic Acid, Helps Eliminate Flakes & Provides Itchy Scalp Relief, Sulfate Free, 12 Oz","Shampoos","B0DV43L7J8"
"GAINWELL 50-Count Heart Shape Compressed Facial Sponges for Daily Facial Cleansing and Exfoliating, 100％ Natural Cosmetic Spa Sponges for Makeup Remover","Blenders & Sponges","B0C2XXB38P"
"TIGI Bed Head Hair Wax Stick for Strong Hold 2.57 oz (Pack of 4)","Gels, Gina's Favorites","B0BNWH7ZXP"
"CeraVe Ultra-Light Moisturizing Gel, Hydrating Gel Face Moisturizer with Ceramides, Niacinamide, Hyaluronic Acid, Fragrance Free, Oil-Free, Weightless Mattifying Moisturizer, 1.75 FL Oz","Face Moisturizers, Face Care, Customers' Most-Loved: Beauty, Shop CeraVe Same Day: Available in select metros, Most-loved beauty deals, Customers' Most-Loved Beauty","B0C7HHKH3G"
"REMEDIAL PAX Face Moisturizer Retinol Cream, Anti Aging Neck Firming Cream, Collagen Day & Night Face Cream with Hyaluronic Acid for Women & Men, 1.85 Fl Oz","Face Moisturizers, Face Care, Customers' Most-Loved: Beauty, Most-loved beauty deals, Customers' Most-Loved Beauty","B0928VR14Z"
"KUPA GelFinity Gel Topcoat Gloss Finish 8oz","Top Coat","B08VYRB3W6"
"e.l.f. Halo Glow Contour Beauty Wand, Liquid Contour Wand For A Naturally Sculpted Look, Buildable Formula, Vegan & Cruelty-free, Deep/Rich","Face, Creams & Moisturizers, Face Care, Valentine's Day Beauty, New Year Beauty, e.l.f.","B0C7S92SK4"
"L'ANGE HAIR Glass Hair Thermal Blowout Primer | Heat Protectant Spray for Frizz-Free Styling | Lightweight Formula for Smooth, Silky Hair | Humidity-Resistant Shine Enhancer | 5 fl oz Bottle","Styling Treatments, Holiday Beauty Haul Coupons, HBH24Couponhub","B0BG9GQYKX"
"Peach Slices | Acne Spot Dots | Hydrocolloid Acne Patches | For Zits, Blemishes, & Breakouts | Vegan | Cruelty-Free | Pimple Patches | Facial Skin Care Products | 3 Sizes (7mm, 10mm, & 12mm) | 60 Ct","Pore Cleansing Strips","B09RF1QBHR"
"Slopehill Professional Ionic Hair Dryer, Powerful 1800W Fast Drying Low Noise Blow Dryer with 2 Concentrator Nozzle 1 Diffuser Attachments for Home Salon Travel (Black)","Hair Dryers","B0C3M9WBQF"
"C CARE Lavender and chamomile Cuticle Oil For Nails - Repairs Cuticles Overnight - Moisturizes and Strengthens Nails and Cuticles - 8oz","Cuticle Oils","B0CN9SHYRD"
"e.l.f. Lip Exfoliator, Moisturizing Scented Lip Scrub For Exfoliating & Smoothing Lips, Infused With Jojoba Oil, Vegan & Cruelty-free, Coffee","Scrubs, Customers' Most-Loved: Beauty, Most-loved beauty deals, Customers' Most-Loved Beauty, e.l.f.","B0C7WMTBLW"
"Kerasal Multi-Purpose Nail Repair Patches - 14 Count - Nail Repair for Damaged Nails, 8-Hour Nail Treatment Restores Healthy Appearance (Packaging May Vary)","Nail Repair, Shop Nail, New Year Beauty","B0BVWHS7CD"
"COVERGIRL Clean Fresh Yummy Gloss – Lip Gloss, Sheer, Natural Scents, Vegan Formula - Havana Good Time","Lip Glosses, Glosses, Customers' Most-Loved: Beauty, Event Deals, Most-loved beauty deals, Customers' Most-Loved Beauty, Lips2, Lipstick2, Best of Makeup, Allure Best of Beauty","B0BBSPM876"
"CorneaCare Rescue: Hydrogel Self Cooling Compress | Cold Eye Masks for Puffy Eyes | Self Cooling Eye Compress for Fast Relief | Travel Ready | 12 Count | FSA & HSA Eligible","Masks","B0B1MBKPCW"
"OUAI Thick Shampoo and Conditioner Set - Sulfate Free Shampoo and Conditioner for Thick Hair - Made with Keratin, Marshmallow Root, Shea Butter & Avocado Oil - Free of Parabens & Phthalates (10 Fl Oz)","Shampoo & Conditioner Sets","B08SY14QNW"
"HAPPY NUTS Comfort Cream Deodorant For Men: Anti-Chafing Sweat Defense, Odor Control, Aluminum-Free Mens Deodorant & Hygiene Products for Men's Private Parts 3.4 Fl Oz, Fragrance-Free","Deodorant, Anti-Chafing Products, Deodorants & Shave","B08K1PF2KK"
"Just for Men 1-Day Beard & Brow Color, Temporary Color for Beard and Eyebrows, For a Fuller, Well-Defined Look, Up to 30 Applications, Darkest Brown/Black (Pack of 2)","Eyebrow Color, The Grande Cosmetics Store","B0DN1ZR7B4"
"HUMBLE BRANDS Original Formula Aluminum-free Deodorant, Earthy & Grounded, Texas Cedarwood, Palo Santo, Black Spruce, Pack of 3","Deodorant, Deodorants & Shave","B0C64HP7G4"
"La Roche-Posay Toleriane Double Repair Matte Face Moisturizer, Daily Moisturizer For Oily Skin With Ceramide And Niacinamide For All Skin Tones, Oil Free, Non-Comedogenic","Face Moisturizers, Face Care, Creams & Moisturizers, Facial Skin Care Sample Credit, Beauty Best Sellers, Customers' Most-Loved: Beauty, La Roche-Posay, Most-loved beauty deals, Shop Skin Care, Customers' Most-Loved Beauty, Premium Beauty Best Sellers, moisturize, La Roche-Posay Sampling, Amazon.com: 15% off Professional Skin Care","B09N13T8TL"
"Professional Blow Drying Brush Set - Ceramic Ionic Thermal Brushes for Styling Wet Hair, 3 Round Brushes with Travel Bag for Women","Hair Brushes","B0C1DQC9GL"
"Ban Invisible Roll-on Antiperspirant Deodorant for Women and Men, 24-hour Underarm Odor & Sweat Protection, Fresh Cotton, 3.5 Oz, Pack of 4","Antiperspirant Deodorant","B08DGN2GG8"
"Tribal Chimp Hair Styling Powder, All-day Invisible Hold Hair Volumizer and Texture Powder for Men and Women, Styling Powder with Matte Finish - Single Pack, 10g","Root Lifting Powders","B0B3TXPM2Q"
"CeraVe Cleansing Balm Makeup Remover, Waterproof Makeup Remover With Ceramides & Plant-Based Jojoba Oil To Nourish & Hydrate, Non-Comedogenic & Fragrance Free, 1.3 Oz","Washes, Face Care","B0B1PP1XCM"
"Gillette Mach3 Men's Razor Blades with Precision Trimmer, Pack of 24 Refill Blades","Cartridges, Deodorants & Shave","B09D7PYL3W"
"Curel Ultra Healing Intensive Fragrance-Free Lotion For Extra-Dry Skin, Dermatologist Recommended, Ideal for Sensitive Skin, Cruelty Free, Paraben Free, 13 Oz, Pack of 3","Lotions, Mom's spa night","B095XGKMPX"
"L'Oreal Paris Elvive Dream Lengths Restoring Shampoo With Fine Castor Oil and Vitamins B3 and B5 for Long, Damaged Hair, Visibly Repairs Damage Without Weighdown With System, 28 Fl Ounce (Pack of 2)","Shampoos","B0D1835FLN"
"Versace Eros 0.17 oz (5 ml) EDT Splash Men Mini NEW IN BOX (Pack of 2)","Fragrance","B0DJYXFVG8"
"MagicMinerals AirBrush Foundation by Jerome Alexander – 2pc Set with Airbrush Foundation and Kabuki Brush - Spray Makeup with Anti-aging Ingredients for Smooth Radiant Skin - Bright Medium","Foundation, Foundation & Concealer, Foundation & Concealers","B0B6QD4FQH"
"LivaClean 240 CT Rainbow Superstar Acne Patches w/Salicylic Acid & Tea Tree, Rainbow Star Patch Star Pimple Patch Pimple for Face Acne Patches Cute Zit for Face","Pore Cleansing Strips","B0BP2DBPDH"
"Wavytalk Thermal Brush, 1.5 Inch Ionic Heated Round Brush Creates Blowout Look Effortlessly Achieves Gorgeous Curls, Dual Voltage (Purple)","Hot-Air Brushes","B0CR1CRCW8"
"Amazon Basics Oval Premium Pads, 300 Count (6 Packs of 50) (Previously Solimo)","Cotton Pads & Rounds, Event Deals","B0943ZBCR5"
"Good Molecules Daily Brightening Serum - Hydrating Facial Serum with Beta Arbutin and Hyaluronic Acid to Moisturize - Anti-Aging Skincare for Face","Serums, Customers' Most-Loved: Beauty, Most-loved beauty deals, Customers' Most-Loved Beauty","B091MGP94B"
"eos Shea Lip Balm Sampler, Lip Care to Moisturize Dry Lips, Sustainably-Sourced Ingredients, 0.25 Ounce (Pack of 5)","Balms & Moisturizers","B0BFZ9SPS4"
"Method Foaming Hand Soap Refill, Sweet Water, Recyclable Bottle, Biodegradable Formula, 28 Fl Oz (Pack of 4)","Hand Wash","B092RBCJ6R"
"Everyone Liquid Hand Soap, 12.75 Ounce (Pack of 3), Pacific Eucalyptus, Plant-Based Cleanser with Pure Essential Oils","Hand Wash","B0B6YG64BC"
"Beetles Builder Gel for Nails -15ml 7 in 1 Milky White Nail Builder Strengthener White Gel Builder For Nails Hard Gel Jelly Gel Builder Extension Nail Gel Salon DIY Nail Art Design","Gel","B0C4BJMD2P"
"VieBeauti Premium Eyelash Growth Serum: Lash Enhancing Serum with Advanced Formula to Boost Longer Fuller and Thicker Looking Lashes - Vegan & Cruelty-Free for Sensitive Eyes 3mL 3-Month Supply","Eyelash Primers, Customers' Most-Loved: Beauty, Most-loved beauty deals, Customers' Most-Loved Beauty","B0DHWLY67W"
"HERITAGE STORE Rosewater - Refreshing Facial Mist for Glowing Skin with Damask Rose, All Skin Types - Rose Water Spray for Face, Made Without Dyes or Alcohol, Hypoallergenic, Vegan, Cruelty Free, 12oz","Face Mists, Face Care","B09HJP3GGN"
"Maybelline Fit Me Blush, Lightweight, Smooth, Blendable, Long-lasting All-Day Face Enhancing Makeup Color, Berry, 1 Count (Pack of 2)","Blush, Customers' Most-Loved Beauty v2","B0BPVYCQ2W"
"The SAEM Iceland Hydrating & Collagen Eye Stick 2 Pack - Cooling & Anti-Wrinkle Eye Balm for Dark Circles and Puffiness – Under Eye Treatment - Reduce Wrinkles and Moisturizing - Duo Set","Balms","B0CBK3T46R"
"Set 12Pcs Gel 3D Bows Nails Charms Plain No Rhinestone Gems Handmade by Gel, Design For Medium & Long Nail, 3D Bow Nail Art Floral Salon Decor For Women (Medium, Bow - Clear)","Nail Tools, Categories, Beauty & Grooming","B0D42DCCTY"
"Self Tanning Drops - USA Made with Natural & Organic Ingredients, Medium Face Tanning Drops to Add to Lotion, Moisturizing Bronzing Tanner for Face & Body, Toxin Free Tanner for Fake Tan","Facial Self Tanners, Customers' Most-Loved: Beauty, Most-loved beauty deals, Beauty Summer Sun Care, Customers' Most-Loved Beauty, Sun Protection","B0C24SSQRZ"
"Wavytalk Thermal Brush, 1.5 inch Heated Round Brush for Blowout Look, Dual Voltage, Pink, Sakura, Tourmaline Ceramic, Negative Ion Technology, 5 Temperature Settings","Hair Brushes","B0CQSNXLJR"
"Palmer's Cocoa Butter Formula Skin Firming Body Lotion, Toning & Tightening Cream with Q10, Collagen & Elastin, Pump Bottle, 13.5 Oz.","Lotions, Mom's spa night, Customers' Most-Loved: Beauty, Most-loved beauty deals, Body Lotions and Skin Care Sample Credit, Customers' Most-Loved Beauty","B09C6PTNYY"
"Set 32PCs Or 10Pcs 3D Sweet Season Poinettia (5 Petals) Flower Nail Art Charms Handmade by Acrylic Powder Design Acrylic Nail Art for Women Girls (Pink-10Pcs)","Nail Tools, Categories, Beauty & Grooming","B0C5XKQ9G2"
"Billie Razors for Women Shave Kit with 2 Refills + Holder Bundle with Lavender Milk Scent SkyFoam Shave Gel","Cartridge Razors, Deodorants & Shave","B0D5XFWX7Z"
"Dr. Dan's Cortibalm - 2 Pack - for Dry Cracked Lips - Healing Lip Balm for Severely Chapped Lips - Designed for Men, Women and Children","Balms & Moisturizers","B0CP64ZMWZ"
"Eucerin Advanced Repair Body Cream, Fragrance Free Body Cream for Dry Skin, 16 Oz Jar (Pack of 2)","Creams","B0C4Z592G7"
"DOVE MEN + CARE Deep Clean Bar Soap and Eucalyptus + Cedar Oil Body Wash Bundle, 8 Pack 3.75oz Bar Soap and 26oz Body Wash","Soaps, Mom's spa night","B0D2VNVJKX"
"Eyelashes Natural Look Faux Mink Lashes Fluffy False Eyelashes Wispy Cat Eye Lashes Pack Strip Lashes by Kiromiro","False Lashes","B0BTSH1YPQ"
