"Title","Categories: Sub","ASIN"
"Cetaphil Face Wash, Hydrating Gentle Skin Cleanser for Dry to Normal Sensitive Skin, NEW 20 oz, Fragrance Free, Soap Free and Non-Foaming","Washes, Face Care, Customers' Most-Loved: Beauty, Most-loved beauty deals, Shop Skin Care, Customers' Most-Loved Beauty, cleanse","B099N3NM61"
"SOL DE JANEIRO Brazilian Bum Bum Body Cream","Creams, Fall Trends, Bare Faced, Beauty New Arrivals, New Year Beauty, Premium Fall Finds, Cleansers, Creams, SOL DE JANEIRO, New Arrivals, New Year Beauty","B0BXBC39TL"
"COSRX Acne Pimple Patch Absorbing Hydrocolloid Original 3 Size Patches for Blemishes and Zits Cover, Spot Stickers for Face and Body, Not Tested on Animals","Pore Cleansing Strips","B0DFH3MPWL"
"Milani Make it Last Matte - Matte Finish Charcoal Setting Spray - Cruelty-Free Makeup Primer and Setting Spray for Oily Skin - Long Lasting Finishing Spray - 2 Pack","Foundation Primers, Foundation & Concealer, Foundation & Concealers","B0BN4N1XNK"
"Method Body Wash, Pure Peace, Paraben and Phthalate Free, Biodegradable Formula, 28 oz (Pack of 1)","Body Washes, Climate Pledge Friendly | Beauty & Personal Care, Mom's spa night","B0BT1VXDGD"
"The Honest Company Conditioning Hair Detangler | Leave-In Conditioner + Fortifying Spray | Tear-Free, Cruelty-Free, Hypoallergenic | Lavender Calm, 4 Fl Oz","Conditioners","B0BFPGH83H"
"Elizabeth Mott Thank Me Later Glow Enhancer & Primer – Hydrating Natural Glow with Hyaluronic Acid, Niacinamide & Squalane, Sheer Tinted Glow, Cruelty-Free, Fair Sheer Glow Shade, 30g","Foundation Primers, Foundation & Concealer, Foundation & Concealers","B0DJWMZHL3"
"L'Oreal Paris Glossing Lamination Hair Mask with Glycolic Acid, Hair Treatment for Lasting Shine and Smoothness for Dull, Dry Hair, EverPure, 5.1 Fl Oz","Hair Masks","B0DKG9CMH8"
"Three Sisters Apothecary 4 oz. Body Butters (California Mission Fig)","Moisturizers, Categories, Beauty & Grooming, Lotions & Moisturizers, Prime-eligible products","B0BW6DLNJ4"
"Aveeno Skin Relief Fragrance-Free Body Wash with Triple Oat Formula, Gentle Daily Cleanser for Sensitive Skin Leaves Itchy, Dry Skin Soothed & Feeling Moisturized, Sulfate-Free, 36 fl. oz","Body Washes, Mom's spa night","B09Q5LGTJN"
"O'Keeffe's Working Hands Hand Cream, Relieves and Repairs Extremely Dry Hands, 3 oz Tube, (Pack of 5)","Hand Creams & Lotions","B0BMMDSKQP"
"Pantene Shampoo & Conditioner Set, Daily Moisture Renewal with Pro-V Nutrients for Dry, Color-Treated Hair, Long-Lasting Hydration & Nourishment, 27.7 Fl Oz Each, 2-Pack + Miracle Rescue Shot (0.5 Oz)","Shampoo & Conditioner Sets, Shop Hair Care, Event Deals, Allure Best of Beauty Summer Picks, Self Care, Winter Hair Care","B09GV3RGW2"
"Neutrogena Ultra Sheer Dry-Touch Sunscreen SPF 55 3 oz (Pack of 3)","Body Sunscreens, Beauty Summer Sun Care, Sun Protection","B00E4MR0XK"
"BAGSMART Toiletry Bag Travel Bag with Hanging Hook, Water-resistant Makeup Cosmetic Bag Travel Organizer for Accessories, Shampoo, Full Sized Container, Toiletries (Red Paisley, Large)","Toiletry Bags","B0BLGRG5GS"
"Mario Badescu Rose Water Facial Spray & Enzyme Cleansing Gel Bundle | Hydrating Rose Water Face Mist + Oil-Free Cleanser with Grapefruit & Papaya Extract | Rejuvenates, Clarifies & Removes Excess Oil","Face Mists, Face Care, Mario Badescu","B0DPNGXTPM"
"Cremo Body Wash Men, Notes of Italian Bergamot, Neroli Blossom, and Fresh Vetiver, Rich-Lathering Italian Bergamot, 16 Fl Oz","Body Washes, Climate Pledge Friendly | Beauty & Personal Care, Mom's spa night, Shop Men's","B0CMW64H59"
"RoC Derm Correxion Advanced Retinol Firming Serum Stick with Antioxidants to Visibly Tighten and Firm Wrinkles and Laugh Lines, 1.0 oz with Retinol Eye Cream Packette","Serums, Customers' Most-Loved: Beauty, Most-loved beauty deals, Winter Beauty Favorites, Customers' Most-Loved Beauty","B0DBRVHR38"
"grace & stella Under Eye Patches for Puffy Eyes and Dark Circles (Retinol, 48 Pairs) Restoring Gel Under Eye Masks with Hyaluronic Acid - Vegan Cruelty-Free Skincare Birthday Gifts for Women","Masks","B0D5YSVQNJ"
"Amazon Basics Cosmetic Foam Wedges For Makeup, 32 Count","Blenders & Sponges, Customers' Most-Loved: Beauty, Most-loved beauty deals, Customers' Most-Loved Beauty","B0BNZZQZN2"
"Amazon Basics Liquid Hand Soap Refill, Mango & Coconut Water Scent, Triclosan-Free, 50 Fl Oz (Pack of 2)","Hand Wash","B09HHBZX91"
"Olaplex No. 7 Bonding Oil, Concentrated High Shine Oil, Heat Protectant, Visibly Smooths & Softens Hair, Added Color Vibrancy, Up to 72 Hour Frizz Control, For All Hair Types, 1 fl oz (Pack of 2)","Hair Treatment Oils, Hair Care, Olaplex, Cleansers, Hair Treatment Oils","B0DBXS432H"
"L'Oreal Paris Magic Root Rescue 10 Minute Root Hair Coloring Kit, Permanent Hair Color with Quick Precision Applicator, 100 percent Gray Coverage, 3 Soft Black, 2 count","Hair Mascaras & Root Touch Ups, Save 20% on L'Oreal Paris Hair Color, LORCD LUSA USA CPA HOLISTIC BEAUTY","B084W319N1"
"BABE ORIGINAL Babe Lash Serum - Fuller & Longer Looking Eyelashes, Clear Essential Serum for Natural Lashes and Lash Extensions, 2mL, 3-month Supply","Eyelash Primers, Deals on premium beauty, Premium Cyber Monday Beauty deals, Beauty Best Sellers, Customers' Most-Loved: Beauty, Premium Black Friday Beauty deals, Most-loved beauty deals, Customers' Most-Loved Beauty, Cleansers, Eyes, Eyes, BABE ORIGINAL, Premium Beauty Best Sellers, Premium Beauty","B01C2EFBZU"
"Neutrogena Gentle Oil-Free Eye Makeup Remover & Cleanser for Sensitive Eyes, Non-Greasy Makeup Remover, Removes Waterproof Mascara, Dermatologist & Ophthalmologist Tested, 8.0 fl. oz (Pack of 2)","Makeup Cleansing Water, Make Up Removers","B0D14XGCH5"
"Method Body Wash, Sea + Surf, Paraben and Phthalate Free, Biodegradable Formula, 28 oz, (Pack of 1)","Body Washes, Climate Pledge Friendly | Beauty & Personal Care, Mom's spa night","B0BT1WN3ZD"
"Bio-Oil Skincare Body Oil, Serum for Scars and Stretch Marks, Face and Body Moisturizer, Dermatologist Recommended, Non-Comedogenic, For All Skin Types, 2 oz (Pack of 24)","Oils","B0BYG6T2DH"
"UNA GELLA Almond Oval Fake Nails Pre-shape 504pcs Oval Gel Nail Tips Round Oval Almond Press on Nails for Full Cover Acrylic Round Oval Full Nails False Nails 12 Sizes False Soft Gel Tips","Nail Tips","B09XB519T1"
"Cetaphil Face & Body Moisturizer, Hydrating Moisturizing Lotion for Normal to Dry Skin, Suitable for Sensitive Skin, 2 oz Pack of 12, Fragrance Free, Hypoallergenic, Non-Comedogenic","Lotions, Mom's spa night, moisturize","B09FCLR216"
"Hero Cosmetics Mighty Patch Micropoint™ XL for Blemishes - Hydrocolloid Acne Spot Treatment Patch for Early Stage Zits and Hidden Pimples, 1,385 Proprietary Micropoints (6 Count)","Pore Cleansing Strips","B0BWL2J93X"
"Ditoi Face Towels, Disposable Face Towels with a Container, Storage Box with Copper Drawer, Ultra Soft Facial Cloths, Makeup Remover Wet Dry Wipes for All Skin","Cloths & Towelettes, Face Care, Make Up Removers","B0CP9M3G76"
"AGE beautiful Permanent Hair Color Dye Liqui Creme | 100% Gray Coverage | Anti-Aging Haircolor | Biotin for Thicker, Fuller Hair | Professional Salon Coloring | 9NNG Light Intense Golden Blonde","Hair Color, Beauty New Arrivals, AGE beautiful","B0BHH9RH8B"
"Dolahair Hair Wax Stick for Flyaways, Smoothing, and Slick Back - Hair Pomade for Women and Kids (2 Pack)","Waxes, Most-loved beauty deals, Customers' Most-Loved Beauty","B0BRC5K11L"
"Gold Bond Age Renew Crepe Corrector Body Lotion, Replenishing & Smoothing Formula, 13 oz (Packaging May Vary)","Lotions, Mom's spa night","B0DHWG1DZH"
"Clairol Root Touch-Up by Nice'n Easy Permanent Hair Dye, 4G Dark Golden Brown Hair Color, Pack of 1","Hair Color","B085YNWXB9"
"Summer Fridays Tinted Lip Butter Balm - Conditioning Vegan Lip Balm for Instant Moisture, Shine & Hydration - Sheer-Tinted, Soothing Skincare - Pink Sugar (.5 Oz)","Balms & Moisturizers, Comfort Zone","B0C42HJRBF"
"Old Spice Aluminum Free Deodorant for Men, 24/7 Odor Protection, Eliminates Odors with Lasting Freshness, High Endurance, Sport Scent, 3 oz (Pack Of 3)","Deodorant, Deodorants & Shave","B08NYHVJ5N"
"PanOxyl Antimicrobial Hydrating Acne Creamy Wash, 4% Benzoyl Peroxide, 6 Ounce (Pack of 2)","Washes, Face Care","B0CTR6TK9H"
"Softsoap Coconut & Hibiscus Scent Hydrating Liquid Hand Soap, Liquid Hand Soap, 11.25 Fl Oz (Pack of 6)","Hand Wash","B08KK91XC5"
"You Are Loved You Are Enough Makeup Case Self-Worth Cosmetic Bag Positive Affirmation Toiletry Bag Gift Motivation Quotes Sister Gift (Soul Sister)","Toiletry Bags, Luggage & Travel Gear, Beauty & Grooming, HM-Curation","B09CGF517S"
"Maybelline Lash Sensational Sky High Serum Infused Lash Primer for Mascara, Lengthening, Thickening, Tinted and Washable Formula, Soft Black, 1 Count","Mascara, Shop Makeup, Allure Best of Beauty Summer Picks, Best of Makeup, Allure Best of Beauty","B0BCQZ29B8"
"Cuccio Naturale Cuticle Oil - Revitalizing & Hydrating - Citrus Wild Berry - Paraben/Cruelty-Free - 2.5 oz","Cuticle Oils","B096SK6RFF"
"Nature Republic HONEY MELTING LIP GLITTER (14 MAPLE) SOFT LIP STICK, 2.9g / 0.09oz","Lip Glosses, Glosses","B0D53TMNBJ"
"Beetles Gel Nail Tips 288 pcs Extra Short Square Beetles Gel X Nail Tips 12 Sizes Full Cover Nail Tips Half Matte Acrylic Press On Nail Square Fake Nails Nail Extension Set for Women","Nail Tips","B0D1CBSSSR"
"JODSONE 35 PCS Gel Nail Polish Kit with Mini UV Light No Wipe Base and Glossy &Matte Top Coat Soak Off Gel Nail Kit Enjoy Fun of Colorful Gel Starter Kit","Decoration Kits","B0B5DP4K2K"
"ARCTIC FOX Vegan and Cruelty-Free Semi-Permanent Hair Color Dye (5.6 Fl Oz, PURPLE MADNESS)","Hair Color","B0CTVFLQYN"
"Gold Bond Healing Hydrating Lotion with Aloe Moisturizes, Heals & Smooths Dry Skin, Delivers Immediate 24-Hour Hydration, Value Size, 24 oz.","Lotions, Mom's spa night","B0CWVSNVG6"
"Naturtint 4WN Radiant Nature Brown Glamour Permanent Hair Color (Pack of 1), Ammonia Free, Vegan, Cruelty Free, up to 100% Gray Coverage, Long Lasting Results (Packaging may vary)","Hair Color","B0CKQ2VP3C"
"Clean Skin Club Clean² Pads 2.0 [NEW & IMPROVED EDGES] Guaranteed Not to Shed & Tear, Unique Triple Layers, Textured Side & Ultra Soft Side, Organic Disposable Cotton, Pair with Makeup Remover 2 pack","Cotton Pads & Rounds","B0BK2CTB4Y"
"Tangle Teezer Ultimate Detangler Hairbrush for Wet & Dry Hair, Eliminates Knots & Reduces Breakage for All Hair Types, Denim Blues","Hair Brushes","B08Z9Y379G"
"LONDONTOWN Illuminating Nail Concealer, Milky Sheer Bubblegum Pink Polish - Long Lasting Brightening Lacquer Nail Care for Discolored, Yellowing Nails, .40fl oz","Nail Polish, Event Deals, LONDONTOWN, Beauty New Arrivals, Cleansers, Nail Strengthening, Nail Polish","B0C8JSSMNW"
"MEDIX Vitamin C Cream + Anti Aging Argan Oil Cream 2PC Skin Care Bundle | Moisturizer Body Cream & Face Lotion | Brightening Body Lotion For Women, Uneven Skin Tone, Wrinkles, & Sun Damaged Skin, 2PC","Creams, Mom's spa night","B0CRXPC2FZ"
"Amazon Basics Cocoa Butter Body Lotion, Lightly Scented, 20.3 Fl Oz, Pack of 4","Lotions, Mom's spa night, Event Deals, Self Care, Most-loved beauty deals, Customers' Most-Loved Beauty","B09HH9777M"
"L'Oreal Paris Feria Permanent Haircolor, R57 Intense Medium Auburn 1 ea (Pack of 9)","Hair Color","B01IAE9UJ4"
"EltaMD UV Clear Tinted Sunscreen for Face - Deep Tinted SPF 46 with Zinc Oxide, Oil-Free, Dermatologist Recommended, 1.7 oz (Pack of 2)","Facial Sunscreens, Deals on premium beauty, Premium Cyber Monday Beauty deals, Premium Black Friday Beauty deals, Most-loved beauty deals, Beauty Summer Sun Care, Customers' Most-Loved Beauty, EltaMD, Sun Protection","B0DK9Y2PSJ"
"Tea Tree Special Shampoo + Tea Tree Special Conditioner, For All Hair Types, Bundle","Shampoo & Conditioner Sets, Shampoo & Conditioner, Tea Tree, Summer Sets & Kits, Premium Beauty Winter Finds","B0B9FQFMMN"
"wet n wild Mega Last Breakup Proof Eyeliner, Quick Drying, Waterproof, 16-Hour Wear - Cruelty-Free & Vegan - Black (Pack of 2)","Eyeliner","B0D14X1G7K"
"Anastasia Beverly Hills - Brow Wiz - Ash Brown","Eyebrow Color, Event Deals, Beauty New Arrivals, Holiday Makeup, Makeup, The Grande Cosmetics Store","B08QM8YLZ8"
"La Roche-Posay Acne Skin Care Set, Toleriane Double Repair Matte Moisturizer 75ml & Effaclar Medicated Gel Cleasner 100ml, Gel Moisturizer with Niacinamide & Acne Cleasner with Salicylic Acid","Washes, Face Care, Cleansers, Facial Skin Care Sample Credit, La Roche-Posay, Beauty New Arrivals, La Roche-Posay Sampling, Amazon.com: 15% off Professional Skin Care","B0C7F3P6VP"
"Olay Body Lotion Brightening for Women with Vitamin C, 24hr Moisturizing, Vitamin E & Vitamin B3 Complex, Fast Absorbing Formula, 17 fl oz","Lotions, Mom's spa night","B0D7XWT4YS"
"Cuticle Trimmer with Cuticle Pusher and Cutter-YINYIN Cuticle Cutter Cuticle Nipper Professional Stainless Steel Cuticle Clippers Durable Pedicure Manicure Tools for Fingernails and Toenails (Pink)","Cuticle Nippers","B091TX6KJ2"
"Morovan Professional Natural Nail Prep Dehydrate and Acid-Free Primer, Dehydrator for Acrylic and Gel Nail Polish, Non Acid Primer for UV Gels Fast Dry Superior Bonding Agent Gift Box Set","Base Coat","B084P2F223"
"BEAKEY Professional Makeup Brush Set, Ultimate Glamour Make up Brushes for Eye and Face, Foundation, Eyeshadow, Eye Shadow, Concealer, with 2 Blender Sponge for Flawless Application","Brush Sets","B0D2NVS69R"
"PanOxyl Acne Treatment Bar with 10% Benzoyl Peroxide, Maximum Strength Bar Soap for Face, Chest and Back, Benzoyl Peroxide Soap Body Wash, Vegan, For Acne Prone Skin, 4 oz","Bars, Face Care, Customers' Most-Loved: Beauty, Most-loved beauty deals, Customers' Most-Loved Beauty","B09SQFPLC9"
"Q-tips Cotton Swabs For Hygiene and Beauty Care Original Cotton Swab Made With 100% Cotton 500 Count & DenTek Triple Clean Advanced Clean Floss Picks, No Break & No Shred Floss, 150 Count","Cotton Swabs","B0CSD1L2ZM"
"EcoTools XL Makeup Brush + Sponge Shampoo, Removes Makeup, Dirt, & Impurities From Makeup Brushes & Makeup Blending Sponges, Fragrance-Free, Vegan, & Cruelty-Free 16 fl. oz./473 ml, 1 Count","Brush Cleaners, Event Deals","B0D1S4WCZL"
"Selsun Blue Medicated Antidandruff Shampoo, Maximum Strength Scalp Treatment With Selenium Sulfide, 11 fl. oz.","Shampoos, Customers' Most-Loved Beauty_Temp","B001UGL84U"
"Victoria's Secret Lavender and Vanilla Body Mist for Women, 250 ml / 8.4 oz","Body Sprays","B09V1QBVML"
"BEAKEY Makeup Sponge Set, Foundation Blending Sponge, Beauty Sponges Flawless for Liquid, Cream, and Powder, Latex Free and Vegan Boun Boun Sponges, Makeup Sponges 5 Pcs blue","Blenders & Sponges","B0B9K3Q1D7"
"RASASI Hawas Ice EDP 100ML (3.4 OZ) | Long Lasting, Exquisite, Luxurious, Arabian Scents. (PACK OF 3)","Eau de Parfum","B0DWCQWPQW"
"Bundle of La Roche-Posay Pure 10% Vitamin C Serum + La Roche-Posay Hyalu B5 Pure Hyaluronic Acid Serum for Face, Hydrating Serums to Visibly Plump Skin, Sensitive Skin Safe, Anti Aging, Oil-Free","Serums, Oils & Serums, Facial Skin Care Sample Credit, La Roche-Posay, La Roche-Posay Sampling, Amazon.com: 15% off Professional Skin Care","B0B156Z9CB"
"Vanicream Gentle Body Wash -12 fl oz & Sarna Sensitive Anti-Itch Lotion for Dry Skin - 7.5 Fl Oz Bundle","Body Washes, Mom's spa night, Body Lotions and Skin Care Sample Credit","B0D3CZGBY2"
"Cremo Palo Santo Shave Cream, Astonishingly Superior Ultra-Slick Shaving Cream for Men, Fights Nicks, Cuts and Razor Burn, 6 Fl Oz","Shaving Creams, Deodorants & Shave","B08S5XQGYG"
"GAOY Gel Top Coat, Builder Gel and Base Coat Set, 3 Pcs 16ml Clear Glossy No Wipe Combination for UV Light Cure Gel Nail Polish","Nail Polish","B0CHY85NZV"
"BRIOTECH Topical Skin Spray, Hypochlorous Acid Spray for Body & Face, Eyelid Cleanser, HOCl Facial Mist, Support Against Irritation, Calm Redness, Soothe Foot & Scalp, 8 fl oz ea, 2 ct","Face Mists, Face Care","B0C1H57PD8"
"Amazon Basics Exfoliating Cotton Round, 600 Count (6 Packs of 100) (Previously Solimo)","Cotton Pads & Rounds, Event Deals","B0943Y3QY7"
"Deodorant Balm for Men & Women Scented Vanilla Cupcake with Fragrance & Essential Oils, Protect Your Skin, 6oz Container, Made in USA","Moisturizers, Categories, Beauty & Grooming, Lotions & Moisturizers, Prime-eligible products","B0DLCMQKQ6"
"ChapStick Original Lip Care Bundle – Moisturizer 2-in-1 Lipcare SPF 15 with Aloe and Vitamin E + Classic Lip Balm, 0.15 Oz Ea (2 Piece Set)","Balms & Moisturizers","B0D84J9K3N"
"Philips Norelco OneBlade 360 with Connectivity Hybrid Face, Electric Beard Trimmer, Shaver with 360 Blade Tech & 1hr Fast Charge, 1x360 Blade, & 5-in-1 Comb, QP4530/90","Beard & Mustache Trimmers, Deodorants & Shave","B0D5HWHL6X"
"Dr Teal's Foaming Bath with Pure Epsom Salt, Sleep Blend with Melatonin, Lavender & Chamomile Essential Oils, 34 fl oz (Pack of 2) (Packaging May Vary)","Bubble Bath, Mom's spa night","B0CK4ZX5K3"
"Vtopmart 4 Pack Clear Stackable Storage Drawers, 4.4'' Tall Acrylic Bathroom Makeup Organizer,Plastic Storage Bins For Vanity, Undersink, Kitchen Cabinets, Pantry, Home Organization","Cosmetic Display Cases, Cabinets & Shelves, Kitchen & Dining Features","B09ZKYQMVD"
"VEET 5 Min Sensitive Skin Hair Removal Cream For Women, Painless Bikini Hair Removal Gel Kit, Dermatologically Tested For Body & Intimate Areas, 27.04 Fl Oz Total, Pack of 2","Depilatories, Deodorants & Shave","B08ZYYKDWB"
"Dr Teal's Body Wash with Pure Epsom Salt, Daytime/Nighttime with Vitamin C & Sleep Blend, 24 fl oz (Pack of 2)","Body Washes, Mom's spa night","B0D4R42L6N"
"Routine Wellness Anti-Thinning Shampoo and Conditioner Set for Thinning Hair - Biotin DHT Blocker Women & Men - Color Safe Shampoo for Hair Loss & Healthier Growth - Orchid & Apricot 14oz (Pack of 2)","Shampoo & Conditioner Sets","B0DDRZKD56"
"Keracolor Color + Clenditioner 3-in-1 Color-Depositing Conditioner, Gently Cleanses & Conditions, Semi-Permanent Lemon Hair Color, 12 Fl Oz","Hair Color, Hair Coloring, KeraColor, KERACOLOR","B08ZKWL2HN"
"Natural Amor Lavender Spa Gifts for Women,7pcs Self Care Box Including Soap Bar, Candle, Bath Butter","Sets & Kits, Categories, Beauty & Grooming, Prime-eligible products","B0C1HSS6J4"
"Speed Stick Men's Antiperspirant Deodorant, Irish Spring Scented, 3 Ounce, 4 Pack","Antiperspirant Deodorant, Deodorants & Shave","B0DGZHRWQC"
"Blistex Medicated Lip Balm, 0.15 Ounce, 3 Count (Pack of 1) Prevent Dryness & Chappin & Summer's Eve Cleansing Cloths, Blissful Escape, 16 Count","Balms & Moisturizers","B0CW2WSP3S"
"Advanced Clinicals Retinol Body Lotion + Manuka Honey Cream 2pc Set | Moisturizer Face Lotion & Body Cream | Crepey Skin Care Treatment | Retinol Cream Targets Look Of Crepe Skin & Sagging Skin, 2pc","Creams","B0CS4B58SM"
"Gillette Fusion5 Mens Razor Blade Refills, Lubrastrip for a More Comfortable Shave, 12 Count","Cartridges, Deodorants & Shave","B0BZYQHC6Z"
"RoC Retinol Correxion Under Eye Daily Wrinkle Cream, 0.5 oz (Packaging May Vary) Retinol Correxion Deep Wrinkle Retinol Face Serum with Ascorbic Acid, 1 Ounce Bundle (Packaging May Vary)","Creams","B0D47SB8ZP"
"TIRTIR Milk Skin Rice Toner | Deep Moisturizing, Hydrating Toner for face, Niacinamide, Ceramide, Rice Bran Extract, Nature-Oriented Ingredients for Korean Skin Care, Vegan, 0.67 Fl Oz","Toners & Astringents, Face Care","B0D1FTP6D4"
"Amazon Basics Antibacterial Liquid Hand Soap Refill, Light Moisturizing, Triclosan-Free, Citrus, 50 Fl Oz (Pack of 2) (Previously Solimo)","Hand Wash","B09HHBZXB7"
"SOL DE JANEIRO Jet Set","Sets & Kits, Cleansers, Sets, SOL DE JANEIRO","B0BZWYR5ZV"
"BYOMA Hydrating Milky Toner - Dewy, Ultra Hydrating Toner for Face - Soothes Skin, Locks in Moisture, Reduces Redness - Barrier Repair - 5.07 fl oz","Toners & Astringents, Face Care","B0CSDWS3HJ"
"d'alba Piedmont Italian White Truffle First Spray Serum, Vegan Skin Care, Hydrating Face Moisturizer, Glow Serum for Radiant Skin, Non Comedogenic, All In One Mist, Korean Skin Care (1.69 fl oz.)","Face Mists, Face Care","B0C5T25JJP"
"Jergens Natural Glow Gradual Glow, Daily Moisturizer +Firming and Face Moisturizer with SPF 20, Fair to Medium","Lotions, Mom's spa night","B0C2WJP6Z5"
"J.R. Watkins Foaming Hand Soap with Pump Dispenser, Moisturizing Foam Hand Wash, All Natural, Alcohol-Free, Cruelty-Free, USA Made, Neroli & Thyme, 9 fl oz, 3 Pack","Hand Wash","B09ZJ2TKXZ"
"CeraVe Vitamin C Serum & Vitamin C Eye Cream Skin Care Set | Skin Brightening Serum with Hyaluronic Acid for Face & Under Eye Cream with Caffeine for Dark Circles and Puffiness","Serums","B0DH98FHZ2"
"Freeman Flirty Feet Coconut and Aloe Instant Peeling Foot Spray, Softening Foot Peel Mask Exfoliates & Removes Dead Skin, Moisturizes Dry Feet, Clean Ingredients, 4 fl.oz./ 118 ml Bottle (Pack of 2)","Foot Masks","B0D14WG9SP"
"Crave Naturals Glide Thru Detangling Hair Brush - Detangler Brush for Curly or Straight, Wet or Dry Hair - Gentle on Tangles Hairbrush and Comb - Ideal for Adults and Kids - 7.5x3-Inch, Blue Cheetah","Hair Brushes","B0B2WWQSM7"
"Fu Store Loofah Sponge Shower Loofahs 80g Bath Sponges Mesh Balls 4 Colors Body Scrubber Exfoliator Wash Back Scrubber Bathroom Men Women 4 Pack Scrubbers Cleaning Bathing Accessories, 80g Green Blue","Bath Sponges","B0D8PLLMFX"
"e.l.f. Clear Lash & Brow Mascara 2-Pack, Conditioning Clear Brow & Lash Gel For Grooming, Defining & Separating, Long-Lasting, Vegan & Cruelty-Free","Mascara, Shop Makeup, e.l.f.","B0BSP2J3BH"
"MAYBELLINE Super Stay 24 2-step Long Lasting Liquid Lipstick and Lip Balm, 910 Copper Glisten, 1 count","Lipstick, Lipstick, Lips1, Lipstick1","B091J22GZH"
"wet n wild Nail Polish Wild Shine, Clear Nail Protector, Nail Color (Pack of 2)","Nail Polish","B0CB6CSWM1"
"Wet Brush Mini Detangler Hair Brush, Elemental Blue - Detangling Travel Hair Brush - Ultra-Soft IntelliFlex Bristles Glide Through Tangles with Ease - Pain-Free - All Hair Types (Pack of 2)","Hair Brushes","B0DJ1JCH14"
"DRMTLGY Luminous Eye Corrector SPF 41, Under Eye Color Corrector for Dark Circles, Anti-Aging Tinted Eye Cream, Hydrating Eye Serum with Peach Undertone, Medium","Creams","B0CRXHWR48"
"e.l.f. SKIN Holy Hydration! Makeup Melting Cleansing Balm JUMBO, Face Cleanser & Makeup Remover, Infused with Hyaluronic Acid to Hydrate Skin, 3.5 Oz","Washes, Face Care, Shop New Arrivals, Summer Beauty, e.l.f.","B0CX35NT6Y"
"CoverGirl & Olay Simply Ageless 3-in-1 Liquid Foundation, Matte Finish, Hyaluronic & Vitamin C Formula, Cruelty Free, Toasted Almond, 1 Count","Foundation, Foundation & Concealer, Foundation & Concealers","B07JPCJH7V"
"JODSONE 100 Pieces Gel Nail Polish Multi-color, Inside Glitter Texture Smooth Glossy Layer Matte Layer Gel Nail Polish Set Starter Set","Nail Polish","B0BWN28LNQ"
"Dr Teal's Epsom Salt Magnesium Soak, Fragrance-Free, 4 lbs","Bath Salts, Mom's spa night, Customers' Most-Loved: Beauty, Most-loved beauty deals, Pre/Post Workout Beauty Essentials, Customers' Most-Loved Beauty","B07FL53JJ7"
"Dr.Althea 345 Relief Cream | Daily Face Moisturizer | Blemish Relief Care | Soothing Recovery & Moisture with Niacinamide, Panthenol | Korean Vegan Skin Care for All Skin Types | 1.7 Fl Oz (Pack of 2)","Face Moisturizers, Face Care","B0DNQC2D85"
"b.tan Clear Face Tan Mist | Gimme The Glow Down - Best Facial Tanner Spray, Gradual Bronzing Sunless Tanning Water, Infused with Rosewater, Vegan, Cruelty Free, 6.7 Fl Oz","Body Self-Tanners, Beauty Summer Sun Care, Sun Protection","B0BYQP5DS3"
"EHBELIF Dandruff Comb Upgraded Scalp Comb Psoriasis Comb Dandruff Removal Scalp Sweep Dandruff Comb Remover, Lice Comb Multifunctional Energy Massager Hair Comb for Scalp Massage Combs for Women Men","Hair Combs","B0DHZMBQQP"
"NYX PROFESSIONAL MAKEUP Marshmellow Setting Spray, Matte Setting Spray for 16HR Make Up Wear","Face Mists, Face Care, Foundation & Concealer, Foundation & Concealers","B0CM75CG2V"
"medicube Salmon DNA PDRN pink collagen jelly gel mask | overnight face mask for glass glow skin- elasticity, hydrating, firming and moisturizing | korean skincare, 28g, 4ea","Masks","B0DGTMR754"
"Dove Damage Therapy Derma Shampoo Dryness + Itch Pack of 6 for Flaky Scalp with Pyrithione Zinc and Coconut Oil 12 Fl Oz","Shampoos","B0BBJV86PW"
"RoC Multi Correxion Revive + Glow Vitamin C Broad Spectrum SPF 30 Moisturizer (1.7 oz) with Retinol Eye Cream Packette","Creams","B0CC6PL4PS"
"Cilrofelr Peel Off Lip Liner Stain, Long Wear Tattoo Lip Liner with Tweezer, Peel Off Lip Stain with Matte Finish, Long Lasting, Waterproof, Transfer-proof, Highly Pigmented Color (Mauve)","Lip Liners, Stains","B0CHJ8YL6G"
"Wavytalk Professional Hair Dryer with Diffuser 1875W Power Dryer, Blow Dryer Ionic Hair Dryer for Women with Constant Temperature, Fast Drying &Low Noise, Millennial Pink","Hair Dryers","B0C33RTVJG"
"EACHY Travel Makeup Bag,Large Capacity Cosmetic Bags for Women,Waterproof Portable Pouch Open Flat Toiletry Bag Make up Organizer with Divider and Handle (LB-Pink, Large)","Cosmetic Bags","B0C7MLGDXW"
"COLOR WOW Raise the Root Thicken + Lift Spray, 1.7 fl oz – All-Day Volume for Fine, Flat Hair without Dulling Color","Hair Sprays, COLOR WOW, Cleansers, Hair Sprays, COLOR WOW","B0CBQRSGYP"
"Metene 2 Pack Shower Brush with Soft and Stiff Bristles, Bath Dual-Sided Long Handle Back Scrubber Body Exfoliator for Wet or Dry Brushing","Bath & Body Brushes","B0B1TPBNSY"
"Head & Shoulders Itchy Scalp Care Dandruff Shampoo, Anti-Dandruff Treatment, Infused with Eucalyptus, 32.1 Fl Oz Each, Twin Pack","Shampoos","B0C4Z8FLS5"
"Kerasal Nighttime Intensive Foot Repair, Skin Healing Ointment for Cracked Heels and Dry Feet, 1 oz","Foot Creams & Lotions","B09S3YSJ1W"
"PEAUAMIE Under Eye Patchs Hyaluronic Acid Eye Mask for Dark Circles and Puffiness Wrinkle Eye Bags 30 Pairs","Masks","B0C1MJCK2M"
