"Title","Categories: Sub","ASIN"
"Clean Skin Club Clean Towels XL™ Supreme, 100% USDA Biobased Face Towel, Disposable Face Towelette, Eczema Association Accepted, Makeup Remover Dry Wipes, Ultra Soft, 50 Ct, 1 Pack","Cloths & Towelettes, Face Care, Make Up Removers","B0CH1RSQHY"
"eos 24H Moisture Travel Body Lotion- Vanilla Cashmere, Travel Size Essential, Toiletries, Mini Body Lotion, 2.5 fl oz","Lotions, Mom's spa night, Must-have winter beauty under $20","B0CPCYP629"
"EOS Shea Better Holiday Body Lotion- Whipped Shea & Sugar, Limited-Edition Skincare, 24-Hour Moisture, Vegan, 16 fl oz","Lotions, Mom's spa night","B0CR2WBFGY"
"EOS Shea Better Holiday Body Lotion- Sparkling Amber, Limited-Edition Skincare, 24-Hour Moisture, Vegan, 16 fl oz","Lotions, Mom's spa night","B0CR2Z7CTF"
"Amazon Basics Cotton Swabs, 500 Count","Cotton Swabs, Shop Makeup","B09541P9WH"
"BIODANCE Bio-Collagen Real Deep Mask, Hydrating Overnight Hydrogel Mask, Pore Minimizing, Elasticity Improvement, 34g x16ea","Masks","B0B879FZBZ"
"Amazon Basics Hypoallergenic 100% Cotton Rounds, 600 Count (6 Packs of 100)","Cotton Pads & Rounds, Event Deals, Shop Makeup","B0949CSB9X"
"Medicube Zero Pore Pads 2.0, Dual-Textured Facial Toner Pads for Exfoliation and Pore Care with 4.5% AHA Lactic Acid & 0.45% BHA Salicylic Acid, Ideal for All Skin Types, Korean Skin Care (70 Pads)","Toners & Astringents, Face Care","B09V7Z4TJG"
"Nizoral Anti-Dandruff Shampoo, 7 Oz + Deep Moisturizing Conditioner, 9.4 Oz Bundle","Shampoo & Conditioner Sets, Shop Hair Care","B0B5Y3V2B4"
"PanOxyl Acne Foaming Wash Benzoyl Peroxide 10% Maximum Strength Antimicrobial, 5.5 Oz (Pack of 2)","Washes, Face Care, Event Deals","B0D9NVPCFS"
"Maybelline Lash Sensational Sky High Washable Mascara Makeup, Volumizing, Lengthening, Defining, Curling, Multiplying, Buildable Formula, True Brown, 1 Count","Mascara","B09VCXH9GF"
"essence | Lash Princess False Lash Effect Mascara Brown (3 Pack) | Intense Volume, Length & Definition | Vegan, Cruelty Free & Paraben Free","Mascara","B0CP8C1WXF"
"La Roche-Posay Toleraine Skin Care Set, Double Repair Face Moisturizer 100ml & Hydrating Gentle Cleanser 50ml, Oil Free Moisturizer & Face Wash","Face Moisturizers, Face Care, Creams & Moisturizers, Facial Skin Care Sample Credit, La Roche-Posay, Beauty New Arrivals, Summer Sets & Kits, New Year Beauty, Cleansers, Face Moisturizers, New Arrivals, New Year Beauty, La Roche-Posay Sampling, Amazon.com: 15% off Professional Skin Care","B0BX21T44J"
"Q-tips Cotton Swabs for Hygiene and Beauty Care Original Cotton Swab Made with 100% Cotton 750 Count (Pack of 3)","Cotton Swabs","B0BPLQ9XZH"
"The Ordinary Glycolic Acid 7% Exfoliating Toner, Brightening and Smoothing Daily Toner for More Even-Looking Skin Tone, 3.4 Fl Oz (Pack of 2)","Toners & Astringents, Face Care, The Ordinary, New to Premium Skin Care: The Ordinary","B0DNN5WPBX"
"CeraVe Moisturizing Cream, Face Body Moisturizer, Normal to Dry Skin, 8 Fl Oz","Face Moisturizers, Face Care, Customers' Most-Loved: Beauty, Most-loved beauty deals, Customers' Most-Loved Beauty, moisturize","B087GNBPXT"
"Wonderskin Wonder Blading Lip Stain Super Set - Long Lasting Pink Tint With Clear Top Gloss, Lip Exfoliator Scrub & Makeup Remover (Romance)","Lip Stains","B0CG6CHD3J"
"medicube Collagen Overnight Wrapping Peel Off Facial Mask Pack - Elasticity & Hydration Care, Reduces Sagging & Dullness - Hydrolyzed Collagen For Glowing Skin - Korean Skin Care, 2.53 fl.oz","Masks","B0BRMYHMS5"
"Dove Body Wash with Pump with Skin Natural Nourishers Instantly Soft Skin and Lasting Nourishment Deep Moisture Cleanser Effectively Washes Away Bacteria While Nourishing Your Skin 34 oz (Pack of 3)","Body Washes, Mom's spa night","B09XBYL9WY"
"YANIBEST Silk Bonnet for Sleeping Women Satin Bonnet Double Layer Satin Lined Hair Bonnet with Tie Band Curly Hair Yellow","Hair Care","B0BLXLHVCY"
"Sacheu Lip Liner Stay-N - Peel Off Lip Liner Tattoo, Peel Off Lip Stain, Long Lasting Lip Stain Peel Off, Infused with Hyaluronic Acid & Vitamin E, MUAH-ve","Lip Liners, Stains, Lips1, Lipstick1","B0BVNW2SKP"
"MRS. MEYER'S CLEAN DAY Hand Soap, Made with Essential Oils, Rhubarb 12.5 Fl Oz (Pack of 6)","Hand Wash","B0BX73TBJ3"
"e.l.f. Instant Lift Brow Pencil, Dual-Ended Precision Brow Pencils For Shaping & Defining Eyebrows, Vegan & Cruelty-Free, Neutral Brown, 2-Pack","Eyebrow Color, Valentine's Day Beauty, New Year Beauty, e.l.f., The Grande Cosmetics Store","B0B52KG7YP"
"VALITIC Kojic Acid Dark Spot Remover Soap Bar with Vitamin C,Retinol,Collagen,Turmeric - Original Japanese Complex Hyaluronic Acid,E,Shea Butter,Castile Oil (2 Pack) With Holder,Pack of 3,3.5 ounces","Soaps, Mom's spa night","B0BC23BHY6"
"The Ordinary Hyaluronic Acid 2% + B5, Multi-Depth Hydration Serum for Plumper, Smoother Skin, 1 Fl Oz (Pack of 2)","Serums, The Ordinary, New to Premium Skin Care: The Ordinary","B0DN6NG52J"
"e.l.f. Glow Reviver Lip Oil, Nourishing Tinted Lip Oil For A High-shine Finish, Infused With Jojoba Oil, Vegan & Cruelty-free, Money Mauve","Lip Glosses, Glosses, e.l.f., Allure Best of Beauty","B0DFMW6VZV"
"Amazon Basics Epsom Salt Soak, Magnesium Sulfate USP, 3 Pound, 1-Pack","Bath Salts, Mom's spa night, Customers' Most-Loved: Beauty, Most-loved beauty deals, Customers' Most-Loved Beauty","B0BXTS6L35"
"Handmade Tallow Balm (Unscented)- 100% Grass Fed Beef Tallow for Skin Care- 100% Natural Whipped Tallow Balm- Sensitive & Dry Skin, Eczema, Psoriasis- 2 FL. oz","Creams & Moisturizers, Categories, Face Care, Beauty & Grooming, Lotions & Moisturizers, Prime-eligible products","B0CWZ6Z2K8"
"SOL DE JANEIRO Cheirosa '68 Hair & Body Fragrance Mist Travel Size 90mL/3.0 fl oz.","Body Sprays, Beauty Best Sellers, Pre/Post Workout Beauty Essentials, Cleansers, Home Scents, Candles, Body Sprays, Essential Oils, SOL DE JANEIRO, Premium Beauty Best Sellers","B0B1HB719V"
"Maybelline Instant Age Rewind Instant Eraser Color Correcting Concealer, Crease-Resistant Coverage, Up to 12HR Moisturizing Wear, Orange Color Corrector, 159, 1 Count","Concealers & Neutralizers, Foundation & Concealer, Foundation & Concealers","B0DN292R8C"
"grace & stella Under Eye Patches - Gifts for Her (12 Pairs) Birthday Gifts for Women - Eye Patches for Puffy Eyes and Dark Circles - Vegan Eye Mask, Bachelorette Party Favors, Self Care","Wrinkle Pads & Patches, Week 2 Deals","B0CYCFRZKD"
"Julep Eyeshadow 101 Crème-to-Powder Waterproof Eyeshadow Stick – Lilac Matte – Long-Lasting, Crease-Proof, Light Lavender Matte Cream Eyeshadow with Built-in Smudger","Eyeshadow","B0CF65YCN8"
"L3 Level 3 Styling Powder - Natural Look Mens Powder - Easy to Apply with No Oil or Greasy Residue (Small - 30 Grams)","Root Lifting Powders, All Dolled Up, Fall Trends, Premium Fall Finds, L3","B08SNSSTPZ"
"e.l.f. Monochromatic Multi Stick, Luxuriously Creamy & Blendable Color, For Eyes, Lips & Cheeks, Luminous Berry, 0.17 Oz (5g)","Blush, e.l.f.","B07MWSB1Z9"
"SimplyVital Collagen, Retinol & Hyaluronic Acid Cream - Anti-Aging Face Moisturizer for Face, Neck & Décolleté - Made in USA, Daily Moisturizer Face Cream - 1.7 fl.oz.","Neck & Décolleté, Climate Pledge Friendly | Beauty & Personal Care, Face Care","B0BBSP2JNQ"
"MAYBELLINE New York Super Stay Matte Ink Liquid Lipstick, Transfer-Proof, Long-Lasting, Limited-Edition Birthday-Cake-Scented Shades, Guest of Honor, 0.17 Fl Oz","Lipstick, Lipstick, Lips1, Lipstick1","B09J65Z4KQ"
"La Roche-Posay Lipikar Daily Repair Moisturizing Lotion Full Size & Travel Size Skin Care Set, Body Lotion for Dry Skin & Eczema, With Niacinamide & Shea Butter for All Day Hydration, Gift Set","Lotions, Mom's spa night, Moisturizers, La Roche-Posay, Beauty New Arrivals, Summer Sets & Kits, Body Lotions and Skin Care Sample Credit, New Year Beauty, Cleansers, Lotions, New Arrivals, New Year Beauty, La Roche-Posay Sampling, Amazon.com: 15% off Professional Skin Care","B0BVSVWCS8"
"Native Deodorant Contains Naturally Derived Ingredients, 72 Hour Odor Control | Deodorant for Women and Men, Aluminum Free with Baking Soda, Coconut Oil and Shea Butter | Coconut & Vanilla, 2-Pack","Deodorant, Deodorants & Shave","B09VCQ1M7X"
"Burt's Bees Valentines Day Gifts Ideas - Just Picked Lip Balm Set, Pomegranate, Watermelon, Sweet Mandarin, Coconut & Pear, Natural Origin Lip Treatment, 4 Tubes, 0.15 oz.","Balms & Moisturizers, 2022 Gifting Page PC- MKD","B0B917MNM1"
"La Roche-Posay Toleriane Purifying Foaming Facial Cleanser, Niacinamide + Ceramides + Prebiotic Thermal Water, Oil Free Face Wash For Oily Skin, Pore Cleanser Safe For Sensitive Skin, Soap Free","Gels, Face Care, Cleansers, Facial Skin Care Sample Credit, La Roche-Posay, La Roche-Posay Sampling, Amazon.com: 15% off Professional Skin Care","B0D2Y9R8HN"
"Differin Acne Treatment Gel and Differin Patches Set: 36 Power Patches, 18 large and 18 small patches for acne-prone skin and A30 day retinoid treatment with 0.1% Adapalene, Mother's Day Gifts","Masks","B0CQZV2135"
"DOVE MEN + CARE Deodorant Stick for Men Aluminum Free 72-Hour Odor Protection Paradiso Sunrise 3 Count Mens Deodorant with Essential Oils & 1/4 Moisturizing Cream 3 oz","Deodorant, Deodorants & Shave","B0CDM4T5K9"
"La Roche-Posay Cicaplast Balm B5 UV SPF 50, Vitamin B5 + Shea Butter + Tribioma + Madecassoside + Zinc Oxide Sunscreen, Post Treatment Skin Protectant With SPF, Multi-Purpose Cream For Dry Skin","Creams, Moisturizers, La Roche-Posay, Body Lotions and Skin Care Sample Credit, La Roche-Posay Sampling, Amazon.com: 15% off Professional Skin Care","B0CZM9MCMK"
"Tree Hut Vanilla Shea Sugar Exfoliating & Hydrating Body Scrub, 18 oz","Scrubs & Body Treatments, Body Scrubs, Mom's spa night","B0BX2TZZWG"
"Ear and Nose Hair Trimmer Clipper - 2025 Professional Painless Eyebrow & Facial Hair Trimmer for Men Women,Battery-Operated Trimmer with IPX7 Waterproof,Dual Edge Blades for Easy Cleansing Black","Nose & Ear Hair Trimmers, Deodorants & Shave","B098NSHBQK"
"L’Oréal Paris Magic Root Cover Up Temporary Concealer Spray for Gray Hair, Bright Red, 2 Oz","Hair Mascaras & Root Touch Ups","B0BGSXPXSH"
"Amazon Basics Liquid Hand Soap Refill, Milk and Honey Scent, Triclosan-free, 50 Fluid Ounces, Pack of 1","Hand Wash","B09HHBV8CB"
"COLOR WOW Smooth + Shiny VIPs Kit","Styling Treatments, Shampoos, COLOR WOW, Cleansers, 2-in-1 Shampoo & Conditioner, Shampoos, COLOR WOW","B0DFYW27HL"
"Vanicream Daily Facial Moisturizer With Ceramides and Hyaluronic Acid - Formulated Without Common Irritants for Those with Sensitive Skin, 3 fl oz (Pack of 2)","Face Moisturizers, Face Care","B0D96W24CX"
"Amazon Basics Gentle & Mild Clear Liquid Hand Soap Refill, Triclosan-free, 50 Fluid Ounces, 1-Pack (Previously Solimo)","Hand Wash","B09HHDHXWX"
"La Roche-Posay Toleraine Skin Care Set, Double Repair Face Moisturizer 40ml & Hydrating Gentle Cleanser 400ml, Oil Free Moisturizer & Face Wash, Formulated with Niacinamide","Washes, Face Care, Cleansers, Facial Skin Care Sample Credit, La Roche-Posay, Beauty New Arrivals, New Year Beauty, Cleansers, Cleansers, New Arrivals, New Year Beauty, La Roche-Posay Sampling, Amazon.com: 15% off Professional Skin Care","B0BX1Z2VMW"
"eos 24H Moisture Super Balm- Birthday Cake, Lip Mask, Day or Night Lip Treatment, Made for Sensitive Skin, 0.35 fl oz, 2-Pack","Hand Creams & Lotions","B0CQS8KD7B"
"CeraVe AM Facial Moisturizing Lotion with SPF 30, Oil-Free Face Moisturizer with SPF, Formulated with Hyaluronic Acid, Niacinamide & Ceramides, Non-Comedogenic, Broad Spectrum Sunscreen, 3 Ounce","Face Moisturizers, Facial Sunscreens, Face Care, Shop CeraVe Same Day: Available in select metros, Beauty Summer Sun Care, Shop Skin Care, Summer Beauty, moisturize, Sun Protection","B00F97FHAW"
"BOLDIFY Hairline Powder (LARGE, 10g) - Root Touch Up Hair Color for Gray Coverage - Bald Spot Concealing Hair Powder for Women & Men - 48-Hour Stain-Proof - Medium Brown","Hair Mascaras & Root Touch Ups","B0B4KFZF72"
"Juicy Georgia Peach Delicious Natural Essential and Fragrance Oil Roll On with Organic Jojoba Oil, Small Batch, Made in California","Fragrance, Categories, Beauty & Grooming","B0CKGW2VTN"
"Amazon Basics Hydrating Makeup Remover Wipes, 50 wipes (Pack of 2)","Makeup Cleansing Wipes, Face Care, Event Deals, Make Up Removers","B0BR3RKF5M"
"Catrice | Under Eye Brightener | Conceal & Brighten Dark Circles | With Hyaluronic Acid & Shea Butter | Vegan, Cruelty Free & Paraben Free (010 | Light Rose)","Concealer, Customers' Most-Loved: Beauty, Most-loved beauty deals, Indie Beauty | Stocking stuffers under $20, Indie Beauty | Shop all, Must-have winter beauty under $20, Customers' Most-Loved Beauty","B09V1CPTR1"
"EltaMD UV Clear Face Sunscreen SPF 46, Oil Free for Face with Zinc Oxide, Dermatologist Recommended Sunscreen Lotion,1.7 oz Pump (Pack of 2)","Face, Facial Sunscreens, Beauty Summer Sun Care, Sun Protection","B0CTD8N6K6"
"L’Oréal Paris Original Voluminous Mascara Makeup Set, Includes Building Volume and Length Mascara and Infallible Eyeliner, Black, 1 Kit","Mascara, New Year Beauty","B09B2RBRRL"
"Harry's Razor Blades for Men - 10 Count - Premium Razor Blade Refill Cartridges","Cartridges, Deodorants & Shave, Shop Personal Care","B09SGK9FWZ"
"Good Molecules Yerba Mate Wake Up Eye Gel - Yerba Mate, Hyaluronic Acid and Caffeine to Hydrate, Minimize Puffiness and Swelling - Skincare for Face","Gels, Customers' Most-Loved: Beauty, Most-loved beauty deals, Customers' Most-Loved Beauty, New Year Beauty","B091NJQ29P"
"Locsanity Dreadlock Hair Scalp Detox - Deep Clean Dreadlock Powder, Cleansing Conditioner - Natural Hair Cleanser for Build Up - ACV Alternative, Loc Care and Maintenance Products","Hair Care, Categories, Beauty & Grooming, Southeast MFN - Jewelry, Zodiac Gifts, Zodiac: Gifts for Pisces, Southeast MFN - Kitchen, Florida, Southeast MFN, Southeast MFN - Beauty","B09RKK1WR8"
"Amazon Basics Cotton Balls, 200ct, 1-Pack (Previously Solimo)","Cotton Balls","B09497R2CN"
"LAURA GELLER NEW YORK Award-Winning Baked Balance-n-Brighten To Go Travel Size Color Correcting Powder Foundation - Deep - Buildable Light to Medium Coverage - Demi-Matte Natural","Foundation, Beauty and wellness Made in Italy, Fall Trends, Bare Faced, Foundation & Concealer, Foundation & Concealers","B0C3C1LCS8"
"Ancient Minerals Magnesium Bath Flakes of Pure Genuine Zechstein Chloride - Resealable Magnesium Supplement Bag That Will Outperform Leading Epsom Salts 1.65 lbs","Bath Salts, Customers' Most-Loved: Health, wellness, and more, Most-loved health & household deals, Mom's spa night","B005F1ATJQ"
"BeautifyBeauties Continuous Spray Bottle - Hair Spray Bottle Bundle with Comb, Markers - Plant Mister Spray Bottle for Plants, Water Spray Bottle Fine Mist Sprayer (Black 10.2)","Spray Bottles","B0D1RL32Y8"
"MRS. MEYER'S CLEAN DAY Hand Soap Refill, Made with Essential Oils, Biodegradable Formula, Compassion Flower, Packaging May Vary, 33 fl. oz","Hand Wash, Foot & Hand Care","B0CHN8YSFK"
"NYX PROFESSIONAL MAKEUP Butter Gloss Brown Sugar, Non-Sticky Lip Gloss - Caramelt (Medium Brown) (Pack of 2)","Lip Glosses, Glosses","B0BV694RPF"
"Salt & Stone Natural Deodorant Trio for Women & Men | Extra Strength Natural Deodorant | Aluminum Free with Probiotics, Seaweed Extracts & Shea Butter (2.6 oz)","Deodorant, Deodorants & Shave, Beauty New Arrivals, Cleansers, Deodorants & Antiperspirants, Body Butter, Salt & Stone","B0BLCRSSZR"
"Comfrey Salve Herbal Balm Skin Body Care Ointment 2 oz","Lip Care, Categories, Beauty & Grooming, Prime-eligible products","B09V96VJ3Y"
"Burt's Bees Lip Balm Valentines Day Gifts, Berry Agua Fresca, Dragonfruit Lemon, Coconut & Pear, Tropical Pineapple, Responsibly Sourced Beeswax, Tint-Free, Natural Lip Treatment, 4 Tubes, 0.15 oz.","Balms & Moisturizers, Most-loved beauty deals, Customers' Most-Loved Beauty","B0B32SHWKY"
"e.l.f. Power Grip Primer Mini, Gel-Based & Hydrating Face Primer For Smoothing Skin & Gripping Makeup, Moisturizes & Primes","Foundation Primers, e.l.f., Foundation & Concealer, Foundation & Concealers","B0CCYRX6X3"
"Garnier Back to School Bundle|Micellar Water (400mL) + Fructis Sleek & Shine Shampoo (22 Fl Oz), Conditioner (21 Fl Oz) (3 Items), 1 Kit (Packaging May Vary)","Shampoo & Conditioner Sets, Face Care, Facial Skin Care Sample Credit","B0C5K5RG3N"
"Grande Cosmetics GrandeLASH-MD Lash Enhancing Serum, 1 ml - 6-week starter supply","Eyelash Primers, Beauty Best Sellers, Shop Makeup, Eye Makeup Sample Credit, Grande Cosmetics, Summer Beauty, Winter Beauty Favorites, Shop Premium Beauty, New Year Beauty, Cleansers, Eyes, Eyes, Premium Beauty Best Sellers, New Year Beauty","B082WZTJV5"
"COLOR WOW Xtra Large Bombshell Volumizer, 6.5 fl oz – New Alcohol-Free Technology for Lasting Volume and Thickness","Mousses, Beauty Best Sellers, Shop Hair Care, Allure Best of Beauty Summer Picks, COLOR WOW, Fall Trends, 90's Grunge, Summer Beauty, Pre/Post Workout Beauty Essentials, Premium Beauty Winter Finds, Shop Premium Beauty, Cleansers, Hair Sprays, COLOR WOW, Premium Beauty Best Sellers","B094PCH9ZZ"
"Degree Men UltraClear Antiperspirant Deodorant Black + White 4 count 72-Hour Sweat & Men Antiperspirant Deodorant Adventure 4 Count For Freshness and Odor Protection","Antiperspirants","B0CW2Z9LST"
"Lume Whole Body Deodorant - Smooth Solid Stick - 72 Hour Odor Control - Aluminum Free, Baking Soda Free and Skin Loving - 2.6 Ounce (Pack of 3) (Unscented)","Deodorant, Deodorants & Shave, Holiday Beauty Haul Coupons, HBH24Couponhub","B0CQ6NLMDP"
"Anua Heartleaf Pore Control Cleansing Oil, Oil Cleanser for Face, Makeup Blackhead Remover, Korean Skin Care 6.76 fl oz(200ml) (original)","Makeup Cleansing Oils, Make Up Removers","B0BN2PX8V3"
"LANEIGE Lip Glowy Balm Blueberry: Hydrate, Glossy, Lightweight, Moisturize & Tint with Shea Butter","Balms & Moisturizers, Cleansers, Lip Balms, LANEIGE","B0CZYL4GP2"
"e.l.f. Hydrating Camo Concealer, Covers Blemishes & Under-Eye Circles, Full-Coverage & Delivers A Satin Finish, Vegan & Cruelty-Free, Rich Walnut","Concealer, e.l.f., Foundation & Concealer, Foundation & Concealers","B0985RLB2P"
"KISS Clear Strip Lash Adhesive With Aloe, Waterproof, Formaldehyde and Latex Free, Odor Free, Cruelty Free, Super Strong Hold Eyelash Glue with Brush Applicator, 0.17 Oz.","Eyelash Adhesives, Customers' Most-Loved Beauty v2, Customers' Most-Loved Beauty_Temp, Tools & Accessories, 2022 Gifting Page Beauty - MKD, 03_22_2023","B01BMMOAFU"
"Beetles Gel Nail Polish 1 Pcs 15ml Neutral Gel Nail Polish Pink Nail Polish Nude Gel Polish Pink Gel Nail Polish Soak Off Uv Nail Lamp Gel Polish Nail Art Manicure Salon DIY Home Nude Gel Polish 0.5Oz","Nail Polish","B0C4YSBP1P"
"ANUA Heartleaf Quercetinol Pore Deep Cleansing Foam, Facial Cleanser, for Double Cleansing, BHA, Hyaluronic Acid, Glycerin, Face Wash, Blackhead Remover, Korean Skincare (150ml/5.07 fl.oz.)","Washes, Face Care, Customers' Most-Loved: Beauty, Most-loved beauty deals, Customers' Most-Loved Beauty","B0BVV8BNYJ"
"L’Oréal Paris Makeup True Match Lumi Glotion, Natural Glow Enhancer, Illuminator Highlighter, Bronzing Drops For a Sun-Kissed Glow, 905 Rich","Highlighters & Luminizers, Customers' Most-Loved Beauty v2","B0CVCY8YYG"
"LANEIGE Lip Sleeping Mask Gummy Bear: Nourish, Hydrate, Vitamin C, Murumuru & Shea Butter, Antioxidants, Flaky, Dry Lips","Balms & Moisturizers, Easter Beauty, Shop Premium Beauty, Cleansers, Lip Balms, LANEIGE, LANEIGE Bestsellers","B09HN5CMBX"
"Wet Brush Original Detangler Hair Brush, Lime-A-Rita (Summer Quencher) - Ultra-Soft IntelliFlex Bristles - Detangling Brush Glides Through Tangles For All Hair Types (Wet Dry & Damaged) - Women & Men","Hair Brushes, Must-have winter beauty under $20","B0DMZYV475"
"Gold Bond Healing Cream Gift Pack, For Body, Hand & Foot","Sets & Kits","B0DH5NZFLQ"
"Samnyte Hair Wax Stick, Styling Cream for Slick Back Hair, Fly Away Hair Tamer, and Gel Stick Hair Accessory for Women & Kids","Waxes","B0CR3SP35D"
"Amazon Basics Petroleum Jelly White Petrolatum Skin Protectant, Unscented, 3.75 Ounce (Pack of 4) (Previously Solimo)","Moisturizers, Event Deals","B09HHDDZWS"
"Glamnetic Press On Nails - Purple Power | Glossy, Semi-Transparent Medium Almond Nails, Reusable | 15 Sizes - 30 Nail Kit with Glue","Press On Nails","B0B6LDPZ7P"
"Vanicream Moisturizing Cream with Pump (16 Oz), Gentle Body Wash (12 Oz) & Gentle Facial Cleanser with Pump Dispenser, (8 Oz)","Creams, Face Care, Facial Skin Care Sample Credit, Body Lotions and Skin Care Sample Credit","B09K48CKK2"
"Turmeric and Kojic Skin Brightening Soap All Natural Gentle Cleanser for All Skin Types. Fights Acne, Reduces Dark Spots & Fades Scars. Face & Body Cleanser for Men, Women & Teens. (3 Pack)","Body, Categories, Beauty & Grooming, Prime-eligible products","B0BP9ZKDJL"
"Kitsch Dermaplaning Tool - Face Razors for Women and Men, Eyebrow Trimmer and Face Shaver, Facial Hair Removal, Facial Razors for Women and Men, Dermaplane Razor - 12pc, Coral","Disposable Razors, Disposable Razors, Deodorants & Shave, Holiday Beauty Haul Coupons, HBH24Couponhub","B0C92YTQ27"
"Dr. Dave's Primal Essence Extra Strength Tallow Deodorant - Aluminum-Free with Baking Soda, Beeswax, Coconut Oil and Mango Butter - Sweet Orange and Bergamot","Deodorants & Antiperspirants, Categories, Beauty & Grooming","B0CLHSGG49"
"Dove Soap Original 4.75 Ounce / 135g, 4.75 Fl Ounce","Soaps, Mom's spa night","B004KY2XR0"
"NYX PROFESSIONAL MAKEUP Micro Brow Pencil, Precise Eyebrow Pencil - Ash Blonde","Eyebrow Color, The Grande Cosmetics Store","B09XGYKHDB"
"Amazon Basics Liquid Hand Soap Refill, Mango and Coconut Water Scent, Triclosan-Free, 50 Fl Oz (Pack of 1) (Previously Solimo)","Hand Wash, BPC 07/23 Reset New","B09HH95J2Z"
"Botanic Hearth Argan Hair Oil for Adult Hydration, Nourishing, Strengthening, Curly, Frizzy, Dry, Damaged Hair, Non-GMO Verified, 4 fl oz, 1 Count","Hair Treatment Oils, Week 1 Deals, Self Care","B0C6XVNS55"
"Aquaphor Lip Repair Lip Balm Set for Chapped Lips, Lip Repair Balm, 0.35 Oz Tube (Pack of 2) + Lip Repair Stick, 0.17 Oz (Pack of 2) + Lip Protectant Plus Sunscreen Lip Balm SPF 30, 0.35 Oz Tube","Balms & Moisturizers","B0D3RTNNGD"
"Swisspers Premium Cotton Rounds – 100 Count (Pack of 3) - 100% Pure Cotton - Soft, Absorbent, Hypoallergenic Pads for Makeup Removal, Skincare, Baby Care and Facial Cleansing - Lint Free","Cotton Pads & Rounds","B091D7T4N8"
"Safety Razor Head Protecting Leather Cover, Genuine Cowhide Leather Double Edge Safety Razor Case Accessories for Travel, Butterfly Razor Case (Vintage Brown)","Shaving Accessories, Categories, Deodorants & Shave, Beauty & Grooming","B0B3NCXNR5"
"38 Colors Available, Big Scrunchies for Hair, Soft Cheer Chiffon large Ponytail Holder, Cute Birthday Gift for Women Girl Teen, Holiday Accessory (Light Peach Pink)","Hair Accessories, Categories, Beauty & Grooming, Valentine's Day Gifts","B0BMXGBDMQ"
"Aveeno Daily Moisturizing Body Lotion with Soothing Prebiotic Oat, Gentle Lotion Nourishes Dry Skin With Moisture, Paraben-, Dye- & Fragrance-Free, Non-Greasy & Non-Comedogenic, 18 oz, 2 Pack","Lotions, Mom's spa night","B0BLY1CWJ4"
"Pawotence Lash Clusters 280pcs Cluster Eyelash Extensions 40D 50D Eyelash Clusters Lash Extension 8-16mm Individual Lashes for Self Application at Home (40D&50D, 0.07D, 8-16mm)","False Lashes","B0CBPGYRXR"
"Philips Norelco Multigroom 3000 Series, All-in-One Trimmer, Beard Trimmer and Hair Clipper, 15-Piece Men's Grooming Kit for Head, Beard, Face, Nose, Ears, No Blade Oil Needed, Soft Pouch, MG3770/40","Beard & Mustache Trimmers, Deodorants & Shave","B0D5K1SBSH"
"L'Oreal Paris Makeup Voluminous Lash Paradise Mascara, Voluptuous Volume, Intense Length, Feathery Soft Full Lashes, No Flaking, Smudging or Clumping, Latte Brown, 0.28 Fl Oz","Mascara","B0CYCN7FY1"
"e.l.f. Cream Glide Lip Liner, Highly-Pigmented Pencil For Shaping & Sculpting Lips, Semi-Matte Finish, Vegan & Cruelty-Free, Pinky Swear","Lip Liners, Stains, e.l.f.","B0CMZ522JQ"
"Native Shampoo and Conditioner Contain Naturally Derived Ingredients| All Hair Type Color & Treated, Fine to Dry Damaged, Sulfate & Dye Free - Warm Cider & Cinnamon, 16.5 fl oz each (2 pack)","Shampoo & Conditioner Sets","B0D4B46KNJ"
"Bioderma Sensibio H2O 500ml + Sébium Pore refiner + Atoderm Lipstick - Makeup Essentials Bundle","Lipstick, Lipstick, Bioderma, Cleansers, Lipstick, Makeup Remover, Bioderma, Make Up Removers","B0DLXTBBQM"
"Nail Polish Remover by Cutex, Nourishing Nail Care, Leaves Nails Looking Healthy, Contains Vitamins E & Apricot Oil, 6.76 Fl Oz (Pack of 2)","Nail Polish Remover","B0BW3D9VYN"
"GAOY Jelly Nude Gel Nail Polish, 16ml Sheer White Translucent Soak Off Gel Polish, UV Light Cure for Nail Art DIY, 1316 Yogurt White","Nail Polish","B0CFQSHJDV"
"UNA GELLA Almond Fake Nails 216pcs Almond Press on Nails Pre-shape Almond Nails Tips for Full Cover Acrylic Almond Nails French False Nails For Nail Extension Nail Art, DIY Salon 12 Sizes Gelly Tips","Nail Tips","B0916DV6VH"
"SkinSmart Facial Cleanser for Acne, Targets Bacteria for Active Teenage Athletes Post Workout and Adult Acne, 8 oz Spray Bottle, Safe for Multiple Daily Uses (Pack of 2)","Washes, Face Care","B0BVNY2MDR"
"Neutrogena T/Sal Therapeutic Shampoo for Scalp Build-Up Control with Salicylic Acid, Scalp Treatment for Dandruff, Scalp Psoriasis & Seborrheic Dermatitis Relief, 4.5 fl. oz (Pack of 4)","Shampoos","B0BV65MQWQ"
"REVLON One-Step Volumizer Hair Dryer and Styler, Improved Motor for Less Frizz, More Shine, and Reduced Heat Damage for Salon Style Round Brush for Blowout, Black (Amazon Exclusive)","Hot-Air Brushes, Allure Best of Beauty Summer Picks, Allure Best of Beauty Winners","B097CNMZF5"
"Sally Hansen Instant Cuticle Remover, 1 Fl. Oz., Pack of 1 Salon Effects Perfect Manicure Press on Nails Kit, Ombre-Lievable Bundle","Cuticle Removing Fluids, Foot & Nail Care","B0CZ7L26K3"
