"Title","Categories: Sub","ASIN"
"GRAPENT Wide Leg Pants for Women Dressy Plus Size Bell Bottom Jeans for Women Women's Business Casual Clothes for Women's Plus Jeans Stretch Jeans High Waist Color Nightfall Dark Wash Size 20 Size 22","Jeans, 935e7a06-ca2b-4ddf-a94d-320834cbcb3b_1, Test Color, Top sellers Women's Test, Top sellers Women's","B0CQBYT9WS"
"Turandoss Silver Heart Initial Necklaces for Women, 18K Real White Gold Plated Initial U Necklace Dainty Heart Necklaces Tiny Silver Initial Necklaces for Women Mothers Day Gifts for Women Jewelry","Pendant Necklaces, Trending","B0DBM4L9Q9"
"SHAPERMINT Bras for Women - Lingerie Bra, Bralettes for Women with Support, No Underwire Plus Size Bras for Women Latte","Everyday Bras, 935e7a06-ca2b-4ddf-a94d-320834cbcb3b_1, Test Color","B0DDPW125R"
"VIFUUR Water Sports Unisex Shoes StripeBlue - 5.5-6.5 W US/ 4.5-5.5 M US (36-37)","Water Shoes, Water Shoes, Top Sellers Men's, Internet_Famous_2021, Most Wished For Styles, Most Gifted Styles, Top Sellers Men's Test, Top-Rated Shoes, Season's Deals","B0BPKD5V24"
"Easton | PRO+ Pull Up Baseball Pant | Youth | Full Length | Elastic Bottom | Youth White YXS","Pants, b21c23e8-ac46-41ab-bfed-a824ad1360c0_601, Easton","B09BG3B4TR"
"N'Ice Caps Kids Waterproof Snow Mittens Cold Weather Thinsulate Insulated (Light Purple Pixels, 6-8 Years)","Mittens","B0DTWRH2N3"
"Sunzel Workout Leggings for Women Butt Lifting, Scrunch Butt Tummy Control Gym Leggings, High Waisted Squat Proof Yoga Pants 25"" Forest Green X-Small","Leggings, b21c23e8-ac46-41ab-bfed-a824ad1360c0_601, Top sellers Women's Test, Top sellers Women's, Season's Deals, Internet Famous","B0CNX4ZBTV"
"Lazebox Garment Bags for Travel and Closet Storage with Zipper, 40 inches Clear Suit Bag for Suits, Coats, Jackets, Shirts","Garment Bags","B0CY5F5836"
"Jason Markk Repel Spray & Refill, Shoe Cleaner, 2-Piece Set, Water & Stain Repellent, Non-Aerosol, Sneaker Care, Ideal for Footwear, Safe for Leather, Suede, Nubuck, Cotton, Knits, 5.4oz","Water & Stain Treatments","B0B29P1BTG"
"MathCat Seamless Workout Shirts for Women Long Sleeve Yoga Tops Sports Running Shirt Breathable Athletic Top Slim Fit","T-Shirts, Shirts, Running, 6609e2df-21bc-475b-90b2-735f42ef982c_3801, 935e7a06-ca2b-4ddf-a94d-320834cbcb3b_1, Women's GenZ Apparel Only, Season's Deals","B0BMLN6WYF"
"Weiman Jewelry Cleaner & Sparkle Stick - Portable, On-The-Go Cleaning for Diamond Engagement Rings, Wedding Rings, Gemstones, Necklaces, Earrings, Bracelets","Cleaning & Care","B0D5ZBR1YW"
"AUTOMET Womens Long Sleeve Shirts Pleated Crew Neck Casual Fall Fashion Tops Loose Fit Lightweight Girls Outfits Clothes BlackGrey XXL","T-Shirts, 935e7a06-ca2b-4ddf-a94d-320834cbcb3b_9701, 935e7a06-ca2b-4ddf-a94d-320834cbcb3b_1","B0DF7FSX6M"
"SUUKSESS Women Sexy Square Neck Tank Top Summer Y2K Going Out Tops Casual Sleeveless Basic Cami Shirts (Baby Blue, XS)","Tanks & Camis, 935e7a06-ca2b-4ddf-a94d-320834cbcb3b_9701, 935e7a06-ca2b-4ddf-a94d-320834cbcb3b_1, Top sellers Women's Test, Top sellers Women's","B0D3L7RNFR"
"WIHOLL Sleeveless Tops for Women Dressy Casual Summer Influencers Picks Clothes 2025 Cap Sleeve Business Casual Outfits Work Office Basic tees Grey White Striped Shirts S","Tanks & Camis, 935e7a06-ca2b-4ddf-a94d-320834cbcb3b_9701, 935e7a06-ca2b-4ddf-a94d-320834cbcb3b_1, Test Color, Top sellers Women's Test, Top sellers Women's","B0CR5Q32Y1"
"Levi's Women's 311 Shaping Skinny Jeans (Also Available in Plus), (New) Personal Wealthy, 34 Regular","Jeans, 935e7a06-ca2b-4ddf-a94d-320834cbcb3b_1, Fashion Plus Shop by Product, Women's Plus-Size Fashion, Fashion Plus Shop by Category, Popular brands: women's, 80dbd58c-5608-4346-a9d0-64e6b7f46827_578602","B0C9NMDHQW"
"Women's Smocked Cuffed Solid Boyfriend Shirt Casual Collar Long Sleeve Button Down Blouse Tops with Pocket","Blouses & Button-Down Shirts, 935e7a06-ca2b-4ddf-a94d-320834cbcb3b_9701, 935e7a06-ca2b-4ddf-a94d-320834cbcb3b_1","B0CJMBJVH4"
"Alimens & Gentle Men's Plaid Button Down Shirts Cotton Long Sleeve Dress Shirts Regular Fit Gingham Shirts","Button-Down Shirts, 935e7a06-ca2b-4ddf-a94d-320834cbcb3b_9701, Top Sellers Men's, Men's Big & Tall Clothing, Test Color, Top Sellers Men's Test, Next-Gen x Most Loved","B0DFHBDFD8"
"EverFoams Women’s Soft Curly Full Slippers Memory Foam Lightweight House Shoes Cozy Loafer with Polar Fleece Lining Blue,5-6 US","Slippers, Test Color, Top sellers Women's Test, Top sellers Women's","B0B936GYRY"
"Amazon Essentials Women's Lightweight Open-Front Cardigan Sweater (Available in Plus Size), Dark Green, Small","Cardigans, Customer Favorites - Merch, 935e7a06-ca2b-4ddf-a94d-320834cbcb3b_1, 100% Plus & Featured Brands, Our Brands, Fashion Plus Shop by Product, Women's Plus-Size Fashion, PTBYB x The Plus Shop, Up to 50% Off Men's and Women's Fashion from Our Brands, Fashion Plus Shop by Category, HG & Top Rated & Manual Plus Size (w/basics), Top Picks from Our Brands, Most Loved Plus-Size, SPB AE AA SJC, Test Color, Customers' Most-Loved: Plus-Size, SPB_HPA_22, New arrivals from our brands, Business Pricing & Quantity Discounts, Amazon Essentials, Plus Stylist Brands, Featured Brands, Back In Stock, Deals from Amazon brands, Plus Size Clothing from Our Brands, test node women, Women's fashion, Customer Favorites from Amazon Brands, Customers' Most-Loved: Sweaters Under $30 pASIN Test","B08T7M582B"
"YANIBEST Bonnet for Men Women Hair Bonnet for Sleeping Double Layer Satin Bonnets for Black Women Curly Hair Braids, Ligth Pink","Hats & Caps, Hats & Caps","B0D3BVMBD6"
"Hstyle Ruffle Socks Women, Ruffle Turn-Cuff Casual Cute Girl Ruffle Socks Breathable Cool Ruffle Ankle Socks 6 Pairs of Mixed Color 2","Women, Socks, 935e7a06-ca2b-4ddf-a94d-320834cbcb3b_1, Test Color, Trending, Creators trends- M&W","B0D7373G6L"
"Wrangler Hardside Spinner Carry-On Luggage, Lilac, 22-Inch","Carry-Ons, New Arrivals This Month, Must-Have Luggage","B0C7YWMBGP"
"Burt's Bees Baby Baby Girls' Sleeper Pajamas, 100% Organic Cotton, Soft One-Piece PJs, Diagonal Zip Up Jumpsuit, Snug Fit Footie with Snap Tab, Blooming Fields, 12 Months","Rompers, Test Color","B0CN1Q6WGZ"
"Amazon Essentials Women's Lightweight V-Neck Cardigan Sweater (Available in Plus Size), Olive, XX-Large","Cardigans, 935e7a06-ca2b-4ddf-a94d-320834cbcb3b_1, Our Brands, Plus-Size Styles from Amazon Essentials, Fashion Plus Shop by Product, Women's Plus-Size Fashion, PTBYB x The Plus Shop, Fashion Plus Shop by Category, HG & Top Rated & Manual Plus Size (w/basics), Most Loved Plus-Size, HG Frequent Plus 4+ Stars, SPB AE AA SJC, Test Color, Customers' Most-Loved: Plus-Size, Plus Size Clothing from Our Brands, New arrivals from our brands, Curated Brands: Plus Size, Business Pricing & Quantity Discounts, Amazon Essentials, Most Gifted Styles, Plus Stylist Brands, Featured Brands, Deals from Amazon brands, Plus Size Clothing from Our Brands, test node women, Plus Size Fashion, Women's fashion, Customers' Most-Loved: Sweaters Under $30 pASIN Test","B08T7GV5B4"
"siliteelon Women's Button Down Shirts Long Sleeve Dress Shirts Wrinkle Free Collared Work Office Solid Blouses Corset Tops - Bright Blue XL","Button-Down Shirts, 935e7a06-ca2b-4ddf-a94d-320834cbcb3b_1, Trending","B0DFWP1Y4N"
"Saucony Men's RunDry Mesh Ventilating Comfort Fit Performance No-Show Socks, Available in M-XXL (6, 12, 18, Black Red Assorted (6 Pairs), Medium","No-Show Socks, Clothing Outlet, Bulk Buying & Case Packs, 80dbd58c-5608-4346-a9d0-64e6b7f46827_744602, Up to 30% off Socks from Dickies and Saucony, Customers' Most-Loved: Sweaters Under $30 pASIN Test","B08YM3KK1N"
"Amazon Essentials Men's Cotton Knit Pajama Pant, Light Grey Flamingo, Medium","Sleep Bottoms, Our Brands, SPB AE AA SJC, Mens Size Inclusive, Test Color, New arrivals from our brands, test node men v2, Business Pricing & Quantity Discounts, Mens Plus Size Fashion, Amazon Essentials, Deals from Amazon brands, test node men","B09KP2TF9W"
"Amazon Essentials Men's Sweatshirt Hoodie, Toffee Brown, Small, Big & Tall Options Available","Fashion Hoodies & Sweatshirts, Our Brands, Men's fashion query V2, Men's Tops, Top Picks from Our Brands, SPB AE AA SJC, Test Color, Mens Big & Tall Fashion, SPB_HPA_22, New arrivals from our brands, test node men v2, Business Pricing & Quantity Discounts, Mens Plus Size Fashion, Amazon Essentials, Prime Day: Products on deal all 48 hours, Holiday Pick from Private Brands, Men's fashion, Associates top products, Most Gifted Styles, Back In Stock, Deals from Amazon brands, test node men, Internet Famous, Men's, Customers' Most-Loved: Sweaters Under $30 pASIN Test","B08X2FH555"
"AUTOMET Womens Hoodies Half Zip Sweatshirts Fleece Jackets Tops Oversized Pullover Fall Outfits 2025 Winter Fashion Clothes CoffeeGrey XL","Fashion Hoodies, 935e7a06-ca2b-4ddf-a94d-320834cbcb3b_1, Women's See It On Your Model, Women's GenZ Apparel Only, Cider Top 100, Top sellers Women's Test, Top sellers Women's, Next-Gen x Most Loved","B0CCDGNRY7"
"Womens Plus Size Tops Short Sleeve Tunic Tops for Leggings V Neck T Shirts Brown 3XL","Tunics, 935e7a06-ca2b-4ddf-a94d-320834cbcb3b_1","B0CXXX8YD7"
"ALL INCLUDED 10 Set Durable Packing Cubes for Suitcases,OlarHike Essentials for Travel, UPGRADED Anti-Tear Stitching, NEW Improved Luggage Packing Organizers, Essentials for Travel(Light Blue)","Packing Organizers","B0DJ4Q9138"
"Under Armour Men's HeatGear Armour Leggings , Midnight Navy (410)/White, Medium","Compression Pants & Tights, High priority-mens, easter promo check-1, UA Sports-2021 PD WTS, 2023-UA Mens Apparel, Sports and Apparel for Back to School | Amazon.com, Mens-Spring NP, mens-sports, b21c23e8-ac46-41ab-bfed-a824ad1360c0_601, Styling Statement Sweaters for Him: Knit Joggers, Men's Athleisure Bottoms, Prime Wardrobe: Under Armour, 2023-UA Mens Apparel, Spend $100+, get $25 off select fashion","B08GLKVJCH"
"Bride Sweatshirt, Engagement gift, Future Mrs Sweatshirt, Bride to be Gift, Embossed Bachelorette Gift, New Mrs, Fiancee Gift, Newly Engaged (S, White)","Fashion Hoodies & Sweatshirts, Clothing, Shoes & Accessories","B0BT4DFN6D"
"GRANKEE Women's Breathable Seamless Thong Panties No Show Underwear 6 Pack(Skin 6 Pack S)","G-Strings & Thongs, 935e7a06-ca2b-4ddf-a94d-320834cbcb3b_1, Test Color, Business Pricing & Quantity Discounts, Most Gifted Styles","B093H49RV2"
"AUTOMET Womens Fashion Tops Summer Outfits T Shirts Business Casual Dressy Plus Size Cap Sleeve Tee Trendy Y2K Clothes CoffeeGrey 2XL","T-Shirts, 935e7a06-ca2b-4ddf-a94d-320834cbcb3b_9701, 935e7a06-ca2b-4ddf-a94d-320834cbcb3b_1, Cider Top 100, Top sellers Women's Test, Women's Plus Size Clothing, Top sellers Women's","B0D2Y7D4KC"
"Pander Two Way Zipper Fanny Pack Nylon Everywhere Belt Bag for Women, Water Repellent Waist Packs, Crossbody Bags with Adjustable Strap (Red Merlot).","Waist Packs, Superbowl Gameday - Men's & Women's, Fashion-forward finds","B0BGZ5Y4DY"
"Amazon Essentials Men's 7"" Quick-Dry Swim Trunk, Navy White Ditsy Floral, X-Large","Trunks, Our Brands, Men's fashion query V2, Back in Stock from Amazon Brands, SPB AE AA SJC, Test Color, New arrivals from our brands, test node men v2, Business Pricing & Quantity Discounts, Mens Plus Size Fashion, Amazon Essentials, Men's fashion, Deals from Amazon brands, test node men","B09FK957PS"
"Embroidered Bride Denim Jacket, Bride Jean Jacket, Future Mrs Jacket, Custom Personalized Pearl Denim Jacket, Wedding Jean Jacket, Wedding Gift, Bachelorette Party Anniversary (XS, Blue)","Clothing, Categories, 935e7a06-ca2b-4ddf-a94d-320834cbcb3b_1, Wedding","B0CZ93BRRN"
"Ozaiic Yoga Socks for Women Non-Slip Grips & Straps, Ideal for Pilates, Pure Barre, Ballet, Dance, Barefoot Workout","Socks, b21c23e8-ac46-41ab-bfed-a824ad1360c0_601, Season's Deals","B0BFLKXFWW"
"Amazon Essentials Men's Performance Tech Loose-Fit Lightweight Shorts (Available in Big & Tall), Pack of 2, Black/Grey, 6X-Large Big","Active Shorts, Shorts, b21c23e8-ac46-41ab-bfed-a824ad1360c0_601, 6609e2df-21bc-475b-90b2-735f42ef982c_3801, Our Brands, Men's fashion query V2, SPB AE AA SJC, Test Color, Mens Big & Tall Fashion, New arrivals from our brands, test node men v2, Business Pricing & Quantity Discounts, Mens Plus Size Fashion, Amazon Essentials, Men's fashion, Deals from Amazon brands, test node men","B09GYLNWQW"
"Aoxjox High Waisted Workout Leggings for Women Trinity Yoga Pants 26.5"" (Pink, Medium)","Leggings, b21c23e8-ac46-41ab-bfed-a824ad1360c0_601, Top sellers Women's Test, Top sellers Women's, Everyday Apparel Essentials","B0B2M1QH46"
"DORALLURE Thigh High Stockings Silicone Lace Top Stay Up Silky Semi Sheer Pantyhose for Women Hold Up Nylon","Sheers, 935e7a06-ca2b-4ddf-a94d-320834cbcb3b_1, Test Color","B0BNQH8MZT"
"OEAK Womens Wireless Bras V Mesh Comfortable Bralette Supportive Tshirt Bra No Underwire Seamless Push Up Everyday Bras White 2XL","Everyday Bras, 935e7a06-ca2b-4ddf-a94d-320834cbcb3b_1, Test Color","B0DH2GPV3X"
"ASICS Men's Gel-Venture 9 Shoes, 9.5, Black/Golden Yellow","Road Running, 80dbd58c-5608-4346-a9d0-64e6b7f46827_690502, Test Color, Next-Gen x Most Loved","B0BZDSMWVQ"
"PUMIEY Women's Long Sleeve T Shirts Crew Neck Slim Fit Going Out Tops for Women Sexy Basic Tee, Ruby Large","T-Shirts, 935e7a06-ca2b-4ddf-a94d-320834cbcb3b_9701, 935e7a06-ca2b-4ddf-a94d-320834cbcb3b_1, Test Color, XS-3X, Season's Deals","B0CHFLMND7"
"Amazon Essentials Women's Pull-On Knit Jegging (Available in Plus Size), Dark Olive, Medium","Jeans, 935e7a06-ca2b-4ddf-a94d-320834cbcb3b_1, 100% Plus & Featured Brands, Our Brands, Fashion Plus Shop by Product, Women's Plus-Size Fashion, PTBYB x The Plus Shop, NA HERproject ASINs, Fashion Plus Shop by Category, HG & Top Rated & Manual Plus Size (w/basics), Most Loved Plus-Size, SPB AE AA SJC, Women's Summer Staples and Swim from Our Brands, Test Color, Customers' Most-Loved: Plus-Size, New arrivals from our brands, Amazon Essentials, Plus Stylist Brands, Featured Brands, Back In Stock, Deals from Amazon brands, Plus Size Clothing from Our Brands, test node women, Women's fashion","B09M94VXNR"
"The French, (Bling) Fleur De Lis Women Reading Glasses Adorned with (Clear + Aurora Borealis) Austrian Crystals, Magnifying (Black) Rectangular. NY Fifth Avenue. (+1.75)","Eyewear Frames, Clothing, Shoes & Accessories, Accessories","B0B7C46N7Z"
"HOPLYNN Neoprene Sweat Waist Trainer Corset Trimmer Shaper Belt for Women, Workout Plus Size Waist Cincher Stomach Wraps Bands Gray XXXX-Large","Waist Cinchers, 935e7a06-ca2b-4ddf-a94d-320834cbcb3b_1, Test Color","B0924MM6DC"
"Buffway Slim Minimalist Front Pocket RFID Blocking Leather Wallets for Men and Women","Wallets","B0D2HTJGVV"
"AUTOMET Sweatpants for Women with Pockets-Lounge Pajams Pants-Running Joggers Fall Clothes Spring Outfits Resort Wear 2025 Red XL","Sweatpants, 6609e2df-21bc-475b-90b2-735f42ef982c_3801, 935e7a06-ca2b-4ddf-a94d-320834cbcb3b_1, Cider Top 100, Test Color, Top sellers Women's Test, Top sellers Women's","B0D7S1H1JX"
"ZITY Mens Polo Shirt Short Sleeve Sports Tactical T-Shirt Athletic Golf Polos Daily Casual Stylish Collared Shirts for Men Khaki 4X-Large","Polos, Top Sellers Men's, Test Color, Top Sellers Men's Test","B0DDXQP46L"
"Burt's Bees Baby Baby Boys Pajamas, One-Piece Footed Sleeper PJs, Non-Slip Snug Fit for Infants 12, 18, and 24 Months","Blanket Sleepers","B0D88RYQRR"
"CUSHIONAIRE Women's Hip 2 Genuine Suede Ankle Snow Boots - Pull-On with Cozy Faux Shearling Lining, +Memory Foam, Booties For Women, Cheetah 9 W","Ankle & Bootie, 935e7a06-ca2b-4ddf-a94d-320834cbcb3b_9701, Test Color, Internet Famous","B0BPDZD1HH"
"Hanes Comfortblend Essentials, Cotton Crewneck Tee, Classic Fit T-Shirt for Women, Black","T-Shirts, 935e7a06-ca2b-4ddf-a94d-320834cbcb3b_9701, 935e7a06-ca2b-4ddf-a94d-320834cbcb3b_1, Test Color, 80dbd58c-5608-4346-a9d0-64e6b7f46827_578602","B0CHN4VW3X"
"ATHMILE Womens Long Sleeve Crewneck Ribbed Tops Fitted Stretch Casual Basic T Shirts 2025 Light Purple","T-Shirts, 935e7a06-ca2b-4ddf-a94d-320834cbcb3b_9701, 935e7a06-ca2b-4ddf-a94d-320834cbcb3b_1, Test Color","B0D7YV3SCN"
"Eedor No Show Socks Womens Invisible Liner, Non Slip & Low Cut, Casual & Formal Wear, Soft & Stretchable, 4 Pairs Small Size 5-7, Multi Color","No-Show Socks, 935e7a06-ca2b-4ddf-a94d-320834cbcb3b_1, Test Color","B09PGGBTZN"
"G4Free Wide Leg Pants for Women Yoga Dress Pants Work Slacks Loose Lounge Palazzo Pants with Pockets for Office Business(Dark Coffee,XS,29"")","Pants, b21c23e8-ac46-41ab-bfed-a824ad1360c0_601, XS-3X","B0CKZ2JQL2"
"ANRABESS Women's Open Front Knit Lightweight Cardigan Casual Long Coatigan Sweater Lady Jacket Coat 2025 Fall Outerwear Gray Medium","Cardigans, 935e7a06-ca2b-4ddf-a94d-320834cbcb3b_1, Women's See It On Your Model, Cider Top 100, Test Color, Top sellers Women's Test, Business Pricing & Quantity Discounts, Top sellers Women's, Cozy luxe edit for her","B0BCPHS924"
"Womens Lingerie Set Babydoll Lace Chemise V Neck Mesh Sleepwear Nightwear(Violet,M)","Baby Dolls & Chemises, 935e7a06-ca2b-4ddf-a94d-320834cbcb3b_1, Test Color","B092ZDZ9QW"
"6 Pairs 14K Gold Hoop Earrings for Women Lightweight Chunky Hoop Earrings Multipack Hypoallergenic, Thick Open Twisted Huggie Hoops Earring Set Jewelry for Gifts. (new gold hoops)","Hoop, Young Adult Fashion Trends","B0C24B78ZG"
"ANRABESS Women Short Sleeve Crewneck Rib Knit Slim Fitted Shirts Summer 2025 Basic Tee Tshirt Tops Underwear Outfits Clothes Yellow X-Small","T-Shirts, 935e7a06-ca2b-4ddf-a94d-320834cbcb3b_9701, 935e7a06-ca2b-4ddf-a94d-320834cbcb3b_1, Test Color","B0DNKLW1Y6"
"MOREOK Winter Gloves -10°F 3M Thinsulate Warm Gloves Bike Gloves Cycling Gloves for Driving/Cycling/Running/Hiking-Black-XL","Gloves, Gloves, b21c23e8-ac46-41ab-bfed-a824ad1360c0_8501","B0BFR3WPQF"
"Amazon Essentials Men's Packable Lightweight Water-Resistant Puffer Jacket (Available in Big & Tall), Black, 6X-Large Big","Down & Down Alternative, Our Brands, SPB AE AA SJC, Mens Size Inclusive, Mens Big & Tall Fashion, New arrivals from our brands, test node men v2, Business Pricing & Quantity Discounts, New Arrivals_Men's Fashion, Amazon Essentials, Deals from Amazon brands, test node men, Internet Famous","B09RFMZNBX"
"Lee Women's Wrinkle Free Relaxed Fit Straight Leg Pant, Bright White","Casual, 935e7a06-ca2b-4ddf-a94d-320834cbcb3b_1, Test Color, 80dbd58c-5608-4346-a9d0-64e6b7f46827_578602","B0CPLZ7X37"
"Thermajane Long Sleeve V Neck Thermal Shirts for Women Cold Weather, Womens Thermal Underwear Tops, Base Layer Women Thermal (Black, Large)","Tops, 935e7a06-ca2b-4ddf-a94d-320834cbcb3b_1, Test Color","B07ZPJYSCT"
"Trendy Queen Womens Ribbed Tank Tops Racerback Summer Basic Camisole V Neck Going Out Slim Fit Fashion Clothes 2025 Greyblue XL","Tanks & Camis, 935e7a06-ca2b-4ddf-a94d-320834cbcb3b_9701, 935e7a06-ca2b-4ddf-a94d-320834cbcb3b_1, Cider Top 100","B0CYGMJ625"
"Burt's Bees Baby Baby Girls' Sleep and Play One-Piece Zip Front Pjs, Sunflower Fields, 6-9 Months","Rompers","B0CFN58SZ1"
"UpUGo 3 Pair Flat Shoe laces, 5/16"" Wide Shoelaces for Athletic Running Sneakers Shoes Boot Strings","Shoelaces, Fashion-forward finds","B0B6HTCP47"
"JMIERR Men's Casual Shorts - Cotton Drawstring Summer Beach Stretch Waist Twill Chino Dress Golf Shorts with Pockets 8 Inch Inseam, XL, Haze Blue","Flat Front, 935e7a06-ca2b-4ddf-a94d-320834cbcb3b_9701, Top Sellers Men's, Test Color, Top Sellers Men's Test","B0D5GQF7W1"
"Amazon Essentials Men's Straight-Fit Woven Pajama Pant, Navy Paisley, Large","Sleep Bottoms, Our Brands, Men's fashion query V2, SPB AE AA SJC, Mens Size Inclusive, Test Color, New arrivals from our brands, test node men v2, Business Pricing & Quantity Discounts, Mens Plus Size Fashion, Amazon Essentials, Most Wished For Styles, Men's fashion, Most Gifted Styles, Deals from Amazon brands, test node men","B09SZCJKL1"
"PAGE ONE Womens Winter Ribbed Beanie Crossed Cap Chunky Cable Knit Pompom Soft Warm Hat","Skullies & Beanies","B0D6VTMLP9"
"CAMPSNAIL Biker Shorts Women with Pockets - 3""/5""/8"" High Waisted Workout Spandex Tummy Control Gym Running Yoga Shorts","Active Shorts, b21c23e8-ac46-41ab-bfed-a824ad1360c0_601, 6609e2df-21bc-475b-90b2-735f42ef982c_3801, 935e7a06-ca2b-4ddf-a94d-320834cbcb3b_1, Test Color, Trending","B0BX5XJP3K"
"Vertvie Women's Seamless Bras No Underwire Scalloped Push Up Bras Soft Wireless Comfort Bralettes Full Coverage Everyday Bra (Skin,X-Large)","Everyday Bras, 935e7a06-ca2b-4ddf-a94d-320834cbcb3b_1","B0CZ3V5F17"
"ASICS Women's Gel-Venture 9 Shoes, 5.5, Carrier Grey/Vibrant Yellow","Trail Running, Test Color, 80dbd58c-5608-4346-a9d0-64e6b7f46827_337702","B0BZDRSHJJ"
"Vertvie Womens Wireless Bras No Underwire Push Up Bra Seamless Supportive Full Coverage Everyday Bras Regular and Plus Size(White,3X-Large)","Everyday Bras, 935e7a06-ca2b-4ddf-a94d-320834cbcb3b_1, Test Color","B0DSBB5VQ7"
"Roselux Womens Long Sleeve Scoop Neck Ribbed Knit Fitted Casual Tops Tee Slim Basic Shirts(3924,Brown-L)","T-Shirts, 935e7a06-ca2b-4ddf-a94d-320834cbcb3b_9701, 935e7a06-ca2b-4ddf-a94d-320834cbcb3b_1, TEST W GENZ SHOES, Test Color, TEST: Womens GenZ Apparel","B0BX5VXTT5"
"JUKMO Tactical Belt, Military Hiking Rigger 1.5"" Nylon Web Work Belt with Heavy Duty Quick Release Buckle (Blue, Medium)","Belts, Top Sellers Men's, Customers' Most-Loved: Sweaters Under $30 pASIN Test","B09BZP5YNT"
"Men's Knitted Turtleneck Tops Fall&Winter Thermal Long Sleeve Slim Fit Pullover Sweaters Plaid(Black-Brown) M","Pullovers, Test Color","B0CBRTRH1H"
"Wrangler Men's 13MWZ Cowboy Cut Original Fit Jean, Black Whiskey, 30W x 32L","Jeans, Mens Size Inclusive, Test Color, 80dbd58c-5608-4346-a9d0-64e6b7f46827_744602, Prime Wardrobe: Wrangler Try Before You Buy, Pre-Loved Apparel draft prod1","B009AFTMV4"
"Amazon Essentials Men's Full-Zip Fleece Hoodie (Available in Big & Tall), Medium Brown, XX-Large","Fashion Hoodies & Sweatshirts, Our Brands, Men's fashion query V2, Clothing Outlet, Back in Stock from Amazon Brands, SPB AE AA SJC, Mens Size Inclusive, Test Color, Mens Big & Tall Fashion, New arrivals from our brands, Must See Deals, test node men v2, Business Pricing & Quantity Discounts, Mens Plus Size Fashion, Amazon Essentials, Men's fashion, Deals from Amazon brands, test node men, Next-Gen x Most Loved, Customers' Most-Loved: Sweaters Under $30 pASIN Test","B08X2F63WY"
"ATG by Wrangler Men's Synthetic Utility Pant, Kelp, 34W x 30L","Pants, Test Color, Pre-Loved Apparel draft prod1","B0B6DCY8DT"
"Amazon Essentials Women's Loafer Flat, Blush, 14","Loafers & Slip-Ons, Our Brands, SPB AE AA SJC, Test Color, New arrivals from our brands, Business Pricing & Quantity Discounts, Amazon Essentials, Deals from Amazon brands, test node women","B088K99TP5"
"DEPOVOR Ultra Boost Inserts Double-Sided Adhesive Pads Sticky Bikini Padding Inserts for Sports Bra Swimsuit Beige","Pads & Enhancers, 935e7a06-ca2b-4ddf-a94d-320834cbcb3b_1, Test Color","B0DKBS8RTP"
"KIDMI Women's Suede Clogs Leather Mules Cork Footbed Sandals Potato Shoes with Arch Support Coffee 38 (Size 7)","Mules & Clogs, Test Color, Top sellers Women's Test, Top sellers Women's","B0CZ6ZB3NM"
"SEEKWAY Water Shoes Women Men Adult Quick-Dry Aqua Socks Barefoot Non Slip for Beach Swim River Pool Lake surf Black Size SK002","Water Shoes, Water Shoes, Most Gifted Styles","B0CTF2LLXN"
"Amazon Essentials Men's Cargo Fleece Sweatpant, Dark Green, X-Large","Sweatpants, 6609e2df-21bc-475b-90b2-735f42ef982c_3801, Our Brands, Back in Stock from Amazon Brands, SPB AE AA SJC, Test Color, New arrivals from our brands, test node men v2, Business Pricing & Quantity Discounts, Mens Plus Size Fashion, Amazon Essentials, Deals from Amazon brands, test node men","B08J949SJR"
"Lone Cone Rain Boots with Easy-On Handles in Fun Patterns & Solid Colors for Toddlers and Kids, Camp - Shiny Finish, 4 Toddler","Girls, Rain Boots, Rain, Girls Boots, Clogs & Mules, Boys Boots, Clogs & Mules, Boys Loafers and Outdoor, Most Wished For Styles, Most Gifted Styles","B09G53WVSH"
"Vertvie Tummy Control Shapewear Shorts for Women Butt Lifting Body Shaper Shorts High Waisted Seamless Girdles Under Dress (Nude,X-Large)","Control Panties, 935e7a06-ca2b-4ddf-a94d-320834cbcb3b_1, Test Color","B0DPJV988N"
"maamgic Mens Swim Trunks with Compression Liner 5"" Stretch Athletic Swimming Shorts Quick Dry with Zipper Pockets No-Chafing Board Shorts Black-Orange Bat XX-Large","Men, Briefs, Men's Swimwear, Top Sellers Men's, Test Color, Top Sellers Men's Test","B0CG9LKH8Y"
"anan520 Elastic Shoe Laces - Elastic No Tie Shoelaces for Adults & Kids Shoes Brown","Shoelaces","B09R1RCYTZ"
"ATHMILE Plus Size Tops Womens Oversized T Shirts Loose Fit Crewneck Short Sleeve Tops Casual Blouse Y2K 2025 Basic Tee Darkpurple","T-Shirts, 935e7a06-ca2b-4ddf-a94d-320834cbcb3b_9701, 935e7a06-ca2b-4ddf-a94d-320834cbcb3b_1, Test Color","B0D1FN64FW"
"BULLIANT Men's Belt,Reversible Belt 1.25"" For Gift Mens Casual Golf Dress pants shirts,One Reverse For 2 Sides(Black/Dark Gray,50""-52"" Waist Adjustable)","Belts, Top Sellers Men's, Top Sellers Men's Test","B0CL1ZH1SZ"
"NY Threads Men's Athletic Shorts Quick Dry Loose-Fit Lightweight Running Workout Gym Shorts with Pockets, Medium, Black White Panel","Active Shorts, Shorts, b21c23e8-ac46-41ab-bfed-a824ad1360c0_601, 6609e2df-21bc-475b-90b2-735f42ef982c_3801","B0BWNJGQLQ"
"Gerber Toddler Unisex Long Sleeve Onesies Bodysuit, White, 5T","Bodysuits, Bodysuits, Gerber, Bodysuits, Test Color","B0CDDJ4WT9"
"Trendy Queen Women Going Out Casual Tank Tops Spring Summer Basic Cute 2025 Sleeveless Shirt Y2K Fashion Outfit Clothes Coffee XL","Tanks & Camis, 935e7a06-ca2b-4ddf-a94d-320834cbcb3b_9701, 935e7a06-ca2b-4ddf-a94d-320834cbcb3b_1, Cider Top 100, Test Color, Top sellers Women's Test, Top sellers Women's","B0D3F1J275"
