"Title","Categories: Sub","ASIN"
"Amazon Essentials Women's Lightweight Full-Zip Water-Resistant Hooded Puffer Coat (Available in Plus Size), Dark Yellow, Large","Down Jackets & Parkas, 935e7a06-ca2b-4ddf-a94d-320834cbcb3b_1, 100% Plus & Featured Brands, Our Brands, Fashion Plus Shop by Product, Women's Plus-Size Fashion, PTBYB x The Plus Shop, Fashion Plus Shop by Category, HG & Top Rated & Manual Plus Size (w/basics), Top Picks from Our Brands, Most Loved Plus-Size, SPB AE AA SJC, Test Color, Customers' Most-Loved: Plus-Size, Deals on Gifts - Coats & Jackets Under $50, New arrivals from our brands, Business Pricing & Quantity Discounts, Into the Wild - Get Outdoors, Gifts for Her, Amazon Essentials, Plus Stylist Brands, Featured Brands, Deals from Amazon brands, Plus Size Clothing from Our Brands, test node women, FW22 AE Hero Product, Women's fashion","B08SRSD66R"
"Hanes, EcoSmart Fleece Full Hoodie, Zip-Up Hooded Sweatshirt for Women, SPANISH MOSS","Active Hoodies, 6609e2df-21bc-475b-90b2-735f42ef982c_3801, 935e7a06-ca2b-4ddf-a94d-320834cbcb3b_1, Test Color, 80dbd58c-5608-4346-a9d0-64e6b7f46827_578602","B0CH1JP7G8"
"XIEERDUO Women's T-Shirts V Neck Tops for Women Short Sleeve Summer Clothes Trendy L","T-Shirts, 935e7a06-ca2b-4ddf-a94d-320834cbcb3b_9701, 935e7a06-ca2b-4ddf-a94d-320834cbcb3b_1, Most Loved Plus-Size, Test Color, Top sellers Women's Test, Most Wished For Styles, Top sellers Women's, Shein Brands + More, Most Gifted Styles, High Perf - US","B09XCDWSM6"
"3 Pack Leggings for Women-No See-Through High Waisted Tummy Control Yoga Pants Workout Running Legging","Leggings, b21c23e8-ac46-41ab-bfed-a824ad1360c0_601, 6609e2df-21bc-475b-90b2-735f42ef982c_3801, 935e7a06-ca2b-4ddf-a94d-320834cbcb3b_1","B09VXVGPLC"
"Carhartt Boys' Long Sleeve Hooded Sweatshirt, Sulphur Spring","Fashion Hoodies & Sweatshirts, 6609e2df-21bc-475b-90b2-735f42ef982c_3801, Test Color","B0C7YRK8J2"
"Silkies Women's Control Top Pantyhose with Run Resistant, Light Support Legs (2 Pair Pack) - Small Taupe","Sheers, 935e7a06-ca2b-4ddf-a94d-320834cbcb3b_1, Test Color, Everyday Apparel Essentials","B08CY3DP5Z"
"Newchoice Womens Ugly Christmas Tunic Tops Merry Buffalo Plaid Print Vintage Graphic Tees (XXL,Merry Red)","Tunics, 935e7a06-ca2b-4ddf-a94d-320834cbcb3b_1, Test Color","B0BF12PNYL"
"CHICGAL Summer Dresses for Women Sundresses Casual Strapless Dresses Beach Cover Ups Ruffle Dress 2024 (Black Amoeba,2XL)","Casual, 935e7a06-ca2b-4ddf-a94d-320834cbcb3b_1","B0CVX296ZH"
"DEANGELMON Seamless Thongs for Women No Show Thong Underwear Women Comfortable Multiple Pack (6P22,M)","G-Strings & Thongs, 935e7a06-ca2b-4ddf-a94d-320834cbcb3b_1","B0CGZTQCL6"
"Castle Matching Shirts for Family 2025 Retro Castle Tshirt Family Vacation Shirt Matching Shirts for Family Vacation Family Matching Outfits","Clothing, Shoes & Accessories, T-Shirts, 935e7a06-ca2b-4ddf-a94d-320834cbcb3b_9701","B0D5MQR369"
"Gildan Adult Softstyle Cotton T-Shirt, Style G64000, Bulk Case, Black, 2X-Large","T-Shirts, 935e7a06-ca2b-4ddf-a94d-320834cbcb3b_9701, Gildan Top 30 PASINs, Test Color, Gildan 2024","B0BWYHBDCK"
"WEERTI Thermal Underwear for Men Long Johns with Fleece Lined, Base Layer Men Cold Weather Top Bottom White","Bottoms, Top Sellers Men's, Test Color","B08ZKHKVPT"
"YEOREO Gym Workout Cargo Leggings with Pockets for Women Hidden Scrunch Butt Lifting Compression Yoga Leggings Light Khaki S","Leggings, 6609e2df-21bc-475b-90b2-735f42ef982c_3801, 935e7a06-ca2b-4ddf-a94d-320834cbcb3b_1, Test Color","B0DJW3JJS8"
"Amazon Essentials Men's Slim-Fit Stretch Golf Pant, Black, 35W x 34L","Pants, b21c23e8-ac46-41ab-bfed-a824ad1360c0_601, Customer Favorites - Merch, Our Brands, Men's fashion query V2, Clothing Outlet, Climate Pledge Friendly - Gifts, SPB AE AA SJC, SPB_HPA_22, New arrivals from our brands, Business Pricing & Quantity Discounts, Amazon Essentials, Men's fashion, Back In Stock, Deals from Amazon brands","B096YLG5FV"
"EFAN Womens Oversized Sweatshirts Hoodies Fleece Crewneck Sweaters Casual Tops Comfy Fall Fashion Outfits Winter Clothes 2025 Red S","Fashion Sweatshirts, 935e7a06-ca2b-4ddf-a94d-320834cbcb3b_1, Test Color, Top sellers Women's Test, Most Wished For Styles, Top sellers Women's","B0C81X9RN8"
"CozyWow Women's 80D Soft Solid Color Semi Opaque Footed Tights High Waist Womens Tights Suntan S-M","Tights, 935e7a06-ca2b-4ddf-a94d-320834cbcb3b_1, Test Color","B0C3TS546Q"
"BAMBOO COOL Men's Underwear Boxer Briefs Fly with Built-in 3D Pouch Support Comfortable Soft Underwear for Men XL","Boxer Briefs, Test Color","B0BX69M5BS"
"Amazon Essentials Women's Classic-Fit Full-Zip Polar Soft Fleece Jacket (Available in Plus Size), Dark Yellow, X-Large","Fleece, 935e7a06-ca2b-4ddf-a94d-320834cbcb3b_1, Our Brands, Fashion Plus Shop by Product, Women's Plus-Size Fashion, PTBYB x The Plus Shop, Fashion Plus Shop by Category, HG & Top Rated & Manual Plus Size (w/basics), SPB AE AA SJC, Test Color, New arrivals from our brands, Business Pricing & Quantity Discounts, Amazon Essentials, Plus Stylist Brands, Featured Brands, Deals from Amazon brands, test node women, Women's fashion, Customers' Most-Loved: Sweaters Under $30 pASIN Test","B08SRW9JTP"
"Fisoew Women's Casual Long Sleeve Tops Crew Neck Round Hem Loose T-Shirts Tunic Tops with Thumb Holes Navy","Tunics, 935e7a06-ca2b-4ddf-a94d-320834cbcb3b_1, Test Color","B0D5YBSXLN"
"Amazon Essentials Baby Boys' Heavyweight Hooded Puffer Jacket, Olive, 18 Months","Down & Down Alternative, Our Brands, Clothing Outlet, SPB AE AA SJC, Test Color, New arrivals from our brands, New Arrivals_Kids/Baby Fashion, test node kids, Amazon Essentials, Deals from Amazon brands","B0BFBTH9K6"
"HSIA Minimizer Bra for Women - Plus Size Lace Bra Womans Full Coverage Bras Unlined Underwire Bra for Heavy Breast Purple","Everyday Bras, 935e7a06-ca2b-4ddf-a94d-320834cbcb3b_1, Most Loved Plus-Size, Test Color","B0BRKRDB47"
"Hybrid & Company Women's Premium Nylon Ponte Stretch High Waist Pencil Suit Skirt Below Knee KSK45002 1073T Olive XS","Skirts, 935e7a06-ca2b-4ddf-a94d-320834cbcb3b_1, Test Color, Womens Summer Styles","B0C7BCQ7LT"
"Eiggam Underwear for Women, Women's Cotton Underwear High Waist Stretch Briefs Soft Breathable Ladies Cotton Panties, Multi E-6 Pack, Size XXL","Briefs, 935e7a06-ca2b-4ddf-a94d-320834cbcb3b_1, Test Color, Plus Size Fashion","B0DPKD5L5C"
"Amazon Essentials Men's Slim-Fit Pants, 5-Pocket Stretch Twill Design, Gold, 32W x 33L","Casual, Our Brands, Back in Stock from Amazon Brands, SPB AE AA SJC, Test Color, New arrivals from our brands, test node men v2, Business Pricing & Quantity Discounts, Mens Plus Size Fashion, Amazon Essentials, Back In Stock, Deals from Amazon brands, test node men","B093LTNCPC"
"Amazon Essentials Men's Classic-Fit Cargo Short (Available in Big & Tall), Indigo Palm Leaf Print, 32","Cargo, Sun-Ready Shorts, 935e7a06-ca2b-4ddf-a94d-320834cbcb3b_9701, Our Brands, Back in Stock from Amazon Brands, Men's Shorts Under $25 - Prod, SPB AE AA SJC, Mens Size Inclusive, Test Color, Mens Big & Tall Fashion, New arrivals from our brands, test node men v2, Business Pricing & Quantity Discounts, Amazon Essentials, Prime Day: Products on deal all 48 hours, Deals from Amazon brands, test node men, Next-Gen x Most Loved, Internet Famous, Customers' Most-Loved: Sweaters Under $30 pASIN Test","B08P68Y1NX"
"Levi's Women's 725 High Rise Bootcut Jeans (Also Available in Plus), First Dibs, 31 Short","Jeans, 935e7a06-ca2b-4ddf-a94d-320834cbcb3b_1, Fashion Plus Shop by Product, Women's Plus-Size Fashion, PTBYB x The Plus Shop, Fashion Plus Shop by Category, HG & Top Rated & Manual Plus Size (w/basics), Most Loved Plus-Size, Customers' Most-Loved: Plus-Size, Popular brands: women's, 80dbd58c-5608-4346-a9d0-64e6b7f46827_578602, Spend $100+, get $25 off select fashion","B0B223T4RB"
"KUNMI Women's High Waisted Bell Bottom Bootcut Jeans Flare Wide Leg Stretch Trendy Jeans","Jeans, 935e7a06-ca2b-4ddf-a94d-320834cbcb3b_1, Test Color","B0CSYB5X6Q"
"EBMORE Womens Wool Socks Thermal Hiking Winter Boot Warm Thick Cozy Crew Comfy Work Socks for Ladies 19 Pairs(Snowflake & Heart)","Calf Socks, 6609e2df-21bc-475b-90b2-735f42ef982c_3801, 935e7a06-ca2b-4ddf-a94d-320834cbcb3b_1","B09KXBYV8G"
"Amazon Essentials Women's Two Strap Heeled Sandal, Rose Leopard, 8","Heeled Sandals, Our Brands, Outlet: End of Summer Fashion, SPB AE AA SJC, Women's Sandal Markdowns, Test Color, New arrivals from our brands, Womens Summer Styles, Women's Gift Guide: Shop by Category, CML BYOC Test: Mens, Business Pricing & Quantity Discounts, Amazon Essentials, CML BYOC Test: Womens, Back In Stock, Deals from Amazon brands, test node women, Fashion-forward finds, Women's fashion, Women's Sandals Under $40, Customers' Most-Loved: Sweaters Under $30 pASIN Test","B07NQCLC9X"
"Alimens & Gentle Men's Dress Shirts Long Sleeve Wrinkle-Free Stretch Shirts Solid Formal Button Down Shirt with Pocket Dark Grey","Button-Down Shirts, 935e7a06-ca2b-4ddf-a94d-320834cbcb3b_9701, Men's Big & Tall Clothing, Test Color, Mens Plus Size Fashion","B0BQYL4CLZ"
"SHOW ME YOUR TITS Funny Gag Gift Trucker Hat for men women man woman brother sister bachelor inappropriate humor funny (SHOW ME YOUR)","Baseball Caps, Clothing, Shoes & Accessories, Accessories","B0CFB5XGJR"
"PAVOI 14K Gold Plated 3mm Cubic Zirconia Classic Tennis Bracelet | Gold Bracelets for Women | Size 6.5-7.5 Inch","Tennis, Customers' Most-Loved: Sweaters Under $30 pASIN Test","B09PMRYPZX"
"Amazon Essentials Women's Flannel Pajama Sleep Pant-Discontinued Colors, Navy Floral Print, 4X","Bottoms, 935e7a06-ca2b-4ddf-a94d-320834cbcb3b_1, Our Brands, Fashion Plus Shop by Product, PTBYB x The Plus Shop, Fashion Plus Shop by Category, HG & Top Rated & Manual Plus Size (w/basics), SPB AE AA SJC, Test Color, New arrivals from our brands, Business Pricing & Quantity Discounts, Amazon Essentials, Prime Day Plus Deals, Plus Stylist Brands, Deals from Amazon brands, test node women, Plus-size Fashion, Women's fashion","B09SZ6481W"
"SHAPERX Women's Fajas Colombianas Shapewear Postpartum Tummy Control Body Shaper Butt Lifter Bodysuit","Bodysuits, Petite, Test Color, Women's Plus Size Clothing","B01JOQNSFE"
"ATHMILE Women's Scoop Neck Long Sleeve Ribbed Slim Fitted Casual Basic Crop Top B-Orange","T-Shirts, 935e7a06-ca2b-4ddf-a94d-320834cbcb3b_9701, 935e7a06-ca2b-4ddf-a94d-320834cbcb3b_1, Test Color","B0DCVLCT48"
"Amazon Essentials Men's Classic-Fit 9"" Chino Short, Sage Green, 42","Flat Front, 935e7a06-ca2b-4ddf-a94d-320834cbcb3b_9701, Our Brands, Men's fashion query V2, Back in Stock from Amazon Brands, SPB AE AA SJC, Test Color, New arrivals from our brands, test node men v2, Must See Deals - Men, Business Pricing & Quantity Discounts, Mens Plus Size Fashion, Amazon Essentials, Prime Day: Products on deal all 48 hours, Men's fashion, Deals from Amazon brands, test node men, Next-Gen x Most Loved, Internet Famous, Customers' Most-Loved: Sweaters Under $30 pASIN Test","B08P68WPH1"
"OOFOS - Unisex OOahh Sport - Post Run Recovery Slide Sandal (Black/Yellow, US Men's Size 11/Women's Size 13)","Sandals, 935e7a06-ca2b-4ddf-a94d-320834cbcb3b_9701, Test Color","B0DPBFLTSK"
"maamgic Boys Swim Trunks with Compression Liner Toddler Stretch Swim Shorts Quick Dry Swimming Trunks Boxer Brief 2 in 1 Beach Shorts Blue Flamingos 14/16","Trunks, Boys' Swimwear, Test Color, Most Wished For Styles","B0CGCVMDZN"
"AUTOMET Shirts for Women Summer Spring Tops Short Sleeve Oversized Tshirts Fashion Basic Casual Tee Clothes 2025 Trendy 02_Aqua L","T-Shirts, 935e7a06-ca2b-4ddf-a94d-320834cbcb3b_9701, 935e7a06-ca2b-4ddf-a94d-320834cbcb3b_1, Everyday Apparel Essentials","B09ZNKF58F"
"Trendy Queen Womens Zip Up Hoodies Jackets Cropped Sweatshirts Fleece Fall Outfits Casual Comfy Y2k Tops Winter Clothes 2025 Pink S","Fashion Hoodies, 935e7a06-ca2b-4ddf-a94d-320834cbcb3b_1, Women's GenZ Apparel Only, Cider Top 100, Test Color, Top sellers Women's Test, Top sellers Women's, Shop By Category: Tween Girls Fashion","B0CB84HVP9"
"Nike Club Fleece Hoodie (Bright Gold, 4X-Large)","Active Hoodies, 6609e2df-21bc-475b-90b2-735f42ef982c_3801, 935e7a06-ca2b-4ddf-a94d-320834cbcb3b_1, Test Color, 80dbd58c-5608-4346-a9d0-64e6b7f46827_578602, Everyday Apparel Essentials","B0BFYTNLFM"
"MORENDL Toddler Sock Shoes Baby Walking Shoes Infant Slippers Boys & Girls Non-Slip Sneakers","Girls, Sneakers, Test Color","B0CZ3ZZ32Z"
"LILLUSORY Lounge Sets Womens Two 2 Piece Matching 2024 Fall Fashion Outfits Clothes Clothing Trendy Knit Sweater Loungewear Travel Sweatsuit Sweat Suit Sets","Sets, 935e7a06-ca2b-4ddf-a94d-320834cbcb3b_1, Test Color","B0BCJW8WQ3"
"Champion, Lightweight Open-Hem Lounge Men, Jersey Pants (Reg. or Big, Oxford Gray C Patch Logo, X-Large Tall","Sleep Bottoms, Men's Big & Tall Clothing, Test Color, 80dbd58c-5608-4346-a9d0-64e6b7f46827_744602, Mens Plus Size Fashion, Men's See It On You","B0BPDXC7ML"
"Womens Tops Dressy Casual V Neck Sweaters for Women Tunic Sweaters Blue Grey XXL","Pullovers, 935e7a06-ca2b-4ddf-a94d-320834cbcb3b_1","B0DPHFH7N4"
"Amazon Essentials Men's Lightweight Waffle Robe (Available in Big & Tall), Navy, 4X-Large Big","Robes, Our Brands, Men's fashion query V2, SPB AE AA SJC, Mens Size Inclusive, Test Color, Mens Big & Tall Fashion, New arrivals from our brands, test node men v2, Amazon Essentials, Men's fashion, Deals from Amazon brands, test node men","B0BGDSB7P3"
"Dad Poked Mom Funny Baby Bodysuit Nerd Parent Shower Gift Shirt Nerdy Infant POKED (6-12 Long Sleeve Onesie)","Bodysuits, Bodysuits, Clothing, Shoes & Accessories, Handmade Kids' & Baby","B0BLHY626H"
"suaskk Womens Athletic Cushioned Anti-Blister Comfort Running Ankle Socks 5 Pairs","Athletic Socks, Socks, b21c23e8-ac46-41ab-bfed-a824ad1360c0_601","B0CVQL8GC5"
"Real Essentials FR:Womens V Neck T-Shirt Ladies Yoga Top Athletic Tees Active Wear Gym Workout Zumba Exercise Running Essentials Dry Fit Dri Fit Moisture Wicking Basic Clothes, Purple, S, Pack of 1","T-Shirts, b21c23e8-ac46-41ab-bfed-a824ad1360c0_601, 6609e2df-21bc-475b-90b2-735f42ef982c_3801, 935e7a06-ca2b-4ddf-a94d-320834cbcb3b_1, Most Loved Plus-Size, Women's Plus-Size Apparel, Test Color, Customers' Most-Loved: Plus-Size, Most Gifted Styles, Customers' Most-Loved: Sweaters Under $30 pASIN Test","B07SQGHRZN"
"TRIWONDER Kids Winter Snow Mittens, Waterproof Warm Kids Ski Gloves Thermal Fleece Outdoor Snowboard Snow Gloves for Baby Boys Girls (Rose Red - 3-5 Years Old)","Gloves, b21c23e8-ac46-41ab-bfed-a824ad1360c0_8501","B0BJCZDPK1"
"Hayvenhurst Wallet For Men - Reinvented Design Men's Wallet - Slim, Minimalistic & Seamless Card Case, Blocks RFID Scanners, Holds 12 Cards (Beech Wood)","Card Cases","B0CCG62Z1R"
"Amazon Essentials Men's Classic-Fit Wrinkle-Resistant Pleated Chino Pant (Available in Big & Tall), Indigo, 33W x 29L","Casual, Our Brands, Top Picks from Our Brands, SPB AE AA SJC, Mens Size Inclusive, Test Color, Mens Big & Tall Fashion, SPB_HPA_22, New arrivals from our brands, Dresses, test node men v2, Business Pricing & Quantity Discounts, Mens Plus Size Fashion, Amazon Essentials, Most Wished For Styles, Back In Stock, Deals from Amazon brands, test node men, Amazon Fashion Sales & Deals","B08JHQMMTH"
"Chooka Womens Waterproof Plush Chelsea Bootie Rain, Olive, 6 US","Rain Footwear, 935e7a06-ca2b-4ddf-a94d-320834cbcb3b_9701, Rain, Test Color, Most Wished For Styles, Most Gifted Styles","B09BYZGHKH"
"Match Men's Wild Camouflage Cargo Pants (42,Blue Digital camo)","Casual, Top Sellers Men's, Women's GenZ Apparel Only, Mens Size Inclusive, Test Color, Mens Plus Size Fashion, Top Sellers Men's Test, Next-Gen x Most Loved, Season's Deals, Internet Famous","B09LCFRHZ4"
"tichers Seamless Thongs for Women No Show Thong V-waisted Stretch Breathable Sexy Panties Underwear 6 Pack","G-Strings & Thongs, 935e7a06-ca2b-4ddf-a94d-320834cbcb3b_1, Season's Deals","B0CJCBB47N"
"PURE CHAMP 3Pk Boys Sweatpants Fleece Athletic Workout Kids Clothes Boys Joggers with Zipper Pocket and Drawstring Size 4-20 (SET3 Size 14/16)","Sweatpants, b21c23e8-ac46-41ab-bfed-a824ad1360c0_8501, 6609e2df-21bc-475b-90b2-735f42ef982c_3801, Test Color","B0C8LBYZX9"
"Graduated Copper Compression Socks for Men & Women Circulation 8 Pairs 15-20mmHg - Best for Running Athletic Cycling","Compression Knee-High Socks, b21c23e8-ac46-41ab-bfed-a824ad1360c0_601","B0BRV5649Q"
"Amazon Essentials Women's Slim-Fit Short-Sleeve V-Neck T-Shirt, Pack of 2, White/Hot Pink, XX-Large","T-Shirts, 935e7a06-ca2b-4ddf-a94d-320834cbcb3b_9701, Customer Favorites - Merch, 935e7a06-ca2b-4ddf-a94d-320834cbcb3b_1, Our Brands, Back in Stock from Amazon Brands, SPB AE AA SJC, Test Color, SPB_HPA_22, New arrivals from our brands, Business Pricing & Quantity Discounts, Amazon Essentials, Women's Tops, Back In Stock, Deals from Amazon brands, test node women, Women's fashion, Women's","B09G3L67B1"
"Amazon Essentials Women's Slim-Fit Short-Sleeve V-Neck T-Shirt, Pack of 2, Navy, X-Small","T-Shirts, 935e7a06-ca2b-4ddf-a94d-320834cbcb3b_9701, Customer Favorites - Merch, 935e7a06-ca2b-4ddf-a94d-320834cbcb3b_1, Our Brands, Back in Stock from Amazon Brands, SPB AE AA SJC, Test Color, SPB_HPA_22, New arrivals from our brands, Business Pricing & Quantity Discounts, Amazon Essentials, Women's Tops, Back In Stock, Deals from Amazon brands, test node women, Women's fashion","B09G3KPWCZ"
"ZOOSIXX Soft Black Pajama Pants for Women, Wide Leg Comfy Casual Lounge Yoga Capri Pants 22'' / 30''","Bottoms, 935e7a06-ca2b-4ddf-a94d-320834cbcb3b_1, Test Color","B0C4HGZLTX"
"Evshine Women's Fuzzy Memory Foam Slippers Chenille Knit bedroom House Slippers Fluffy Plush Warm Slip-on Indoor Shoes, Rose Pink, 36-37 (Size 5-6.5)","Slippers, Test Color","B0D9RP4CG1"
"Amazon Essentials Mens T-Shirts, Regular-Fit, Short-Sleeve Crewneck Pocket, Pack of 2, Grey Heather/White, Medium","T-Shirts, 935e7a06-ca2b-4ddf-a94d-320834cbcb3b_9701, Our Brands, Winning Style, Dazzle, Drama, Disco: Classics & shine, Generation Celebration: Crocs & Classics, Outlet: End of Summer Fashion, Men's Solid T-Shirts, Dazzle, Drama, Disco: Sneakers & more, SPB AE AA SJC, Mens Size Inclusive, Test Color, Winning Style: Basics, New arrivals from our brands, test node men v2, Business Pricing & Quantity Discounts, Mens Plus Size Fashion, Amazon Essentials, Prime Day: Products on deal all 48 hours, Dazzle, Drama, Disco: On-Trend athleisure, Dazzle, Drama, Disco, Deals from Amazon brands, test node men, Generation Celebration","B09TPK2XG8"
"Amazon Essentials Women's Lightweight Waffle Full-Length Robe (Available in Plus Size), Navy, 3X","Robes, 935e7a06-ca2b-4ddf-a94d-320834cbcb3b_1, Our Brands, Fashion Plus Shop by Product, Women's Plus-Size Fashion, PTBYB x The Plus Shop, Fashion Plus Shop by Category, HG & Top Rated & Manual Plus Size (w/basics), Top Picks from Our Brands, Most Loved Plus-Size, Back in Stock from Amazon Brands, SPB AE AA SJC, Test Color, SPB_HPA_22, New arrivals from our brands, @stylekita Amazon Fashion Picks, Business Pricing & Quantity Discounts, Amazon Essentials, Plus Stylist Brands, Back In Stock, Deals from Amazon brands, test node women, Women's fashion","B09KYH9GRB"
"Engtoy Baby Shoes Baby Sock Shoes Baby Walking Shoes Infant Non-Slip Breathable Slippers with Soft Rubber Sole Baby Boys Girls Slip On Sneakers All Black","Sneakers, Baby Boys, Test Color","B09LQXJGWN"
"Blooming Jelly Women One Piece Swim Dress Tummy Control Swimsuits Modest Mesh Sheer V Neck Swimdress (M, Hot Pink)","One-Pieces, Women's Swimwear, 935e7a06-ca2b-4ddf-a94d-320834cbcb3b_1, Test Color","B0DK8YNPV2"
"TELALEO 4 Pack Women's Compression Shirt Long Sleeve Performance Workout Baselayer Athletic Top Sports Gear 4Black-XXL","Active Base Layers, Women, Women, b21c23e8-ac46-41ab-bfed-a824ad1360c0_601, 6609e2df-21bc-475b-90b2-735f42ef982c_3801, 935e7a06-ca2b-4ddf-a94d-320834cbcb3b_1","B0DJLZYNZG"
"FMEYOA Womens Summer Tops Casual V Neck Short Sleeve Solid Color Basic T Shirt(Z-Pink,Medium)","T-Shirts, 935e7a06-ca2b-4ddf-a94d-320834cbcb3b_9701, 935e7a06-ca2b-4ddf-a94d-320834cbcb3b_1","B0CQLD25VW"
"Aegend Running Gloves Women Men Touch Screen Cycling Sports Mittens Liners Warm Gloves, Black - Gray Pattern, Small","Gloves, Gloves, b21c23e8-ac46-41ab-bfed-a824ad1360c0_601","B0D83D29ML"
"J.VER Boy's Long Sleeve Dress Shirts Solid Stretch Wrinkle-Free Shirt Kids Casual Button Down Shirts Grey","Button-Down Shirts, Test Color, Mens Plus Size Fashion","B0BTD6NB8F"
"ROCKBROS Cold Weather Balaclava Ski Mask for Men Windproof Thermal Winter Scarf Mask Women Neck Warmer Hood for Cycling","Balaclavas","B0CPDDCGX8"
"QUALFORT Women's Crewneck Sweater 100% Cotton Soft Knitted Pullover Tops Blue Small","Pullovers, 935e7a06-ca2b-4ddf-a94d-320834cbcb3b_1, Test Color","B0DF2V8D34"
"Burt's Bees Baby Baby Socks Ankle or Crew Height Made with Soft Organic Cotton - 6 Packs With Non-Slip Grips for Babies and Newborn Babies","Ankle Socks, Test Color, Most Wished For Styles, Most Gifted Styles","B0DPJL1VYY"
"AUTOMET Womens Athletic Shorts High Waisted Running Shorts Gym Workout Shorts Casual Comfy Sport Shorts with Pockets 2025 Coffee","Active Shorts, b21c23e8-ac46-41ab-bfed-a824ad1360c0_601, 6609e2df-21bc-475b-90b2-735f42ef982c_3801, 935e7a06-ca2b-4ddf-a94d-320834cbcb3b_1, Cider Top 100, Test Color","B0C3LTQYFP"
"Brooks Men’s Adrenaline GTS 24 Supportive Running Shoe - Cobalt/Neo Yellow/Peacoat - 15 Wide","Road Running, 80dbd58c-5608-4346-a9d0-64e6b7f46827_690502, Spend $100+, get $25 off select fashion","B0CQTKZT2M"
"FULLSOFT High Waisted Leggings for Women No See-Through Tummy Control Yoga Hiking Pants Workout Leggings-Reg&Plus Size (Grey camo,Small-Medium)","Leggings, b21c23e8-ac46-41ab-bfed-a824ad1360c0_601","B0DLKVH3TM"
"WEERTI Thermal Underwear for Women Long Johns with Fleece Lined, Base Layer Women Cold Weather Top Bottom Purple","Sets, 935e7a06-ca2b-4ddf-a94d-320834cbcb3b_1, Test Color","B08ZN82VXW"
"SHEWIN Wide Leg Jeans for Women Trendy 2025 High Waisted Flare Jeans Straight Leg Ankle Denim Pants with Pockets Sky Blue Size 14","Jeans, 935e7a06-ca2b-4ddf-a94d-320834cbcb3b_1, Test Color","B0DQT9JVF8"
"Blooming Jelly Womens Summer Tank Top Sleeveless Business Casual Top Trendy Dressy Work Blouse 2025 (M, Grey Blue)","Tanks & Camis, 935e7a06-ca2b-4ddf-a94d-320834cbcb3b_9701, 935e7a06-ca2b-4ddf-a94d-320834cbcb3b_1, Test Color","B0DF5QTP6K"
"Amazon Essentials Men's Athletic-Fit Pants, 5-Pocket Stretch Twill Work, Big & Tall, Charcoal, 36W x 28L","Casual, Our Brands, Back in Stock from Amazon Brands, SPB AE AA SJC, Test Color, Mens Big & Tall Fashion, SPB_HPA_22, New arrivals from our brands, test node men v2, Business Pricing & Quantity Discounts, Mens Plus Size Fashion, Amazon Essentials, Back In Stock, Deals from Amazon brands, test node men","B093LWXLKV"
"ELETOP Men's Swim Trunks 9"" Long Board Shorts for Swimming Quick Dry Beach Holiday Bathing Suit Blue TK105 3XL","Board Shorts, Men's Swimwear, Mens Plus Size Fashion","B08Y1G452N"
"Amazon Essentials 18K Gold Over Sterling Silver Thin 0.8mm Box Chain 24"", Yellow Gold (previously Amazon Collection)","Chains, Our Brands, SPB AE AA SJC, New arrivals from our brands, Business Pricing & Quantity Discounts, Most Wished For Styles, Most Gifted Styles, Deals from Amazon brands","B0BFDPQLDF"
"Eoehro Passport and Vaccine Card Holder Combo, Faux Leather, Compact, Lightweight, Waterproof, AA-Black","Passport Covers, Outfit Builder","B09G2XRDP8"
"Fruit of the Loom Women's Built Up Tank Style Sports Bra Value Pack, Kitty Pink/Hyacinth/Grey Heather/Black Hue","Sports Bras, 935e7a06-ca2b-4ddf-a94d-320834cbcb3b_1, Test Color, 80dbd58c-5608-4346-a9d0-64e6b7f46827_578602","B0CZGTVWX2"
"Gerber Baby Girl's 8-Pack Short Sleeve Onesies Bodysuits, Leopard Pink, 3-6 Months","Bodysuits, Gerber, Test Color, Business Pricing & Quantity Discounts","B092564255"
"Lee Men's Extreme Motion Crossroad Cargo Short, Blue Desert, 33","Cargo, 935e7a06-ca2b-4ddf-a94d-320834cbcb3b_9701, Test Color, 80dbd58c-5608-4346-a9d0-64e6b7f46827_744602","B0CQZ5SGJW"
"SAMPEEL Crop Tops for Women Trendy Beige Short Sleeve T Shirts Streetwear L","T-Shirts, 935e7a06-ca2b-4ddf-a94d-320834cbcb3b_9701, 935e7a06-ca2b-4ddf-a94d-320834cbcb3b_1, Women's GenZ Apparel Only","B0CNSK5ZVR"
"Ekouaer Womens Waffle Knit Pajama Sets Long Sleeve Top and Shorts Matching Lounge Set Sleepwear Loungewear Sweatsuit with Pockets Yellow Green XX-Large","Sets, 935e7a06-ca2b-4ddf-a94d-320834cbcb3b_1, Women's GenZ Apparel Only, Cider Top 100, Top sellers Women's Test, Top sellers Women's","B0BK7ZMKSN"
"BAGSMART 4 Set Compression Packing Cubes for Travel, Lightweight Vacation Travel Essentials, Travel Accessories for Suitcase Organizer Bags Set, Durable Luggage Organizer Travel Bags","Packing Organizers","B08Z35YNSR"
"KuaiLu Womens Arch Support Flip Flops Comfortable Yoga Mat Slip on Leather Walking Thong Cushion Sandals Summer Beach Orthotic Slides Travel Essentials Indoor Outdoor Slippers Shoes Grey Size 7.5","Flip-Flops, Test Color, Womens Summer Styles, Season's Deals","B09N3QM44V"
"Amazon Essentials Women's Short-Sleeve V-Neck T-Shirt (Available in Plus Size), Pack of 2, White/Light Grey Heather, 4X","T-Shirts, 935e7a06-ca2b-4ddf-a94d-320834cbcb3b_9701, 935e7a06-ca2b-4ddf-a94d-320834cbcb3b_1, 100% Plus & Featured Brands, Our Brands, Fashion Plus Shop by Product, Women's Plus-Size Fashion, Fashion Plus Shop by Category, Back in Stock from Amazon Brands, SPB AE AA SJC, Test Color, New arrivals from our brands, Business Pricing & Quantity Discounts, Amazon Essentials, Plus Stylist Brands, Featured Brands, Deals from Amazon brands, test node women, Women's fashion","B09HCLMZNV"
"HOZIY Girls Leotards for Kids Gymnastics Size 6-7 Years Old Purple Black Leopard Panel Shiny Outfits Sparkly Colorful","Unitards, Gymnastics","B09TSH77FB"
"Silver Red Earrings for Women, Red Stud Huggie Hoop Jacket Earring Stacks for Multiple Piercing, Garnet January Birthstone Trendy Jewelry Gifts","Earring Jackets","B0DHXTP4DG"
