"Title","Categories: Sub","ASIN"
"Franklin Sports Youth Baseball + Softball Pants - Relaxed Style Kids Baseball Pants for Boys + Girls with Belt Loop - Grey - Youth Small","Pants, b21c23e8-ac46-41ab-bfed-a824ad1360c0_601","B0CQXYHYHP"
"Leggings Depot Womens Relaxed fit Jogger Pants - Track Cuff Sweatpants with Pockets, Capri-Forest Teal, Medium","Sweatpants, b21c23e8-ac46-41ab-bfed-a824ad1360c0_601, 6609e2df-21bc-475b-90b2-735f42ef982c_3801, 935e7a06-ca2b-4ddf-a94d-320834cbcb3b_1, publishers momentum, Test Color, Business Pricing & Quantity Discounts, Most Wished For Styles, Most Gifted Styles, Next-Gen x Most Loved, Everyday Apparel Essentials, Customers' Most-Loved: Sweaters Under $30 pASIN Test","B09QHFC739"
"Playtex Women's 18-Hour Ultimate Lift Wireless Full-Coverage Bra, Single or 2-Pack, Rustic Berry Red","Everyday Bras, 935e7a06-ca2b-4ddf-a94d-320834cbcb3b_1, Test Color, 80dbd58c-5608-4346-a9d0-64e6b7f46827_578602","B0D156CJ5X"
"ThunderFit Silicone Men’s Wedding Rings, 10mm Wide 2.5mm Thick Rubber Wedding Bands-Variety Multipack 1-7","Wedding Rings, Business Pricing & Quantity Discounts, Customers' Most-Loved: Sweaters Under $30 pASIN Test","B08RJ33LPV"
"Nike Unisex Performance Cushion Crew Socks with Band (6 Pairs), Black/White, Large","Socks, b21c23e8-ac46-41ab-bfed-a824ad1360c0_601, Customers' Most-Loved: Under $75, Customers' Most-Loved: Womens Sandals, Customers' Most-Loved: Men's jackets and coats, Customers' Most-Loved: Women's beanies, Customers' Most-Loved: Men's boots, Customers' Most Loved: Girls' Fashion, Customers Most-Loved: Men's styles under $50, Customers' Most-Loved: Women's scarves and wraps, Customers' Most-Loved: Men's beanies, Customers' Most Loved: Women's Clothing, Customer's Most Loved: Boys' Fashion, Customers' Most-Loved: Men's shoes, Customers' Most-Loved Clothing, Shoes & Jewelry, Customers' Most-Loved: Men's scarves, Customers' Most Loved: Women's Accessories, Child Store: CML <$50, Customers' Most-Loved: Under $50, Customers' Most-Loved: Women's swim, Customers' Most-Loved: Men's Sneakers, Customers' Most-Loved: Dresses, Customers' Most-Loved: Dresses, Customers' Most-Loved: Women's gloves, Customers' Most Loved: Women's Handbags, Customers' Most-Loved: Women's sweaters, Customers' Most-Loved: Men's gloves, Customers' Most-Loved: Under $40, Customers' Most-Loved: Men, Customers Most-Loved: Women's styles under $50, Customers' Most-Loved: Womens Fashion, Customers' Most-Loved: Women's Dresses under $40, Customers' Most-Loved: Women's swim, Customers' Most-Loved: Women's shoes, Customers' Most-Loved: Women's boots, Customers' Most-Loved: Women, Customers' Most-Loved: Men's sweaters, Customer Most Loved under $50, Customers' Most-Loved: Women's jackets and coats, Customers' Most-Loved: Women's Sweaters under $40, Customers' Most-Loved: Mens Fashion, Child Store: CML <$40, Most Loved under $40, Customers' Most-Loved: Men's swim, Customers' Most-Loved, Child Store: CML <$75, Most Loved under $75","B0CMYCHMFH"
"Zelda Matilda 100G 3M Thinsulate Children Toddlers & Baby Mittens Winter Waterproof Mittens","Gloves","B0B3S5P18V"
"Womens Floral Cardigans Christmas Kimono Casual Shirts Holidays Coverups Tops(Xmas Red,XXL)","Cover-Ups, 935e7a06-ca2b-4ddf-a94d-320834cbcb3b_1, Women's Plus Size Clothing, Most Wished For Styles, Most Gifted Styles","B0CN6P2QXS"
"Russell Athletic Mens Cotton Performance Long Sleeve T-Shirt, Vintage White, 3X-Large","T-Shirts, 935e7a06-ca2b-4ddf-a94d-320834cbcb3b_9701, Test Color, 80dbd58c-5608-4346-a9d0-64e6b7f46827_744602, RA Top 10 PASINs","B0CXYVC7MG"
"Sof Sole Unisex's 3.7 Ounce Goo Repair Adhesive for Fixing Worn Shoes or Boots, Clear, 3.7-Ounce Tube (2-Pack), 2 Pack","Water & Stain Treatments","B0BVBY8NVP"
"ACCFOD 9-11 White Crew Socks or Modern Socks for Women, Soft Thin Cotton Socks for Women Girls","Calf Socks, 6609e2df-21bc-475b-90b2-735f42ef982c_3801, 935e7a06-ca2b-4ddf-a94d-320834cbcb3b_1, Test Color, Season's Deals","B0C472GLJ2"
"Alvada Merino Wool Hiking Socks Thermal Warm Crew Winter Boot Sock For Men Women 3 Pairs LXL","Athletic Socks, Camping & Hiking, Athletic Socks, Hiking & Outdoor Recreation, b21c23e8-ac46-41ab-bfed-a824ad1360c0_8501","B0DH8KDTDS"
"Gildan Unisex Adult Heavy Cotton T-shirt, Style G5000, Multipack, White (3-pack), Large US","T-Shirts, T-Shirts, 935e7a06-ca2b-4ddf-a94d-320834cbcb3b_9701, Gildan Top 30 PASINs, Test Color, See It On You, Business Pricing & Quantity Discounts, Gildan 2024, Mens Plus Size Fashion, Men's See It On You, Women's See It On You, Everyday Apparel Essentials, Pre-Loved Apparel draft prod1, Customers' Most-Loved: Sweaters Under $30 pASIN Test","B09S6W3Z2B"
"RUNNING GIRL High Impact Sports Bras for Women,Racerback Running Bra Workout Crop Tank Tops Longline Sports Bra Push up(WX2667 Hot Pink L)","Sports Bras, 935e7a06-ca2b-4ddf-a94d-320834cbcb3b_1, Test Color","B0D3V9YTZF"
"Dickies Men's Casual Leather Belt, Brown Grommet, XX-Large (46-48)","Belts, Internet Famous","B0B5B7QFDP"
"RUNBOX Green Men's Wallets Slim Rfid Leather 2 ID Window With Gift Box","Wallets","B0CF8L5Q75"
"Lee Women's Ultra Lux Comfort with Flex Motion Bootcut Jean, Star Rise, 0 Long","Jeans, 935e7a06-ca2b-4ddf-a94d-320834cbcb3b_1, Test Color, 80dbd58c-5608-4346-a9d0-64e6b7f46827_578602, LEDT9 Priority","B0CBW8513N"
"Ieumaz Scrunch Butt Lifting Leggings for Women Impact Gym Seamless Workout Leggings Mid Low Waist Tummy Control Yoga Pants","Leggings, 6609e2df-21bc-475b-90b2-735f42ef982c_3801, 935e7a06-ca2b-4ddf-a94d-320834cbcb3b_1, Test Color","B0DJKR3Q42"
"SwissGear Sion Softside Expandable Luggage, Merlot, Checked-Large 29-Inch","Suitcases, GIII T12 24 Best Deal, Backpacks, Bags, & Luggage","B0BTFLJNDF"
"Brooks Women’s Adrenaline GTS 23 Supportive Running Shoe - Black/Cream/Biscuit - 8.5 Wide","Road Running, Virtual Try-on: Shoes, 80dbd58c-5608-4346-a9d0-64e6b7f46827_337702, Spend $100+, get $25 off select fashion","B0CD1F2VVR"
"Cuddl Duds Womens Thermal Underwear - Cold Weather Heavyweight Base Layer 2-Piece Set - Moisture-Wicking Long Johns - Winter Clothes - Dusty Blue - XL","Sets, 935e7a06-ca2b-4ddf-a94d-320834cbcb3b_1, Test Color, 80dbd58c-5608-4346-a9d0-64e6b7f46827_578602","B0DDRXKFLN"
"BAMBOO COOL Men's Ultra Breathable Underwear,No Riding Up Boxer Briefs with ComfortFlexible Waistband,Multipack","Boxer Briefs, Test Color, Business Pricing & Quantity Discounts, Everyday Apparel Essentials","B0BGRTNZYV"
"Dickies Men's Dri-Tech Moisture Control Quarter Socks, Available in M-XXL (6, 12, 18, Hi-Vis Orange Black (6 Pairs), X-Large","Calf Socks, Crew Socks, Test Color, 80dbd58c-5608-4346-a9d0-64e6b7f46827_744602, Everyday Apparel Essentials","B09TCPPCX2"
"Champion Men's Joggers, Powerblend, Fleece Joggers, Sweatpants for Men (Reg. or Big & Tall)","Sweatpants, b21c23e8-ac46-41ab-bfed-a824ad1360c0_601, 6609e2df-21bc-475b-90b2-735f42ef982c_3801, Test Color, Mens Big & Tall Fashion, 80dbd58c-5608-4346-a9d0-64e6b7f46827_744602","B0BNJYN6Y4"
"SAMPEEL Two Piece Set for Women Christmas Outfits Holiday Trendy Lounge Sets Mock Neck Matching Sets Women Clothing Wide Leg Crop Pants Set Red 2XL","Tracksuits, 6609e2df-21bc-475b-90b2-735f42ef982c_3801, 935e7a06-ca2b-4ddf-a94d-320834cbcb3b_1, Test Color","B0DHVQ5GK5"
"Ekouaer Silk Pajamas Set for Women Satin Backless Lingerie Pjs Cami Top and Shorts Nightwear Snorkel Blue","Sets, 935e7a06-ca2b-4ddf-a94d-320834cbcb3b_1, Cider Top 100, Test Color, Top sellers Women's Test, Top sellers Women's","B09MRKRHYN"
"UGG Women's Tasman Slipper, Ash Fog, 11","Slippers, UGG WTS Top ASINs, UGG Top 20, Shopbop ASINs, Best of Premium Brands, Test Color, Fall styles inspired by the runway, Business Pricing & Quantity Discounts, UGG variation audit, 80dbd58c-5608-4346-a9d0-64e6b7f46827_337702, Premium Fashion Brands","B08LQWB8FY"
"Amazon Essentials Men's Classic-Fit Wrinkle-Resistant Flat-Front Chino Pant (Available in Big & Tall), Indigo, 35W x 34L","Casual, Our Brands, Prime Try Before You Buy: Men's Holiday Looks, SPB AE AA SJC, Mens Size Inclusive, Test Color, Mens Big & Tall Fashion, New arrivals from our brands, test node men v2, Business Pricing & Quantity Discounts, Amazon Essentials, Deals from Amazon brands, test node men, Customers' Most-Loved: Sweaters Under $30 pASIN Test","B08JHNNG9Z"
"AUROLA Dream Tie Dye Workout Leggings for Women Seamless High Waist Scrunch Athletic Running Gym Fitness Active Pants","Leggings, Leggings, b21c23e8-ac46-41ab-bfed-a824ad1360c0_601, 6609e2df-21bc-475b-90b2-735f42ef982c_3801, 935e7a06-ca2b-4ddf-a94d-320834cbcb3b_1, TEST W GENZ SHOES, TEST 2: GENZ APPAREL 2.0, Test Color, Top sellers Women's Test, Top sellers Women's, TEST: Womens GenZ Apparel, Next-Gen x Most Loved","B0C8G3MFKC"
"Crocs Unisex-Adult Classic Lined Clog, Sulphur, 16 Women/14 Men","Mules & Clogs, Comfort Shoes, Test Color, 80dbd58c-5608-4346-a9d0-64e6b7f46827_337702, Spend $100+, get $25 off select fashion","B0B2JBG3QW"
"WallFlower Women's Luscious Curvy Bootcut Mid-Rise Insta Stretch Juniors Jeans (Standard and Plus), Camille, 14 Plus Long","Jeans, 935e7a06-ca2b-4ddf-a94d-320834cbcb3b_1, Test Color, Juniors' Clothing, Women's Plus Size Clothing Test, Business Pricing & Quantity Discounts, Women's Plus Size Clothing, Pre-Loved Apparel draft prod1","B08YBYGG6J"
"ZOMAKE Metal Shoe Horn Long Handle for Seniors 16.5 Inches with 7.5 Inches Travel Shoe Horn for Kids(Pack of 2)","Shoe Horns & Boot Jacks","B0B1QZ66BX"
"Amazon Essentials Women's Lightweight Longer Length Cardigan Sweater (Available in Plus Size), Burgundy, 4X","Cardigans, 935e7a06-ca2b-4ddf-a94d-320834cbcb3b_1, 100% Plus & Featured Brands, Our Brands, Fashion Plus Shop by Product, Women's Plus-Size Fashion, PTBYB x The Plus Shop, Up to 50% Off Men's and Women's Fashion from Our Brands, Fashion Plus Shop by Category, HG & Top Rated & Manual Plus Size (w/basics), Top Picks from Our Brands, Most Loved Plus-Size, SPB AE AA SJC, Test Color, Customers' Most-Loved: Plus-Size, SPB_HPA_22, New arrivals from our brands, Business Pricing & Quantity Discounts, Amazon Essentials, Plus Stylist Brands, Featured Brands, Back In Stock, Deals from Amazon brands, Plus Size Clothing from Our Brands, test node women, Women's fashion, Women's","B09RQL21VB"
"CRZ YOGA Butterluxe High Waisted Lounge Leggings 28'' - Workout Yoga Pants for Women Buttery Soft Larkspur Blue Large","Leggings, 6609e2df-21bc-475b-90b2-735f42ef982c_3801, 935e7a06-ca2b-4ddf-a94d-320834cbcb3b_1, Cider Top 100, Test Color, Top sellers Women's Test, Top sellers Women's, Next-Gen x Most Loved, Spend $100+, get $25 off select fashion","B0DHR81B3C"
"Bluemaple 6 Pack Copper Compression Socks for Women and Men Circulation-Best Support for Medical, Running,Nursing,Athletic","Compression Socks, b21c23e8-ac46-41ab-bfed-a824ad1360c0_601","B0BYSD9BXV"
"Veken 8 Set Packing Cubes for Suitcases, Travel Bag Organizers for Carry on Luggage, Suitcase Organizer Bags Set for Travel Essentials Travel Accessories in 4 Sizes(Extra Large, Large, Medium, Small)","Packing Organizers","B0CQ6Z7GM3"
"Thermajohn Thermal Shirts for Men Long Sleeve Thermal Compression Shirts for Men Base Layer Cold Weather (Royal Blue, Large)","Active Base Layers, Men, b21c23e8-ac46-41ab-bfed-a824ad1360c0_8501, 6609e2df-21bc-475b-90b2-735f42ef982c_3801, Mens Size Inclusive, Test Color","B0D7NR8GNW"
"New Balance Men's 608 V5 Casual Comfort Cross Trainer, Black, 10.5 3X-Wide","Fitness & Cross-Training, Feb NB WTS - mens/kids, 80dbd58c-5608-4346-a9d0-64e6b7f46827_690502, BFCM: Black Friday Brand Deals, Test Color, T4W WTS, Most Wished For Styles, BFCM: New Balance, Most Gifted Styles, Internet Famous, Spend $100+, get $25 off select fashion","B0BYGLJQJV"
"G Gradual Men's Sweatpants with Zipper Pockets Athletic Pants Traning Track Pants Joggers for Men Soccer, Running, Workout(Grey,XS)","Track Pants, b21c23e8-ac46-41ab-bfed-a824ad1360c0_601, 6609e2df-21bc-475b-90b2-735f42ef982c_3801, Top Sellers Men's, Cider Top 100, Test Color, Most Gifted Styles, Top Sellers Men's Test","B0CCDTMP9J"
"coskefy Womens Brief Underwear Cotton Hipster Panties Soft Stretch Breathable Ladies Underwear 6 Pack","Hipsters, 935e7a06-ca2b-4ddf-a94d-320834cbcb3b_1","B0CHP1JKMW"
"Fruit of the Loom Women's T-Shirt Bra, Blushing Rose/White/Grey Heather, 38B","Everyday Bras, 935e7a06-ca2b-4ddf-a94d-320834cbcb3b_1, Test Color, 80dbd58c-5608-4346-a9d0-64e6b7f46827_578602, Everyday Apparel Essentials, Customers' Most-Loved: Sweaters Under $30 pASIN Test","B099YTJ711"
"Under Armour Mens Charged Assert 9 CN, Mod Gray (101)/White, 9.5 Medium US","Road Running, Running Shoes, January WTS UA Shoes, Test Color, Prime Wardrobe: Under Armour, Spend $100+, get $25 off select fashion","B08QVK14F3"
"Lilosy Petite Sexy Cute Underwire Push Up Strappy Heart Embroidered Mesh Sheer Lingerie Set for Women See Through Bra and Panty 2 Piece Beige White X-Small","Women, Lingerie Sets, 935e7a06-ca2b-4ddf-a94d-320834cbcb3b_1, Test Color","B0D93KJ9F8"
"Amazon Essentials Women's Fleece Jogger Sweatpant (Available in Plus Size), French Blue, XX-Large","Sweatpants, 6609e2df-21bc-475b-90b2-735f42ef982c_3801, 935e7a06-ca2b-4ddf-a94d-320834cbcb3b_1, 100% Plus & Featured Brands, Our Brands, Fashion Plus Shop by Product, Women's Plus-Size Fashion, Fashion Plus Shop by Category, Women's Plus-Size Apparel, SPB AE AA SJC, Test Color, 19243156011ODD, New arrivals from our brands, AE Picks + DR Puffer, Business Pricing & Quantity Discounts, Amazon Essentials, Plus Stylist Brands, Featured Brands, Deals from Amazon brands, test node women, Prime Try Before You Buy: Women's Activewear, Women's fashion","B08JFZGM5S"
"Amazon Essentials Women's Classic-Fit Long-Sleeve Crewneck T-Shirt (Available in Plus Size), Burgundy, 3X","T-Shirts, 935e7a06-ca2b-4ddf-a94d-320834cbcb3b_9701, 935e7a06-ca2b-4ddf-a94d-320834cbcb3b_1, Our Brands, Fashion Plus Shop by Product, Women's Plus-Size Fashion, PTBYB x The Plus Shop, Fashion Plus Shop by Category, HG & Top Rated & Manual Plus Size (w/basics), Most Loved Plus-Size, SPB AE AA SJC, Test Color, New arrivals from our brands, Business Pricing & Quantity Discounts, Amazon Essentials, Deals from Amazon brands, test node women, Women's fashion","B0BGH683XP"
"Levi's Men's 511 Slim Fit Jeans (Also Available in Big & Tall), Fresh Blue, 30W x 29L","Jeans, Prime Day: Men's and Women's Levi's, Mens Size Inclusive, Test Color, Mens Big & Tall Fashion, 80dbd58c-5608-4346-a9d0-64e6b7f46827_744602, Business Pricing & Quantity Discounts, Prime Day: Products on deal all 48 hours, Internet Famous","B095XBRRC5"
"Trendy Queen Womens Oversized Long Sleeve T Shirts 2025 Basic Crewneck Tee Fall Tops Casual Workout Y2K Clothes Blue XL","T-Shirts, 935e7a06-ca2b-4ddf-a94d-320834cbcb3b_9701, 935e7a06-ca2b-4ddf-a94d-320834cbcb3b_1, Test Color","B0DNSQKGPB"
"Sunzel Workout Leggings for Women, Squat Proof High Waisted Yoga Pants 4 Way Stretch, Buttery Soft, Kambaba, X-Large","Leggings, b21c23e8-ac46-41ab-bfed-a824ad1360c0_601, XS-3X, Top sellers Women's Test, Top sellers Women's, Season's Deals, Everyday Apparel Essentials","B0B7J1MDNK"
"BULLIANT Men's Belt, Slide Ratchet Belt For Gift Men Dress Pant Shirt Oxfords,Trim To Fit(Sacred Grey,36""-42"" Waist Adjustable)","Belts, Top Sellers Men's, Top Sellers Men's Test","B0BQ3D2HXY"
"Fruit of the Loom womens Breathable Underwear (Regular & Plus Size) Hipster Panties, Hipster - Cooling Stripes 6 Pack Assorted Colors, US","Briefs, 935e7a06-ca2b-4ddf-a94d-320834cbcb3b_1, Bulk Buying & Case Packs, Test Color, FOTL Top 10 PASIN, 80dbd58c-5608-4346-a9d0-64e6b7f46827_578602, Everyday Apparel Essentials","B09T3VX9MF"
"Amazon Essentials Women's Classic-Fit Lightweight Long-Sleeve Turtleneck Sweater (Available in Plus Size), Dark Red, Large","Pullovers, Customer Favorites - Merch, 935e7a06-ca2b-4ddf-a94d-320834cbcb3b_1, Our Brands, Fashion Plus Shop by Product, Women's Plus-Size Fashion, PTBYB x The Plus Shop, Fashion Plus Shop by Category, HG & Top Rated & Manual Plus Size (w/basics), Most Loved Plus-Size, SPB AE AA SJC, Test Color, Customers' Most-Loved: Plus-Size, SPB_HPA_22, New arrivals from our brands, Business Pricing & Quantity Discounts, Amazon Essentials, Plus Stylist Brands, Women's See It On You, Back In Stock, Deals from Amazon brands, test node women, Prime Day 2020 Hero & Sizzle, Women's fashion, Customers' Most-Loved: Sweaters Under $30 pASIN Test","B08T7GV583"
"Healing Hands Women's Underscrub Soft Knit Melissa Longsleeve Scrub Tee with Breathable & Easy Care Fabric Pack of 2-5047, Ceil, 3XL","Clothing, Scrub Tops, 935e7a06-ca2b-4ddf-a94d-320834cbcb3b_1, Test Color, Women's Plus Size Clothing Test, Healthcare, Women's Plus Size Clothing","B0DBTX2G3C"
"Saloogoe Womens Long Sleeve Tops Casual Plain T Shirts Lightweight Pullover Cute Sweaters Grey Blue M","Tunics, 935e7a06-ca2b-4ddf-a94d-320834cbcb3b_1, Test Color, Creators trends- M&W","B0DHL4LTB9"
"OEAK Womens Comfortable Bra Wireless Bra Push Up Bralettes Soft Seamless Brassiere with Support V Neck Scalloped Everyday Bra Coffee S","Everyday Bras, 935e7a06-ca2b-4ddf-a94d-320834cbcb3b_1, Test Color, Trending, Creators trends- M&W","B0CZRP5JMQ"
"Love my boy Love my mama Matching mommy and me shirts for boy mom (6-12M tshirt, Love my Mama, Navy)","Clothing, Shoes & Accessories, Men, Women, 935e7a06-ca2b-4ddf-a94d-320834cbcb3b_9701","B09NV12128"
"CRZ YOGA Womens Butterlift High Waisted Workout Leggings 25"" - Pilates Gym Athletic Yoga Pants Buttery Soft Black Small","Leggings, Pilates & Yoga, Yoga, b21c23e8-ac46-41ab-bfed-a824ad1360c0_601, Spend $100+, get $25 off select fashion","B0D49BF1NK"
"Amazon Essentials Men's Tank Undershirts, Pack of 6, Black, Large","Undershirts, Our Brands, Men's Tops, SPB AE AA SJC, Test Color, SPB_HPA_22, New arrivals from our brands, test node men v2, Amazon Essentials, Back In Stock, Deals from Amazon brands, test node men","B0BG8DYDGW"
"OEAK Womens Push Up Everyday Bras Comfortable Wireless Bralettes V Neck Seamless Bra Smooth Brassiere Wire Free Basic Bras Black M","Everyday Bras, 935e7a06-ca2b-4ddf-a94d-320834cbcb3b_1, Test Color, Creators trends- M&W","B0CLZZ5QXK"
"SANTINY Women's Joggers Pants Pockets Drawstring Running Sweatpants for Women Lounge Workout Jogging(Deep Red_L)","Track Pants, b21c23e8-ac46-41ab-bfed-a824ad1360c0_601, 6609e2df-21bc-475b-90b2-735f42ef982c_3801, 935e7a06-ca2b-4ddf-a94d-320834cbcb3b_1, Top sellers Women's Test, Top sellers Women's, Everyday Apparel Essentials","B0BJCQQHP8"
"iGENJUN Workout Tops for Women Racerback Tank Tops Yoga Gym Ribbed Sleeveless Shirts Clothes,M,Beige","Tanks & Camis, 935e7a06-ca2b-4ddf-a94d-320834cbcb3b_9701, 935e7a06-ca2b-4ddf-a94d-320834cbcb3b_1, Test Color, Creators trends- M&W, What's Trending for her","B0D4QK1VWP"
"Luggage Tags for Cruise Ship Essentials for NCL, Princess, Carnival, Royal Caribbean and Celebrity Cruise Necessities by SEAVILIA","Luggage Tags","B0BPNS48Y9"
"Fruit of the Loom Unisex Adult Eversoft Fleece Hoodies, Pullover & Full Zip, Moisture Wicking Breathable, Sizes S-4x Hooded Sweatshirt, Red, Large US","Active Sweatshirts, 2025 SL AMRs, F2 AMRs Collections, FOTL Casualwear, Test Color, See It On You, Most-loved fashion deals","B0B7ZXS2K8"
"5 Pairs Stud Earrings Set, Hypoallergenic Cubic Zirconia 316L Earrings Stainless Steel CZ Earrings 3-8mm (Steel color)","Stud","B0CSSRV9MQ"
"Egnaro Inner Arc Ergonomic Breathable Design, Silicone Rings Mens with Half Sizes, 7 Rings / 4 Rings / 1 Ring Rubber Wedding Bands, 8.5mm Wide-2mm Thick","Wedding Rings","B0C6F6RQDS"
"Trendy Queen Womens Long Sleeve Shirts Crop Tops Square Neck Going Out Basics Tees Y2K Winter Clothes 2025 Army Green XS","T-Shirts, 935e7a06-ca2b-4ddf-a94d-320834cbcb3b_9701, 935e7a06-ca2b-4ddf-a94d-320834cbcb3b_1, Cider Top 100, Test Color, Top sellers Women's Test, Top sellers Women's","B0DGD75WCT"
"AUTOMET Long Sleeve Shirts for Women Ribbed Knit Fall Tops Casual Basic Fitted T Tshirts Tight Underscrub Slim Cotton 2024 Trendy Teen Outfits Fashion Cute Clothes Going Out Undershirt Heather Grey M","T-Shirts, 935e7a06-ca2b-4ddf-a94d-320834cbcb3b_9701, 935e7a06-ca2b-4ddf-a94d-320834cbcb3b_1, Trending, Creators trends- M&W","B0D4YK12JS"
"Amazon Essentials Men's Slim-Fit Casual Stretch Chino Pant, Raspberry Red, 40W x 30L","Casual, Our Brands, Mix-and-Match Florals for Him, Graduation Picks for Him, Back in Stock from Amazon Brands, SPB AE AA SJC, Test Color, New arrivals from our brands, test node men v2, Business Pricing & Quantity Discounts, Mens Plus Size Fashion, Amazon Essentials, Tailored Pants, Night Out, Done Right, Deals from Amazon brands, test node men, Customers' Most-Loved: Sweaters Under $30 pASIN Test","B08JHRLCZ4"
"OEAK Womens Deep V Bras Comfortable Bras Support Push Up Bralettes Low Cut no Underwire Bras Plunge Seamless Tshirts Bras Skin Color 3XL","Everyday Bras, 935e7a06-ca2b-4ddf-a94d-320834cbcb3b_1","B0DJW45433"
"Levi's Men's 501 Original Fit Jeans (Also Available in Big & Tall), All for One-Medium Indigo, 34W x 34L","Jeans, Popular brands: Men's, Prime Day: Men's and Women's Levi's, Mens Size Inclusive, Test Color, The Men's Fall Trend Edit: Head-to-Toe Denim, Mens Big & Tall Fashion, 80dbd58c-5608-4346-a9d0-64e6b7f46827_744602, Must See Deals, Prime Day: Products on deal all 48 hours, Internet Famous, Pre-Loved Apparel draft prod1","B08P53V7LP"
"Darong Women's 2 Piece Lounge Sets Long Sleeve Tops Wide Leg Pants Casual Outfits Pajama Set Fall Collection 9065B White Grey M","Sets, 935e7a06-ca2b-4ddf-a94d-320834cbcb3b_1, Test Color, Trending, Creators trends- M&W","B0D666BFD7"
"Warner's Women's Easy Does It Underarm Smoothing with Seamless Stretch Wireless Lightly Lined Comfort Bra RM3911A, Summer Sky","Everyday Bras, 935e7a06-ca2b-4ddf-a94d-320834cbcb3b_1, Most Gifted Styles, 80dbd58c-5608-4346-a9d0-64e6b7f46827_578602","B0CNDR1DL1"
"ANZERMIX Women's Breathable Cotton Thong Panties Pack of 6 (6PK Floral Dots Combo, Medium)","G-Strings & Thongs, 935e7a06-ca2b-4ddf-a94d-320834cbcb3b_1, Most Gifted Styles, Holiday Pop-In - BuzzFeed","B0D6FV1ZBR"
"Amazon Essentials Women's Classic-Fit Short-Sleeve Crewneck T-Shirt, Pack of 2, Powder Blue/Stripe, XX-Large","T-Shirts, Private Brands Outfitting BOH, 935e7a06-ca2b-4ddf-a94d-320834cbcb3b_9701, 935e7a06-ca2b-4ddf-a94d-320834cbcb3b_1, Our Brands, Back in Stock from Amazon Brands, SPB AE AA SJC, Test Color, New arrivals from our brands, Business Pricing & Quantity Discounts, Amazon Essentials, Deals from Amazon brands, test node women, Women's fashion, Customers' Most-Loved: Sweaters Under $30 pASIN Test","B08P4T6F3W"
"DLOODA Womens Wide Leg Yoga Pants Casual Work Dress Pants Lounge Sweatpants High Waist Comfy Loose Trousers with Pockets Brown","Active Pants, Pants, b21c23e8-ac46-41ab-bfed-a824ad1360c0_601","B0DDPXL8N7"
"Amazon Essentials Women's Belice Ballet Flat, Bronze, 11","Flats, Shops, Save up to 50% on fashion from Our Brands, Our Brands, Back in Stock from Amazon Brands, SPB AE AA SJC, Up to 50% off Men's and Women's Fashion from Our Brands, Test Color, New arrivals from our brands, Must See Deals, Business Pricing & Quantity Discounts, Amazon Essentials, Associates top products, Women's Shoes, Deals from Amazon brands, test node women, Fashion-forward finds, Internet Famous, Women's fashion, Women's, Customers' Most-Loved: Sweaters Under $30 pASIN Test","B07FYBDLBG"
"rivmount Winter Gloves Women Men, Thermal Ski Gloves for Cold Weather with Warm, Waterproof, Touchscreen for Running, Skiing","Gloves, Gloves, b21c23e8-ac46-41ab-bfed-a824ad1360c0_8501","B0DF598XQ1"
"SHAPERMINT Bras for Women - Bras for Women no Underwire, Bralettes for Women Plus Size, Wireless Push up Bra","Everyday Bras, 935e7a06-ca2b-4ddf-a94d-320834cbcb3b_1, Test Color","B0D9M1F7V1"
"Gildan Men's A-Shirt Tanks, Multipack, Style G1104, White (12-Pack)","Tank Tops, Gildan Top 30 PASINs, Test Color, Gildan 2024, Most Wished For Styles, Most Gifted Styles","B0CLPKWRYC"
"CRZ YOGA Womens Butterluxe Maternity Leggings Over The Belly 25"" - Buttery Soft Workout Activewear Yoga Pregnancy Pants Brown Purple X-Large","Active, WF 50% off Maternity Test Specialty Store Custom Store, 935e7a06-ca2b-4ddf-a94d-320834cbcb3b_1, WF 50% off Maternity Test Specialty Store, Test Color, Top sellers Women's Test, Top sellers Women's, Spend $100+, get $25 off select fashion","B0C9PY49LJ"
"Stelle Ballet Shoes for Girls Toddler Ballet Slippers Soft Leather Boys Dance Shoes for Toddler/Little Kid/Big Kid (Pink, 10MT)","Dance, Boys, Girls Athletic & Oxfords, Test Color, Business Pricing & Quantity Discounts, Most Wished For Styles, Most Gifted Styles","B09MVZX4CL"
"Niidor Adhesive Bra Strapless Bras for Women Sticky Invisible Push up Silicone Bra for Backless Dress Creme","Adhesive Bras, 935e7a06-ca2b-4ddf-a94d-320834cbcb3b_1","B0DBLDC7N1"
"ANRABESS Womens Sleeveless High Neck Tank Tops Fashion Summer Casual Basic Slim Fit Ribbed Racerback Top Shirt Clothes Orange Red Small","Tanks & Camis, 935e7a06-ca2b-4ddf-a94d-320834cbcb3b_9701, 935e7a06-ca2b-4ddf-a94d-320834cbcb3b_1, Test Color, Top sellers Women's Test, Top sellers Women's","B0DKJCMWX5"
"Darong Women's Classic Fit Long Sleeve Boat Neck T Shirt Y2K Tight Tshirts 9026 Dark Grey Large","T-Shirts, 935e7a06-ca2b-4ddf-a94d-320834cbcb3b_9701, 935e7a06-ca2b-4ddf-a94d-320834cbcb3b_1, Test Color","B0CKL679SP"
"SOJOS Retro Aviator Sunglasses for Women Men,Trendy Rectangle Womens Mens Shades Sun Glasses SJ2202 Black Frame Light Orange Red Lens","Sunglasses, Sunglasses, Virtual Try-on: Eyewear, Swim for Her, Top sellers Women's Test, Most Wished For Styles, Top sellers Women's, Most Gifted Styles, Season's Deals, Spend $100+, get $25 off select fashion","B09RZSC5J6"
