"Title","Categories: Sub","ASIN"
"Wonderful Pistachios In Shell, Seasoned Salt Flavored Nuts, 14 Ounce Bag, Protein Snacks, Gluten Free, Salty Snacks","Pistachios, Snacks & produce IA, Paleo-friendly foods, Game day snacks & dips, Snacks, Salty snacks, Snacks Under 5$, 15% off coupon terms and conditions, Snacks, Gluten-Free Groceries, Add toppings, Nuts, Seeds, Dried Fruits & Vegetables, d963aedb-8e7e-493c-80e7-b70e3c253824_9301, Snacks, Snacks, Game Day Snacks, Canned, Packaged & Baking, Gluten-free ingredients, Snacks under $5, Chips and Snacks, New to Fresh Snacks, Other cheese pairings, Nuts & Trail Mix, Shop & Save Terms & Conditions","B0CQ3QTMMM"
"ChocZero Healthy Mini Marshmallows - Sugar Free Marshmallow Snack - Keto Friendly, Low Carb Baking - 10.5 Ounce Box","Marshmallows, Candy & Chocolate, Canned, Packaged & Baking, All Candy Coupons, Gluten-free ingredients, Movie Night Coupons, Extra Toppings","B0C623RPLL"
"Laffy Taffy Candy, Fruit Combos, Individually Wrapped Mini Bars, 6 Ounce","Taffy, Candy & Chocolate, Easter Candy, Valentine's Day Grocery, SNAP_Sweets, Canned, Packaged & Baking, Sweet Treats from Twizzlers, Black Forest, Orbit, and more, All Candy Coupons, Movie Night Coupons, Non-chocolate candy","B0B8T8P3ZX"
"Morton Plain Salt, All-Purpose, Non-Iodized Salt, Ideal for Cooking & Table Use, (26 oz), 3-Pack","Table Salt, Condiments & sauces, Pantry Staples","B0D2759JMY"
"King Arthur Gluten-Free Pancake Mix, Non-GMO Project Verified, Kosher, 15 Ounces, Packaging May Vary (Pack of 4)","Pancakes & Waffles, Gluten-Free Groceries, d963aedb-8e7e-493c-80e7-b70e3c253824_9301, Canned, Packaged & Baking, Gluten-free ingredients","B0D14XR8KM"
"Gevalia House Blend Decaf Medium Roast Ground Coffee, 20 oz Bag","Ground Coffee, Packaged Coffee, Cozy up with coffee, Coffee & Tea, Breakfast Deals, Coffee, Save on Coffee & Tea, Beverages, Coffee Grounds, OTC, Coffee & creamer, Main Coffee Base Shoveler, Coffee & Tea","B094BHTWH3"
"Pan's Mushroom Jerky, Vegan Snacks, Dried Mushrooms Shiitake, Plant based Jerky, Meatless Jerky, Gluten Free, High in Fiber, with Curry flavor (2.2 Ounce, Pack of 1)","Jerky, Meat substitutes, APS Test, Vegan-friendly foods, Meat substitutes, Meat alternatives, Plant-Based Lifestyles, Meat & Seafood","B08N687FJS"
"Prego Three Cheese Pasta Sauce, 45 Oz Jar (Case of 6)","Tomato Sauce, Pantry, Pantry Staples","B09DR7G9HV"
"Intelligentsia Coffee, Dark Roast Whole Bean Coffee - Black Cat Sublunar 12 Ounce Bag","Roasted Coffee Beans, Packaged Coffee, Cozy up with coffee, Coffee & Tea, Coffee, Save on Coffee & Tea, Beverages, Coffee & creamer, Main Coffee Base Shoveler, Coffee & Tea, Whole Beans","B0CVJ5LMWL"
"Pure Protein Bars, High Protein, Nutritious Snacks to Support Energy, Low Sugar, Gluten Free, Brookie, 1.76oz, Pack of 4","High Protein, Snacks & produce IA, Game day snacks & dips, Snacks, Snacks Under 5$, 15% off coupon terms and conditions, Snacks, Lunchbox snacks, Gluten-Free Groceries, Snacks, Snacks, Game Day Snacks, Canned, Packaged & Baking, Snacks under $5, New to Fresh Snacks, Granola Bars, Shop & Save Terms & Conditions","B0DMTPYS2Y"
"Peet's Coffee, Medium Roast Keurig K-Cup Pods - Single Origin Brazil 88 Count (4 Boxes of 22 K-Cup Pods)","Single-Serve Capsules & Pods, Packaged Coffee, Cozy up with coffee, Coffee & Tea, Breakfast Deals, Coffee, Save on Coffee & Tea, 1, Beverages, Coffee & creamer, Main Coffee Base Shoveler, Coffee & Tea, Cups/Pods","B0B8F5LWN2"
"BetterBody Foods Organic Coconut Sugar, Gluten-Free, Non-GMO, Low Glycemic Sugar Substitute, 3.5 lbs, 56 ounces","Coconut, Whole Foods Market - Pie fillings, Canned, Packaged & Baking, Gluten-free ingredients, Sugar & Sweeteners, Sugars & Sweeteners","B0CB9DC8KP"
"Gushers Tropical Fruit Flavored Snacks 3 Ct (Pack of 5)","Fruit Snacks, Snacks & produce IA, Game day snacks & dips, Fruit Snacks, Snacks, Seasonal Snacks, Snacks Under 5$, 15% off coupon terms and conditions, Snacks, Restaurant and Bulk Food Supply, Snacks, Fruit Snacks Shov, Game Day Snacks, Canned, Packaged & Baking, Fruit Snacks, Snacks under $5, Fruit  Snacks, New to Fresh Snacks, Other cheese pairings, Fruit Snacks & Dried Fruit, Shop & Save Terms & Conditions","B0D1G53B9M"
"Bumble Bee Snack On The Run Everything Bagel Seasoning Tuna Salad With Crackers Kit, 3.35 oz - Ready To Eat, Spoon Included - Wild Caught Tuna - Shelf Stable & Convenient Protein Snack (Pack of 4)","Tuna Fish, Pantry, Pack in protein, Canned Tuna & Seafood, Pantry Staples","B0DJZ6FJB7"
"Kraft Original Mac & Cheese Macaroni and Cheese Dinner, 12 ct Pack, 7.25 oz Boxes","Macaroni & Cheese, Pantry, Pantry Staples","B0CTRY9GMS"
"STARBURST Original Jelly Beans Chewy Candy, 14 oz Bag (Pack of 3)","Jelly Beans, Candy & Chocolate, Canned, Packaged & Baking, All Candy Coupons, Movie Night Coupons, Candy, Non-chocolate candy","B0C1FYLCKT"
"Laffy Taffy Candy, Grape Flavor, Individually Wrapped Candy, (145 Pieces)","Taffy, Candy & Chocolate, Canned, Packaged & Baking, All Candy Coupons, Movie Night Coupons, Non-chocolate candy","B0BCBVYK5X"
"NOS GT Grape: High Performance Energy Drink. 16 Fl oz (Pack of 15)","Energy Drinks, Beverages, Energy Drinks, Energy drinks","B0D1T1PFYK"
"Fisher Chef's Naturals Pecan Halves 23 oz 100% Resealable Jar, Unsalted Raw Nuts for Cooking, Baking & Snacking, Vegan Protein, Keto Snack, Gluten Free Raw Pecans Halves","Pecans, Snacks & produce IA, Paleo-friendly foods, Game day snacks & dips, Snacks, Salty snacks, Snacks Under 5$, 15% off coupon terms and conditions, Snacks, Add toppings, d963aedb-8e7e-493c-80e7-b70e3c253824_4001, Nuts, Seeds, Dried Fruits & Vegetables, Snacks, Fresh, Snacks, Plant-Based Lifestyles, Game Day Snacks, Canned, Packaged & Baking, Snacks under $5, Chips and Snacks, New to Fresh Snacks, Other cheese pairings, Nuts & Trail Mix, Shop & Save Terms & Conditions","B09V6RBVJP"
"Dot's Pretzels Honey Mustard Seasoned Pretzel Twists, Healthy Kids Snacks, 16oz Grocery Sized Bag","Pretzels, Snacks & produce IA, Game day snacks & dips, Snacks, Snack favorites, Seasonal Snacks, Snacks Under 5$, 15% off coupon terms and conditions, Snacks, Snacks, Lunchbox snacks, Pretzels, Snacks, Fresh, Snacks, Game Day Snacks, Canned, Packaged & Baking, Snacks under $5, Salty Snacks, New to Fresh Snacks, Snacks, Popcorn & Pretzels, Shop & Save Terms & Conditions","B09BM9ZGF3"
"Floresta em Pé The True Organic Premium Brazil Nuts (15oz) Roasted & Himalayan Salt | KOSHER | Non-Gmo | Certified Organic | No Oil | Fresh | Vegan | Gluten Free | Keto and Paleo Friendly | Sustainably Harvested","Brazil Nuts, Snacks & produce IA, Paleo-friendly foods, Game day snacks & dips, Snacks, Salty snacks, Snacks Under 5$, 15% off coupon terms and conditions, Snacks, Add toppings, The rights fats, Nuts, Seeds, Dried Fruits & Vegetables, Snacks, Fresh, Snacks, Plant-Based Lifestyles, Game Day Snacks, Canned, Packaged & Baking, Snacks under $5, Chips and Snacks, New to Fresh Snacks, Other cheese pairings, Nuts & Trail Mix, Shop & Save Terms & Conditions","B0BGQTQ5HR"
"Koia - Plant Based Protein Shake - Cold Brew Coffee - 20g Protein, 3g Sugar, 6g Prebiotic Fiber, 21 Vitamins & Minerals - Dairy Free, Soy Free, Non GMO - Meal Replacement Drinks - 11 fl oz, 12 Bottles","Protein Drinks, Beverages, Protein drinks","B0DB6FLYN2"
"Pureboost Clean Energy Booster, Refreshing Energy Drink Mix with B12 Vitamins, Electrolytes, Antioxidants, Sugar-Free with No Sucralose (Combo Pack, 10 Count)","Energy Drinks, Beverages, Energy drinks","B0DCKHTQLD"
"Syruvia Hazelnut Coffee Syrup – 25.4 fl oz – Syrup for Coffee, Lattes, Shakes, Smoothies, Desserts – 100% Vegan, Gluten Free, Kosher Delicious Coffee Syrup, (Pack of 4)","Syrups, Plant-Based Lifestyles, Beverages","B0CGMDMW8K"
"Monster Energy Ultra Vice Guava, Sugar Free Energy Drink, 16 Ounce (Pack of 15)","Energy Drinks, Beverages, Energy Drinks, Energy drinks","B0DH59KH15"
"Bauducco Vanilla Wafers - Crispy Wafer Cookies With 3 Delicious, Indulgent, Decadent Layers of Vanilla Flavored Cream - Delicious Sweet Snack or Desert - 5.0 oz (Pack of 1)","Wafers, Snacks & produce IA, Game day snacks & dips, Snacks, Snacks Under 5$, 15% off coupon terms and conditions, Snacks, Cookies, Fresh, Snacks, Plant-Based Lifestyles, Game Day Snacks, Snack cookies, Perishables OIH, Snacks under $5, Snack Foods - Low-sodium, Bakery & Prepared Foods, Bread and bakery, OIH_breads&bakery, Sundae Store All, New to Fresh Snacks, Bakery_baked goods & sweets, Cookies and Sweets - Variety Packs, Sweet Snacks, Pastries & Bakery, Organic Bread and Bakery Items, Shop & Save Terms & Conditions","B0C6RG22VN"
"RXBAR Nut Butter and Oat Protein Bars, Protein Snacks, Snack Bars, Honey Cinnamon Peanut Butter, 23.2oz Box (12 Bars)","High Protein, High-protein, Snacks & produce IA, Game day snacks & dips, Snacks, Snacks Under 5$, Essential brands for an energized AM, 15% off coupon terms and conditions, Nutrition Bars and Shakes, Better for you breakfast, Snacks, Lunchbox snacks, Gluten-Free Groceries, Energize your morning, Favorites, Simple ingredients to fuel your AM, Snacks, Snacks, Game Day Snacks, Canned, Packaged & Baking, Snacks under $5, New to Fresh Snacks, Granola Bars, Shop & Save Terms & Conditions","B09KMWCX72"
"Stevia In The Raw Organic Stevia Sweetener Packets, 300 Ct, Zero Calorie Stevia Sugar Substitute Packets, No Erythritol or Artificial Flavors, USDA Organic, Non-GMO Project Verified, Vegan","Stevia, Grocery: More Sustainable Products, Plant-Based Lifestyles, Canned, Packaged & Baking, Sugar & Sweeteners, Sugars & Sweeteners","B0B52CJ68H"
"Bear Creek Soup Mix, Minestrone, 8.4 Ounce","Dry Soup Mixes, Meat and Soup IA, Pantry, Pantry Staples","B09ZFBMG34"
"Trident Vibes SOUR PATCH KIDS Watermelon Sugar Free Gum, 4 Bottles of 40 Pieces (160 Total Pieces)","Chewing & Bubble Gum, Candy & Chocolate, Canned, Packaged & Baking, All Candy Coupons, Movie Night Coupons, Non-chocolate candy","B0BT3BNJX1"
"Nutella Hazelnut And Cocoa Spread, 21 Mini Jars, Friends Edition, 1.05 Oz Each","Chocolate & Hazelnut Spreads, Jams & spreads, Pantry, Canned, Packaged & Baking, Chocolate Syrups & Hazelnut Spreads, Jelly, jam, and nut butters","B09CG9LVKK"
"Prego Sweet Sausage and Roasted Peppers Pasta Sauce, 23.5 OZ Jar (Case of 6)","Tomato Sauce, Pantry, Gluten-Free Groceries, Restaurant and Bulk Food Supply, d963aedb-8e7e-493c-80e7-b70e3c253824_9301, Pantry Staples","B0B359HQPJ"
"Lucy's Family Owned - 34oz. GLASS BOTTLE (2 PACK) Organic, With the Mother, Apple Cider Vinegar, Unfiltered, Unpasteurized, Raw, and NonGMO","Apple Cider, Grocery: More Sustainable Products, Canned, Packaged & Baking","B0B8PHNM8S"
"Kinder Bueno, 5 Pack, Milk Chocolate and Hazelnut Cream, Stocking Stuffers, 2 Individually Wrapped Chocolate Bars per Pack, 7.5 oz","Candy & Chocolate Bars, Test01, Candy & Chocolate, Snacks, Canned, Packaged & Baking, All Candy Coupons, Chocolate, National Candy Month, Chocolate","B09LNYR72H"
"EXTRA Refreshers Fruit Mix Sugar Free Chewing Gum Bulk, 40 Piece Bottle (Pack of 6)","Chewing & Bubble Gum, Candy & Chocolate, Restaurant and Bulk Food Supply, Canned, Packaged & Baking, All Candy Coupons, Movie Night Coupons, Non-chocolate candy","B0BZFHRH5H"
"Lavazza Dolcevita Classico, Single-Serve Keurig K-Cup Pods, Medium Roast Coffee, 88-Count Box (4 Packs of 22)","Single-Serve Capsules & Pods, Packaged Coffee, Cozy up with coffee, Coffee & Tea, Breakfast Deals, Coffee, Save on Coffee & Tea, 1, Beverages, Coffee & creamer, Main Coffee Base Shoveler, Coffee & Tea, Cups/Pods","B0BFFPLLD5"
"Lavazza Dolcevita Classico, Single-Serve Keurig K-Cup Pods, Medium Roast Coffee, 40-Count Box","Single-Serve Capsules & Pods, Packaged Coffee, Cozy up with coffee, Coffee & Tea, Breakfast Deals, Coffee, Save on Coffee & Tea, 1, Beverages, OTC, Coffee & creamer, Main Coffee Base Shoveler, Coffee & Tea, Cups/Pods","B08ZVDH4G7"
"NESCAFÉ CLÁSICO Colombia, Medium Roast Instant Coffee, 6 oz. Jar","Instant Coffee, Cozy up with coffee, Coffee & Tea, Breakfast Deals, Coffee, Save on Coffee & Tea, Beverages, Coffee & creamer, Main Coffee Base Shoveler, Coffee & Tea, Instant Coffee","B0BHHN2C6H"
"Saratoga Sparkling Spring Water Bottle PET, 16 Oz, 24-Pack","Carbonated Water, Sparkling water, Sparkling Water, Soda and cocktail mixers, Beverages, Sparkling water, Sparkling water, Drinks, Sparkling Water, Baverages, Beverages, Beverages, Water, Sparkling Water, Beverages, CSD and Water, BBQ Beverages, All Sparkling Water, Springtime Beverages, Beverages for Summer, Sparkling  Water","B0D49ML63Z"
"TEARELAE - Cinnamon Tea, 40 Count - Pure Cinnamon Sticks Tea Bags - Hot Cinnamon Spice Tea - Rich in Antioxidants - Non-GMO - Caffeine-Free","Herbal, Coffee & Tea, Tea, Save on Coffee & Tea, Coffee & Tea","B0DF2FMYC6"
"Amazon Brand - Happy Belly Coarse Ground Black Pepper, 3 ounce (Pack of 2)","Ground Pepper, Condiments & sauces, Happy Belly, Prime foods at just-right prices, Pantry Staples","B0D14YZ2LC"
"Tiesta Tea - Pumpkin Spice Rooibos Tea | Premium Loose Leaf Tea Blend | Non-Caffeinated Herbal Infusion | Make Hot or Iced & Up to 25 Cups | Made with Natural Ingredients - 2oz Resealable Pouch","Herbal, Coffee & Tea, Tea, Save on Coffee & Tea, Gluten-Free Groceries, d963aedb-8e7e-493c-80e7-b70e3c253824_9301, Coffee & Tea","B0CF62DVDB"
"KIND Breakfast Bars, Healthy Snacks, Peanut Butter, Gluten Free, Whole Grains and Oats, 5g Protein, 30 Count","High Protein, Snacks & produce IA, Game day snacks & dips, Snacks, Snacks Under 5$, 15% off coupon terms and conditions, Snacks, Lunchbox snacks, Gluten-Free Groceries, Snacks, Snacks, Game Day Snacks, Canned, Packaged & Baking, Snacks under $5, New to Fresh Snacks, Granola Bars, Shop & Save Terms & Conditions","B0BLTF5RXR"
"SodaStream - Diet Mountain Dew Soda Drink Mix | For Sparkling Water Makers | Zero Calories | 51mg Caffeine per Serving | Makes 96 Servings | 14.9 Fl Oz, Pack of 4 Packaging may vary","Soft Drinks, Soda and cocktail mixers, Beverages, Beverages, Bebidas, Drinks, Quench your thirst, Beverages, Soda, Beverages, CSD and Water, BBQ Beverages, Movie Night Coupons, Soft Drinks, Soft Drinks, Springtime Beverages, Beverages for Summer","B0CS191QMW"
"Red Bull Red Edition Energy Drink, Watermelon, with 114mg Caffeine plus Taurine & B Vitamins, 12 Fl Oz, 6 Packs of 4 Cans (Pack of 24)","Energy Drinks, Beverages, Energy Drinks, Energy drinks","B0BMSJ49JM"
"La Tourangelle, Organic Canola Oil, Expeller-Pressed Non-GMO Canola Seeds, Pesticide and Chemical Free, High Heat Neutral Cooking Oil, 169 fl oz","Canola, Oils, Gluten-Free Groceries, d963aedb-8e7e-493c-80e7-b70e3c253824_4001, d963aedb-8e7e-493c-80e7-b70e3c253824_9301, Plant-Based Lifestyles, Canned, Packaged & Baking, Gluten-free ingredients","B0BRYR2VWP"
"Quaker Large Rice Cakes, Lightly Salted, Pack of 6","Cakes, Snacks & produce IA, Game day snacks & dips, Snacks, Salty snacks, Snacks Under 5$, 15% off coupon terms and conditions, Snacks, Game Day Snacks, Canned, Packaged & Baking, Snacks under $5, New to Fresh Snacks, Shop & Save Terms & Conditions","B0BRQSN1FZ"
"Ripple Plant Based Protein Shake Variety Pack | 20g of Quality Sourced Pea Protein, Calcium Rich | Shelf Stable | Vegan & Non GMO | Dairy, Soy, Nut, & Gluten Free | 12 Fl Oz Bottles (Pack of 12)","Protein Drinks, Sports Nutrition Sample Box Credit, Plant-Based Lifestyles, Beverages, Protein drinks","B0C1ZVM9TF"
"ASPIRE® Fruit Punch, Healthy Energy Drink with Low Caffeine, No Sugar, Carbs, and Keto Friendly, 24 Pack","Energy Drinks, Gluten-Free Groceries, d963aedb-8e7e-493c-80e7-b70e3c253824_9301, Beverages, Energy Drinks, Energy drinks","B0CSZ7YD46"
"Almond Breeze Dairy Free Almondmilk, Unsweetened Vanilla, 32 Ounce (Pack of 6)","Almond Milk, Dairy alternatives, Dairy alternatives, Dairy & dairy alternatives, Dairy-free, Dairy and yogurt alternatives, Local Dairy, Cheese & Eggs, Dairy, eggs, & plant based alternatives, Breakfast Deals, Breakfast Dairy, OIH_DCE, Cereal and milk, DCE_milk and cream (+ND), Perishables OIH, Non-Dairy, Plant-based milk, Non-dairy milk, Dairy Milk & Non Dairy Milk, Non Dairy Milk, Under $5 dairy, 10% off DCE","B08SX3YX2B"
"Peet's Coffee, Medium Roast Espresso Capsules, Compatible with Nespresso Original Machine - Caramel, 50 Count (5 Boxes of 10 Espresso Capsules)","Single-Serve Capsules & Pods, Packaged Coffee, Cozy up with coffee, Coffee & Tea, Breakfast Deals, Coffee, Save on Coffee & Tea, 1, Beverages, Coffee & creamer, Main Coffee Base Shoveler, Coffee & Tea, Cups/Pods","B0C3P4JTXL"
"Pomona Organic Juices Pure Watermelon Juice, Cold Pressed Organic Juice, Non-GMO, No Sugar Added, Not from Concentrate, Gluten Free, Kosher Certified, Preservative Free, 8.4 Ounce (Pack of 12)","Fruit Juice, Fruit juice, Refreshing beverages, Bebidas, Gluten-Free Groceries, Quench your thirst, Morning beverages, d963aedb-8e7e-493c-80e7-b70e3c253824_9301, Plant-Based Lifestyles, Beverages, Beverages, Beverages for Summer, Juice","B0BTJWHKMQ"
"Nongshim Premium Shin Black Instant Ramen Noodle Cup, 6 Pack, Bold & Spicy, Beef Bone Broth, Microwaveable Ramen Soup Mix","Noodle Soups, Asian Cuisine, Featured SNAP-eligible groceries","B076X6LYCG"
"REESE'S Big Cup Chocolate Lava Milk Chocolate Peanut Butter Cups, Candy Packs, 1.4 oz (16 Count)","Chocolate Candy, Test01, Candy & Chocolate, Snacks, Canned, Packaged & Baking, All Candy Coupons","B0DBR6VSC7"
"Welch's Singles To Go Variety Pack, Watertok Powdered Drink Mix, Includes 4 Flavors, Grape, Passion fruit, Strawberry Peach, Cherry Pomegranate, 1 Box (40 Servings)","Soft Drink Mixes","B0CT42ZMSZ"
"Kewpie Squeeze Tube Mayonnaise - 12 Oz, ivory","Mayonnaise, Pantry, Faves, Condiments & sauces, Gluten-Free Groceries, Canned, Packaged & Baking, BYOBurger, Condiments, Pantry Staples","B08P966276"
"Jif Natural Creamy Peanut Butter Spread and Honey – Contains 80% Peanuts, 16 Ounces","Peanut Butter, Jams & spreads, Pantry, Featured Holiday Foods, Featured SNAP-eligible groceries, Smucker's Baking Foods, New Year New You - Healthy Eating, Canned, Packaged & Baking, JIF & Fruit, Peanut butter and jelly spreads, SANDWICH STORE, ILM ASINs B, Jelly, jam, and nut butters","B00FWUEITC"
"OREO Game Day Chocolate Sandwich Cookies, Limited Edition, 10.68 oz","Sandwich, Snacks & produce IA, Game day snacks & dips, Snacks, Snacks Under 5$, 15% off coupon terms and conditions, Snacks, Lunchbox snacks, Cookies, Snacks, Game Day Snacks, Snack cookies, Perishables OIH, Snacks under $5, Bakery & Prepared Foods, Bread and bakery, OIH_breads&bakery, Sundae Store All, New to Fresh Snacks, Bakery_baked goods & sweets, Cookies and Sweets - Variety Packs, Pastries & Bakery, Organic Bread and Bakery Items, Shop & Save Terms & Conditions","B0DDML7HT9"
"Dry Roasted Brazil Nuts Sea Salted 64oz (4 lb) | No oil | No Herbicides Or Pesticides | Batch Tested Gluten & Peanut Free | Non GMO | No PPO | Vegan and Keto Friendly | Premium Quality | Made from 100% Natural Brazil Nuts","Brazil Nuts, Snacks & produce IA, Paleo-friendly foods, Game day snacks & dips, Snacks, Salty snacks, Snacks Under 5$, 15% off coupon terms and conditions, Snacks, Add toppings, The rights fats, Nuts, Seeds, Dried Fruits & Vegetables, Snacks, Fresh, Snacks, Plant-Based Lifestyles, Game Day Snacks, Canned, Packaged & Baking, Snacks under $5, Chips and Snacks, New to Fresh Snacks, Other cheese pairings, Nuts & Trail Mix, Shop & Save Terms & Conditions","B09W9YQ6JY"
"NOW Foods, Certified Organic Monk Fruit Liquid, Zero-Calorie Liquid Sweetener, Non-GMO, Low Glycemic Impact, 16-Ounce","Stevia, Canned, Packaged & Baking, Sugar & Sweeteners, Sugars & Sweeteners","B0DDZSY9GG"
"Ghirardelli Chocolate Company Sea Salt Caramel Sauce Pump Bottle, 87.3 oz","Caramel, Gluten-Free Groceries, Canned, Packaged & Baking, Gluten-free ingredients, Sundae Store All, Chocolate Syrups & Hazelnut Spreads, Sauce","B09Z63XNBW"
"Lavazza Espresso, Single-Serve Keurig K-Cup Pods, Medium Roast Coffee, 40-Count Box","Single-Serve Capsules & Pods, Packaged Coffee, Cozy up with coffee, Coffee & Tea, Breakfast Deals, Coffee, Save on Coffee & Tea, 1, Beverages, OTC, Coffee & creamer, Main Coffee Base Shoveler, Coffee & Tea, Cups/Pods","B08ZVYVMV7"
"Bizzy Organic Cold Brew Coffee | Dark & Bold Blend | Coarse Ground Coffee | Dark Roast | Micro Sifted | Specialty Grade | 100% Arabica | 2 LB","Iced Coffee & Cold-Brew, Coffee & Tea, Breakfast Deals, Coffee, Save on Coffee & Tea, Morning beverages, Beverages, Cold Brew/Iced Coffee, Coffee & creamer, Main Coffee Base Shoveler, Coffee & Tea","B0BKNZ3DP9"
"Sunbelt Bakery Peanut Sweet & Salty Chewy Granola Bars, 120-1.0 OZ Bars (12 Boxes)","Granola, Snacks & produce IA, Game day snacks & dips, Snacks, Snacks Under 5$, 15% off coupon terms and conditions, Snacks, Lunchbox snacks, Snacks, Snacks, Game Day Snacks, Canned, Packaged & Baking, Snacks under $5, New to Fresh Snacks, Granola Bars, Granola Bar, Shop & Save Terms & Conditions","B09V6TKNHR"
"Black Rifle Coffee Company Five Alarm, Medium Roast Ground Coffee, 12 OZ Bag","Ground Coffee, Packaged Coffee, Cozy up with coffee, Coffee & Tea, Breakfast Deals, Coffee, Save on Coffee & Tea, Beverages, Coffee Grounds, Coffee & creamer, Main Coffee Base Shoveler, Coffee & Tea","B0BDPG2D2K"
"L'OR Espresso Capsules, 50 Count Variety Pack, Single-Serve Aluminum Coffee Capsules Compatible with the L'OR BARISTA System & *Nespresso Original Machines","Single-Serve Capsules & Pods, Packaged Coffee, Cozy up with coffee, Coffee & Tea, Coffee, Save on Coffee & Tea, 1, Beverages, Coffee & creamer, Main Coffee Base Shoveler, Coffee & Tea, Cups/Pods","B0CKGH85V5"
"Ensure Max Protein Milk Chocolate with Caffeine Nutrition Shake | 30g Protein, 1g Sugar, 4g Fiber Blend | 12 Pack","Protein Drinks, Sports Nutrition Sample Box Credit, Beverages, Protein drinks","B08WHYHPL5"
"M&M'S Fudge Brownie Chocolate Candy Party Size, 34 oz Bag","Fudge, Candy & Chocolate, Restaurant and Bulk Food Supply, Canned, Packaged & Baking, All Candy Coupons, National Candy Month, Chocolate, Movie Night Coupons, Snacks, Candy, Chocolate-Covered Nuts & Pretzels, Non-chocolate candy","B08LRKZMYQ"
"BetterBody Foods Organic Cacao Powder, Rich Chocolate Flavor, Non-GMO, Gluten-Free, 32 Ounce, 2 lb bag","Cocoa, Organic Groceries, Gluten-Free Groceries, d963aedb-8e7e-493c-80e7-b70e3c253824_9301, Canned, Packaged & Baking, Gluten-free ingredients, Extra Toppings","B0DJHDPQZ1"
"Orchard Valley Harvest Dark Chocolate Dipped Cherries, 8 oz (Pack of 3), Made With Real Cherries, Gluten Free, Non-GMO, No Artificial Colors, Stand Up Bag, On-The-Go Snack For The Whole Family","Fruit, Test01, Candy & Chocolate, Snacks, Canned, Packaged & Baking, All Candy Coupons","B0CW7D637Q"
"OREO Chocolate Sandwich Cookies, Party Size, 24.16 oz","Sandwich, Snacks & produce IA, Game day snacks & dips, Snacks, Snacks Under 5$, 15% off coupon terms and conditions, Snacks, Lunchbox snacks, Cookies, Restaurant and Bulk Food Supply, Snacks, Game Day Snacks, Halloween Party, Snack cookies, Perishables OIH, Snacks under $5, Holiday Snacks, Snack Foods - Low-sodium, Bakery & Prepared Foods, Bread and bakery, Hosting Hub, OIH_breads&bakery, Sundae Store All, New to Fresh Snacks, Dessert and Candy, Bakery_baked goods & sweets, Cookies and Sweets - Variety Packs, Snacks, Pastries & Bakery, Organic Bread and Bakery Items, Shop & Save Terms & Conditions","B0CJ44HMBF"
"That's it. Apple + Strawberry 100% Natural Real Fruit Bar, Best High Fiber Vegan, Gluten Free Healthy Snack, Paleo for Children & Adults, Non GMO No Sugar Added, No Preservatives Energy Food (12 Pack)","Fruit Bars, Snacks & produce IA, Game day snacks & dips, Snacks, Snacks Under 5$, 15% off coupon terms and conditions, Snacks, Lunchbox snacks, Snacks, Snacks, Plant-Based Lifestyles, Game Day Snacks, Canned, Packaged & Baking, Snacks under $5, Fruit & Nut Bars, New to Fresh Snacks, Shop & Save Terms & Conditions","B0BX7FW3VN"
"SweetLeaf Stevia Liquid Sweet Drops - Liquid Stevia Sweetener, Sugar-Free Pumpkin Spice Syrup Alternative for Keto Coffee and More, 2 Fl Oz (Pack of 2)","Stevia, Canned, Packaged & Baking, Sugar & Sweeteners, Sugars & Sweeteners","B071434WNN"
"Sunny Fruit Organic Probiotic Prunes - 1 Bag (5 Individual Portion Packs) | Convenient Dried Plums Snack with Live Probiotics | ORGANIC, NON-GMO, KOSHER, HALAL, NO PRESERVATIVES, NO SUGAR ADDED","Dried Prunes, Salad toppings, Snacks & produce IA, Game day snacks & dips, Snacks, APS Test, Snacks Under 5$, 15% off coupon terms and conditions, Salads, Fresh produce, Snacks, Nuts, Seeds, Dried Fruits & Vegetables, Game Day Snacks, Canned, Packaged & Baking, Snacks under $5, Fresh and dried fruit, Deals_FreshProduce, New to Fresh Snacks, Fruit Snacks & Dried Fruit, Shop & Save Terms & Conditions","B0CTC4M8XW"
"Jack Link's Beef Jerky, Sweet & Hot and Peppered, Flavorful Everyday Snack, Made with 100% Beef – 96% Fat Free, No Added MSG** – 9 Oz. (Pack of 4)","Jerky, Snacks & produce IA, Game day snacks & dips, Snacks, Salty snacks, Snacks Under 5$, 15% off coupon terms and conditions, Snacks, Game Day Snacks, Canned, Packaged & Baking, Snacks under $5, New to Fresh Snacks, Other cheese pairings, Shop & Save Terms & Conditions","B0CC3YK8VX"
"Starbucks Nitro Cold Brew Coffee, Splash of Sweet Cream, 9.6 fl oz Cans, Iced Coffee, Cold Brew Coffee, Coffee Drink (Pack of 8)","Ready to Drink Liquid Coffee, Coffee & Tea, Breakfast Deals, Coffee, Save on Coffee & Tea, Morning beverages, Beverages, Coffee & creamer, Main Coffee Base Shoveler, Coffee & Tea, RTD Coffee","B09QQQ6YSC"
