"Title","Categories: Sub","ASIN"
"SPLENDA Sugar Free, Low Calorie French Vanilla Coffee Creamer, 8 Fl Ounces Bottle (Pack of 6)","Coffee Creamers, Local Dairy, Cheese & Eggs, Dairy & dairy alternatives, APS Test 2, Breakfast Dairy, Save on Dairy, Cheese & Eggs, OIH_DCE, Coffee & creamer, DCE_milk and cream (+ND), Perishables OIH, Dairy and Non-Dairy Creamers, NYNY Dairy Essentials, Milk & Cream, 10% off DCE","B0D81KCQB6"
"Sauer's Imitation Vanilla Extract, 1 Quart (Pack of 1)","Mixed Spices & Seasonings, Condiments & sauces, Canned, Packaged & Baking, Pantry Staples","B0DH12JBN4"
"Community Coffee French Roast Ground Coffee, Extra Dark Roast, 32 Ounce (Pack of 3)","Ground Coffee, Packaged Coffee, Cozy up with coffee, Coffee & Tea, Breakfast Deals, Coffee, Save on Coffee & Tea, Beverages, Coffee Grounds, Coffee & creamer, Main Coffee Base Shoveler, Coffee & Tea","B0C1H8RLN3"
"Jocko Fuel Blue Raspberry Energy Drink, 12 Pack, 0 Sugar, 95mg Caffeine, Supports Brain Health","Energy Drinks, Same-Day New Year Grocery, Beverages, Energy Drinks, Energy drinks","B0CJ635JM5"
"Red Bull Coconut Edition Energy Drink, Coconut Berry, with 80mg Caffeine plus Taurine & B Vitamins, 8.4 Fl Oz, Pack of 12 Cans","Energy Drinks, Beverages, Energy Drinks, Energy drinks","B092N6TKLN"
"Ka’Chava All-In-One Nutrition Shake Blend, Vanilla, 85+ Superfoods, Nutrients & Plant-Based Ingredients, 26g Vitamins and Minerals, 25g Plant-Based Protein, 2lb","Meal Replacement Drinks, Beverages","B0C93QG4MD"
"King Arthur Baking Organic Medium Rye Flour - 3 lbs for Complex Flavorful Breads & Baked Goods - 100% US Grown & Milled - Non-GMO Project Verified - Robust Flavor for Rye Bread, Cookies & More","Flours & Meals, Organic Groceries, Grocery: More Sustainable Products, Pantry Staples, Canned, Packaged & Baking, New to CPF, Flour & Meal, Mother's Day Bake Products, Mother's Day Deals, Mother's Day, Deals","B08HZJJ61J"
"Amazon Brand - Happy Belly Cappuccino Coffee Pods Light Roast Compatible with 2.0 K-Cup Brewers, French Vanilla Flavored, 24 Count, 1.5 pound (Pack of 1)","Single-Serve Capsules & Pods, Packaged Coffee, Cozy up with coffee, Coffee & Tea, Happy Belly, Breakfast Deals, Coffee, Save on Coffee & Tea, SNAP-eligible beverages, SNAP Beverages, Prime foods at just-right prices, 1, Beverages, Coffee & creamer, Main Coffee Base Shoveler, Coffee & Tea, EDLP US, Cups/Pods","B0B6DHVC2R"
"Don Francisco's Kona Blend Medium Roast K-Cup Single-Serve Coffee Pods, 55 Count - 10% Hawaiian, Compatible with Keurig Brewers, Recyclable through TerraCycle","Single-Serve Capsules & Pods, f2acaa74-dfe3-426c-b654-a431ad2c4e38_447902, Packaged Coffee, Cozy up with coffee, Coffee & Tea, Breakfast Deals, Coffee, Save on Coffee & Tea, 1, Beverages, OTC, Coffee & creamer, Main Coffee Base Shoveler, Coffee & Tea, Cups/Pods","B07Y47Z5ZJ"
"Canada Dry Ginger Ale Soda, 12 fl oz cans, 12 pack","Soft Drinks, Beverages, Soda and cocktail mixers, Beverages, Bulk beverages, Beverages, Bebidas, Drinks, Beverages, Quench your thirst, Beverages, SNAP Soda, SNAP Beverages, Cold beverages, Beverages, Memorial Day Coupons, Summer Alcohol Program, Amazon Fresh clearance on everyday staples, Clearance on everyday selection, Halloween Party, Soda, Summer Store 2024, Clearance on everyday staples, Coca-Cola Holiday, ILM ASINs A, Clearance on goods, 7UP and Canada Dry Holiday, Amazon Fresh clearance on everyday items, Beverages, Amazon Fresh clearance on everyday select items, CSD and Water, All Super Bowl 2024, Hosting beverages 2023, Amazon clearance on goods, UWA_US_OIH_top_discounts, Drinks for dinner, ALL BEVS MULTIPACKS (no packaged c&t), Stock up on fan favorites, BBQ Beverages, Movie Night Coupons, Halloween beverages 2023, 2023 NYE, Soft Drinks, CSD Multipacks, Clearance selection, CSD and Water Multipacks, Amazon clearance on everyday staples, Coca-Cola Brands, Ginger Ale 2022, Soft Drinks, Prime Day 2023 Selection, Football beverages 2023, Springtime Beverages, Beverages for Summer, Clearance on everyday items, Amazon clearance selection, Amazon Fresh clearance items, Hosting Beverages_Fr92220, Coca-Cola, Super Bowl (Multi-Category), Drinks, Clearance on staples","B000WHR2XO"
"Cafe Du Monde Coffee Chicory, 15 Ounce Ground (Pack of 2)","Ground Coffee, Packaged Coffee, Cozy up with coffee, Coffee & Tea, Coffee, Save on Coffee & Tea, Beverages, Coffee Grounds, Coffee & creamer, Main Coffee Base Shoveler, Coffee & Tea","B0D14X6C61"
"Heinz tomato ketchup 1070g ~ 6 this","Ketchup, Pantry, Condiments & sauces, Canned, Packaged & Baking, BYOBurger, Condiments, Condiments, Pantry Staples","B00BLDKPGO"
"Peet's Coffee, Dark Roast Keurig K-Cup Pods - Major Dickason's Blend 88 Count (4 Boxes of 22 K-Cup Pods)","Single-Serve Capsules & Pods, Packaged Coffee, Cozy up with coffee, Coffee & Tea, Breakfast Deals, Coffee, Save on Coffee & Tea, SNAP Coffee, SNAP Beverages, 1, Beverages, Coffee & creamer, Main Coffee Base Shoveler, Coffee & Tea, Cups/Pods","B09WJ73WB7"
"Bundle of PLANTERS Honey Roasted Peanuts, 16 oz. + PLANTERS Deluxe Honey Roasted Whole Cashews, 8.25oz (1 Canister) + PLANTERS Deluxe Lightly Salted Whole Cashews 18.25oz (1 Canister)","Peanuts, Snacks & produce IA, Paleo-friendly foods, Game day snacks & dips, Snacks, Salty snacks, Snacks Under 5$, 15% off coupon terms and conditions, Snacks, Add toppings, The rights fats, Nuts, Seeds, Dried Fruits & Vegetables, Snacks, Fresh, Snacks, Game Day Snacks, Canned, Packaged & Baking, Snacks under $5, Chips and Snacks, New to Fresh Snacks, Other cheese pairings, Nuts & Trail Mix, Shop & Save Terms & Conditions","B0C6BTKMT8"
"Blue Diamond, Holiday Frosted Brownie Flavored Sweet Snack Nut Almonds Perfect Size for On-The-Go, Holidays and Gatherings, Lunch, Adults and Kids, 6oz Can","Almonds, Snacks & produce IA, Paleo-friendly foods, Game day snacks & dips, Snacks, Salty snacks, Snacks Under 5$, 15% off coupon terms and conditions, Snacks, Add toppings, The rights fats, Nuts, Seeds, Dried Fruits & Vegetables, Snacks, Keto-friendly foods, Snacks, Game Day Snacks, Canned, Packaged & Baking, Snacks under $5, Chips and Snacks, New to Fresh Snacks, Other cheese pairings, Nuts & Trail Mix, Shop & Save Terms & Conditions","B0D8WSKSKJ"
"bubly Sparkling Water, Zero Sugar & Zero Calories, Seltzer Water, Orange Creamsicle, 12 Fl Oz Cans (Pack of 8)","Carbonated Water, Sparkling water, Sparkling Water, Soda and cocktail mixers, Beverages, Sparkling water, Sparkling water, Drinks, Sparkling Water, Baverages, Beverages, Beverages, Water, Sparkling Water, Beverages, CSD and Water, BBQ Beverages, All Sparkling Water, Springtime Beverages, Beverages for Summer, Sparkling  Water","B0BG8VQJ2R"
"YORK Dark Chocolate Snack Size Peppermint Patties, Candy Pantry Pack, 15 oz (25 Pieces)","Candy & Chocolate Bars, Test01, Candy & Chocolate, SNAP_Sweets, Snacks, Canned, Packaged & Baking, All Candy Coupons, Chocolate, National Candy Month, Chocolate","B09MJHCPGZ"
"Peet's Coffee, Medium Roast Keurig K-Cup Pods - Big Bang, 32 Count (1 Box of 32 K-Cup Pods)","Single-Serve Capsules & Pods, Packaged Coffee, Cozy up with coffee, Coffee & Tea, Coffee, Save on Coffee & Tea, 1, Beverages, Coffee & creamer, Main Coffee Base Shoveler, Coffee & Tea, Cups/Pods","B0D2RX1XHJ"
"Bumble Bee Chunk Light Tuna In Oil, 5 oz Cans (Pack of 4) - Wild Caught Skipjack Tuna - 22g Protein Per Serving - MSC Certified Sustainable Seafood, Non-GMO, Gluten Free, Kosher","Tuna Fish, Pantry, Pack in protein, Canned Tuna & Seafood, Pantry Staples","B0B3FPXS7F"
"DaVinci Gourmet Naturals Strawberry Syrup, 25.4 Fluid Ounces (Pack of 1)","Syrups, Beverages","B09Z37GWFS"
"BODYARMOR Caffeine Flash I.V. Dragonfruit Berry flavored Electrolyte Mix, 0.28 oz Packets, 6 Pack","Sports Drinks, Refreshing beverages, Beverages, Quench your thirst, Beverages, Sports drinks, Sports Drinks, Springtime Beverages, Beverages for Summer","B0DHLL72TH"
"Candy Variety Pack - 4 Count Assorted Lollipops - Ring Pop, Push Pop, Baby Bottle Pop & Juicy Drop - Ideal for Birthdays, Party Favors, Celebrations & Candy Gifts by Bazooka Candy Brands","Suckers & Lollipops, Candy & Chocolate, Canned, Packaged & Baking, All Candy Coupons, Movie Night Coupons, Non-chocolate candy","B0DS2X65BG"
"Gatorade G Zero Powder, Fruit Punch Variety Pack, 0.10oz Individual Packets - 10 Count (Pack of 5)","Sports Drinks, SPORTS & ENERGY DRINKS, Refreshing beverages, Beverages, Quench your thirst, Beverages, Sports drinks, OTC, Sports Drinks, Springtime Beverages, Beverages for Summer","B08VG1FLK1"
"Mighty Sesame Co. Organic Tahini, Squeezable Creamy & Ready Tahini Paste, 10.9oz | Gluten Free, Vegan, Non GMO, Keto Friendly, Plant Based Protein, Kosher","Dips, Salsas & Spreads, Game day & Cheese LP IA, APS Test, Safe & Healthy Customer Favorites, Dips, Grocery: More Sustainable Products, Gluten-Free Groceries, Best Selling USDA Organic Products, Fresh Dips, Fresh, Plant-Based Lifestyles, Deli & Prepared, Dips, Vegan deli, Perishables OIH, Dips, Dips to pair with your favorite veggies, Chips and Snacks, OIH_Deli & Prep, All Deli & Prepared Foods","B0796HH5F4"
"ROSSO CAFFÈ Espresso Coffee Pods, Compatible with Nespresso Original Machines, Reserve Variety Pack, 80 Capsules - Made in Italy","Single-Serve Capsules & Pods, Packaged Coffee, Cozy up with coffee, Grocery & Gourmet Food Made in Italy, Coffee & Tea, Breakfast Deals, Coffee, Save on Coffee & Tea, 1, Beverages, Coffee & creamer, Main Coffee Base Shoveler, Coffee & Tea, Cups/Pods","B09DT9LTS9"
"Lotus Biscoff Cookies, Caramelized Biscuit Cookies, 160 Cookies (8 Sleeves of 10 XL Size Two-Packs) Vegan, 8.8 Ounce (Pack of 8)","Cookies, Snacks & produce IA, Game day snacks & dips, Snacks, Snacks Under 5$, 15% off coupon terms and conditions, Snacks, Cookies, Snacks, Plant-Based Lifestyles, Game Day Snacks, Snack cookies, Perishables OIH, Snacks under $5, Bakery & Prepared Foods, Bread and bakery, OIH_breads&bakery, Sundae Store All, New to Fresh Snacks, Bakery_baked goods & sweets, Cookies and Sweets - Variety Packs, Pastries & Bakery, Organic Bread and Bakery Items, Shop & Save Terms & Conditions","B0CRJV31Y7"
"Tillamook Country Smoker Zero Sugar Spicy Jalapeño Keto Friendly Smoked Sausages, 10 Ounce (Pack of 2)","Jerky, Snacks & produce IA, Game day snacks & dips, Snacks, Salty snacks, Snacks Under 5$, 15% off coupon terms and conditions, Snacks, Game Day Snacks, Canned, Packaged & Baking, Snacks under $5, New to Fresh Snacks, Other cheese pairings, Shop & Save Terms & Conditions","B0B2XDX5JY"
"Butterfinger, CRUNCH, Baby Ruth and 100 Grand, Bulk 60 Pack, Assorted Fun Size Chocolate Candy Bars, Stocking Stuffers, 37.2 oz","Candy & Chocolate Bars, f2acaa74-dfe3-426c-b654-a431ad2c4e38_946602, Test01, Candy & Chocolate, Restaurant and Bulk Food Supply, SNAP_Sweets, Snacks, Canned, Packaged & Baking, All Candy Coupons, Chocolate","B09NMX9CGB"
"LIFE SAVERS Pep-O-Mint Breath Mint Bulk Hard Candy, Party Size, 44.93 oz Bag","Mints, f2acaa74-dfe3-426c-b654-a431ad2c4e38_946602, Candy & Chocolate, Restaurant and Bulk Food Supply, Canned, Packaged & Baking, All Candy Coupons, Clearance on everyday selection, National Candy Month, Superbowl Event, Hosting Hub, Dessert and Candy, Movie Night Coupons, Gum and mints, Non-chocolate candy, Super Bowl (Multi-Category)","B09VRGNNWJ"
"TRUE LEMON KIDS Wild Watermelon (10 Packets) - Hydration for Kids - No Preservatives, No Artificial Flavors & Sweeteners - Low Sugar Water Flavoring - Juice Powdered Drink Mix","Soft Drink Mixes, All Beverages","B09NYKFZR5"
"Amazon Brand - Happy Belly Cashews, Roasted & Salted, 16 ounce","Cashews, Salad toppings, Snacks & produce IA, Paleo-friendly foods, Game day snacks & dips, Snacks, Salty snacks, Snacks Under 5$, 15% off coupon terms and conditions, Happy Belly, Salads, Snacks, Add toppings, Nuts & Trail Mix by Happy Belly, an Amazon Brand, Nuts, Seeds, Dried Fruits & Vegetables, Snacks, Fresh, Snacks, Prime foods at just-right prices, Game Day Snacks, Canned, Packaged & Baking, OTC, Snacks under $5, Chips and Snacks, New to Fresh Snacks, RFS Food, Other cheese pairings, Nuts & Trail Mix, Shop & Save Terms & Conditions","B08G8YWBTB"
"StarKist Chunk Light Tuna in Water - 5 oz Can (Pack of 24)","Tuna Fish, Pantry, Pack in protein, Canned Tuna & Seafood, Restaurant and Bulk Food Supply, Pantry Staples","B0BPWRLQRF"
"Spry Fresh Natural Xylitol Stronger Longer Chewing Gum Dental Defense System Aspartame-Free Sugar Free Gum (Spearmint, 55 Count - Pack of 6)","Chewing & Bubble Gum, Candy & Chocolate, d963aedb-8e7e-493c-80e7-b70e3c253824_4001, Canned, Packaged & Baking, All Candy Coupons, Movie Night Coupons, Non-chocolate candy","B09BW8N1DS"
"Tazo Regenerative Organic Zen Green Tea, Fair Trade, Kosher, USDA Certified Organic, Non-GMO, 16 Tea Bags (Pack of 6)","Herbal, Organic Groceries, Coffee & Tea, Grocery: More Sustainable Products, Tea, Save on Coffee & Tea, Coffee & Tea","B0B2JGT1LH"
"Carnation Breakfast Essentials Ready to Drink with Fiber, Rich Milk Chocolate, 8 FL OZ Carton (Pack of 24) (Packaging May Vary)","Instant Breakfast Drinks, Grocery: More Sustainable Products, Beverages, OIH_DCE, Perishables OIH, 10% off DCE","B09GKGN8TG"
"Traditional Medicinals Organic Lemon Balm Herbal Tea, Calming and Supports Digestion, (Pack of 2) - 16 Tea Bags","Herbal, Coffee & Tea, Tea, Save on Coffee & Tea, Coffee & Tea","B0BW3DCC5H"
"Amazon Fresh, Baking Soda, 16 Oz","Baking Soda, Holiday Baking, Plant-Based Lifestyles, Canned, Packaged & Baking, Mother's Day Bake Products, Mothers Day 2024_All ASINs, EDLP US, Products under $2, Baking Ingredients, Holiday baking","B09NRGMTYP"
"Harney & Sons Holiday Tea, 20 ct sachet tin","Black, Drinks & treats, Tea, Save on Coffee & Tea, Gluten-Free Groceries, d963aedb-8e7e-493c-80e7-b70e3c253824_9301, Coffee & Tea","B00JPY0ND6"
"Yerba Mate Instant Tea Powder, 3-in-1 Super Drink - Clean Energy, Brain Fog Buster, and Gut Health Powered by Nootropics, Prebiotics and Probiotics | Yerba Magic Strawberry Matcha 30 Servings","Mate Tea, Tea, Save on Coffee & Tea","B0DK9SW76Z"
"Navitas Organics Chia Seeds, 16 oz. (2-Pack) 76 Servings — Organic, Non-GMO, Gluten-Free…","Chia Seeds, Add toppings, The rights fats, Nuts, Seeds, Dried Fruits & Vegetables, Fresh, Keto-friendly foods, Canned, Packaged & Baking","B09RPZGD72"
"Albanese World's Best, Sweet & Sour Monster Combo, 45-0.5oz Trick or Treat Bags of Halloween Candy","Gummy Candy, Candy & Chocolate, Gluten-Free Groceries, Restaurant and Bulk Food Supply, Canned, Packaged & Baking, All Candy Coupons, Movie Night Coupons, Non-chocolate candy","B0D3WSLKFG"
"ICE BREAKERS Cherry Limeade Sugar Free Mints Tin, 1.5 oz","Mints, Candy & Chocolate, Canned, Packaged & Baking, All Candy Coupons, National Candy Month, Movie Night Coupons, Non-chocolate candy","B095KXP53M"
"Lipton Black Tea Bags, Hot or Iced, Black tea with Caffeine, 400 Total Bags (200ct - Pack of 2)","Black, Tea, Save on Coffee & Tea, Featured SNAP-eligible groceries, SNAP Beverages, Hot beverages, Coffee & Tea","B08V34B96W"
"Pisti Cream of Pistachio from Sicily 21.2 Ounce (600g) | Artisanal Italian Nut Spread | Enjoy with Bread and Biscuits","Sandwich Spreads, Pantry, Condiments & sauces, Gluten-Free Groceries, d963aedb-8e7e-493c-80e7-b70e3c253824_9301, Canned, Packaged & Baking, OTC, Pantry Staples","B079SYDLPJ"
"Wyler's Light Singles To Go Powder Packets, Water Drink Mix, Watermelon Lemonade, 96 Servings, 8 Count x Pack of 12","Soft Drink Mixes","B093CKPSYM"
"Nongshim Neoguri Spicy Seafood Ramen Noodle Soup, 6 Pack, Microwaveable Ramyun Instant Noodle Cup, Bold & Spicy Chili Peppers","Noodle Soups","B09NQP8V61"
"Starburst Duos Singles To Go Powdered Drink Mix, Blue Raspberry Lemon, 12 Boxes with 6 Packets Each - 72 Total Servings, Sugar-Free Drink Powder, Just Add Water, 6 Count (Pack of 12)","Soft Drink Mixes","B0CM6TGKCB"
"Cape Cod Potato Chips Original Less Fat, 1 Oz, 10 Ct","Potato, Snacks & produce IA, Game day snacks & dips, Snacks, Snack favorites, Seasonal Snacks, Salty snacks, Snacks Under 5$, 15% off coupon terms and conditions, Chips, Snacks, Lunchbox snacks, Gluten-Free Groceries, SNAP Snacks, d963aedb-8e7e-493c-80e7-b70e3c253824_9301, Snacks, Chips, Game Day Snacks, Canned, Packaged & Baking, Chips, Shop all eligible game day snacks, Chips, Snacks under $5, Chips and Snacks, Chips & more, Snack Foods - Low-sodium, Kettle, Cape Cod, Late July, Superbowl Event, New to Fresh Snacks, Snacks, Snack Foods - Sugar-free, Super Bowl (Multi-Category), Shop & Save Terms & Conditions","B0BGNQN5P3"
"V8 Splash Berry Blend Flavored Juice Beverage, 12 fl oz Bottle (6 Pack)","Juices, Refreshing beverages, Gluten-Free Groceries, Quench your thirst, d963aedb-8e7e-493c-80e7-b70e3c253824_9301, Beverages, Beverages for Summer","B0DG11C2TL"
"WHOPPERS Robin Eggs Malted Milk Balls, Easter Candy Bag, 9 oz","Candy & Chocolate Bars, Easter Candy, Test01, Candy & Chocolate, Easter Candy, Snacks, Canned, Packaged & Baking, All Candy Coupons, Easter Selection, Easter 2023 50% and 75% markdown, Chocolate, Easter LTOs, Easter LTOs Under $5, Easter Lead In Candy 30%, Easter 2023 BOGO","B09C2HYNWP"
"Tiesta Tea - 4 Autumnal Tea Blends | Premium Loose Leaf Tea Blend | Non-Caffeinated Tea | Make Hot or Iced | Pouch of Pumpkin Spice, Cozy Chai, Chamomile Mint, Meyer Lemon Zest - Pack of 4","Tea Gifts, Organic Groceries, Coffee & Tea, Tea, Gluten-Free Groceries, d963aedb-8e7e-493c-80e7-b70e3c253824_9301, Coffee & Tea","B0D67FMFT1"
"MiO Sugar-Free Lemonade Naturally Flavored Liquid Water Enhancer 1 Count 1.62 fl oz (Pack of 5)","Water Flavoring Drops","B0D1G5MMJ9"
"Illy Espresso Compatible Capsules - Single-Serve Coffee Capsules & Pods - Intenso Lungo Dark Roast - Notes Of Cocoa & Dried Fruit Coffee Pods - For Nespresso Coffee Machines – 10 Count","Single-Serve Capsules & Pods, Packaged Coffee, Cozy up with coffee, Coffee & Tea, Breakfast Deals, Coffee, Save on Coffee & Tea, Restaurant and Bulk Food Supply, 1, Beverages, Coffee & creamer, Main Coffee Base Shoveler, Coffee & Tea, Cups/Pods","B0BNQZ44L3"
"Pillsbury Mini Soft Baked Cookies, Chocolate Chip, Snack Bags, 10 ct","Chocolate Chip, Snacks & produce IA, Game day snacks & dips, Snacks, Snacks Under 5$, 15% off coupon terms and conditions, Snacks, Lunchbox snacks, Cookies, Snacks, Game Day Snacks, Snack cookies, Perishables OIH, Snacks under $5, Bakery & Prepared Foods, Bread and bakery, OIH_breads&bakery, Sundae Store All, New to Fresh Snacks, Bakery_baked goods & sweets, Pastries & Bakery, Organic Bread and Bakery Items, Shop & Save Terms & Conditions","B0CTRZS6NY"
"Cheez-It Cheese Crackers, Baked Snack Crackers, Lunch Snacks, Family Size, Variety Pack (3 Boxes)","Assortments & Samplers, Snacks & produce IA, Crackers, Game day snacks & dips, Snacks, Snack favorites, Snacks Under 5$, 15% off coupon terms and conditions, Snacks, Snacks, Snacks, Game Day Snacks, Canned, Packaged & Baking, OTC, Snacks under $5, New to Fresh Snacks, Snack Foods - Sugar-free, Shop & Save Terms & Conditions, Crackers and bread","B08Z572K8V"
"ChocZero Raspberry Jam Preserves, No Added Sugar, Keto Fruit Spread, Great Source of Fiber, All Natural, 12 Ounces (Pack of 1)","Jams & Preserves, Jams & spreads, Pantry, Canned, Packaged & Baking, Breakfast Essentials House Q1 2023, Jelly, jam, and nut butters","B0D237524B"
"Capri Sun Pacific Cooler Mixed Fruit Naturally Flavored Kids Juice Drink Blend (30 ct Box, 6 fl oz Pouches) (Pack of 2)","Fruit Juice, Fruit juice, Refreshing beverages, Bebidas, Quench your thirst, Morning beverages, Beverages, Beverages, Beverages for Summer, Juice","B0BP9BN5S4"
"Power Up Premium Trail Mix - Chocolate Espresso Trail Mix 10oz","Snack & Trail Mixes, Snacks & produce IA, Paleo-friendly foods, Game day snacks & dips, Snacks, Snack favorites, Salty snacks, Snacks Under 5$, 15% off coupon terms and conditions, Snacks, Snacks, Snacks, Game Day Snacks, Canned, Packaged & Baking, Snacks under $5, Chips and Snacks, New to Fresh Snacks, Snacks, Other cheese pairings, Nuts & Trail Mix, Shop & Save Terms & Conditions","B0CHFYCLXQ"
"Stash Tea Turmeric Chai Herbal Tea - Naturally Caffeine Free, Non-GMO Project Verified Premium Tea with No Artificial Ingredients, 18 Count (Pack of 6) - 108 Bags Total","Chai, Tea, Save on Coffee & Tea, Gluten-Free Groceries, d963aedb-8e7e-493c-80e7-b70e3c253824_9301, Coffee & Tea","B000Z94XWM"
"Traditional Medicinals, Organic Ginger Tea Variety Pack Promoting Digestion & Nausea support, Includes Ginger, Lemon-Ginger, Ginger-Chamomile, Lemon-Ginger, and Ginger-Aid, 64 Tea Bags, (4 Pack)","Herbal, Organic Groceries, Coffee & Tea, Tea, Save on Coffee & Tea, Gluten-Free Groceries, Plant-Based Lifestyles, Coffee & Tea","B09CFVMCWZ"
"Starbucks Doubleshot Energy Drink Coffee Beverage, Caramel, Iced Coffee, 15 fl oz Cans (Packaging May Vary) (Pack of 12)","Energy Drinks, Beverages, Energy Drinks, Energy drinks","B0BWBK8F37"
"Nongshim Gourmet Spicy Shin Instant Ramen Noodle, 16 Pack, Savory & Rich, Premium Microwaveable Ramen Soup Mix","Noodle, Pantry, Pantry Staples","B0D8CXHSVL"
"Lindt Valentine Lindor Assorted Bag, Assorted Chocolate, 8.5 Ounce","Candy & Chocolate Bars, Test01, Candy & Chocolate, Snacks, Canned, Packaged & Baking, All Candy Coupons, Chocolate","B084N3KHRP"
"Cirkul Frosted Refreshers Variety Pack, 6-pack (2 Pink, 2 Mango Dragon Fruit, 2 Paradise)","Powdered Drink Mixes & Flavorings","B0DCDZ6LF3"
"SodaStream bubly bounce Drops, Cherry Citrus flavor, Pack of 3","Water Flavoring Drops","B09Y7MQR4T"
"Drizzilicious Mini Rice Cakes Very Berry - Rice Crisps, Healthy Snack for Adults and Kids, Flavored Rice Cakes, Vegan, Gluten Free, Allergen Free, Only 90 Calories Per Serving - 4 oz (Pack of 1)","Cakes, Snacks & produce IA, Game day snacks & dips, Snacks, Salty snacks, Snacks Under 5$, 15% off coupon terms and conditions, Snacks, Plant-Based Lifestyles, Game Day Snacks, Canned, Packaged & Baking, Snacks under $5, New to Fresh Snacks, Shop & Save Terms & Conditions","B0D9ZXFWSC"
"Organic Goji Berries, 32 Ounces | 100% Natural Sun-Dried Whole Fruit | Sulfate & Additive Free | Large Berry Form, Great Flavor for Drinks, Snacks, & Beverages | Non-GMO & Vegan","Dried Berries, Salad toppings, Snacks & produce IA, Organic Groceries, APS Test, Grocery: More Sustainable Products, Salads, Fresh produce, Nuts, Seeds, Dried Fruits & Vegetables, Fresh, Plant-Based Lifestyles, Canned, Packaged & Baking, OG Nuts, Seeds & Dried Fruit, Deals_FreshProduce, OG Produce","B0BXYB91BJ"
"Oregon Chai Original Chai Tea Latte Single Serve Powdered Mix, 8 Count (Pack of 2)","Chai, Organic Groceries, Tea, Save on Coffee & Tea, Coffee & Tea","B0CJ2VRQFT"
"Butternut Mountain Farm 100% Pure Organic Maple Syrup From Vermont, Grade A (Prev. Grade B), Dark Color, Robust Taste, All Natural, Easy Squeeze, 12 Fl Oz (Pack of 2)","Maple Syrup, Organic Groceries, Canned, Packaged & Baking, Sugars & Sweeteners","B0D14XNZ35"
"SOLELY - Organic Mango Guava Fruit Jerky - 12 Individually Wrapped Fruit Strips (12-Pack) - Fruit Leather Made from Dried Fruit - Healthy Snacks for Adults & Kids - Non GMO, Vegan Snacks - 0.8oz (23g)","Fruit Snacks, Snacks & produce IA, Game day snacks & dips, Fruit Snacks, Snacks, Seasonal Snacks, Snacks Under 5$, 15% off coupon terms and conditions, Snacks, Snacks, Plant-Based Lifestyles, Fruit Snacks Shov, Game Day Snacks, Canned, Packaged & Baking, Fruit Snacks, Snacks under $5, Fruit  Snacks, New to Fresh Snacks, Other cheese pairings, Fruit Snacks & Dried Fruit, Shop & Save Terms & Conditions","B0D2N63JC3"
"Red Bull Yellow Edition Energy Drink, Tropical, with 80mg Caffeine plus Taurine & B Vitamins, 8.4 Fl Oz, 2 Packs of 12 Cans (Pack of 24)","Energy Drinks, Beverages, Energy Drinks, Energy drinks","B0C4B8XZYT"
"Lorann Oils Peanut Butter Bakery Emulsion: Realistic Peanut Butter Flavor Without Nuts, Perfect for Elevating Peanut Butter notes in Baked Goods, Gluten-Free, Keto-Friendly, 4 Oz","Imitation, Baking Extracts & Flavoring, Canned, Packaged & Baking, Gluten-free ingredients, Homemade ice cream","B0DHHJNGX8"
"Royal Basmati Organic White - 2 lbs","Basmati, Pantry, Step 3. Build your base, Restaurant and Bulk Food Supply","B0DKTTQH19"
"Zellie's | 100% Xylitol Sugar Free Spearmint Breath Mints | Non-GMO, Low-Calorie, Gluten Free, Vegan & Kosher Mints (540 Count (Pack of 1))","Mints, Candy & Chocolate, Gluten-Free Groceries, Plant-Based Lifestyles, Canned, Packaged & Baking, All Candy Coupons, Movie Night Coupons, Non-chocolate candy","B0B25XR1PM"
"Stash Tea Bold Black Tea Sampler - Assortment of Caffeinated Premium Teas, Including English Breakfast, Irish Breakfast and Earl Grey Tea, 18-20 Count (Pack of 3)","Tea Samplers, Tea, Save on Coffee & Tea","B0BP4M21MP"
"Simple Mills Almond Flour Crunchy Cookies Variety Pack (Chocolate Chip, Double Chocolate Chip, Toasted Pecan) - Gluten Free, Vegan, Healthy Snacks, Made with Organic Coconut Oil, 5.5 Ounce (Pack of 3)","Chocolate Chip, Snacks & produce IA, Game day snacks & dips, Snacks, Snacks Under 5$, 15% off coupon terms and conditions, Snacks, Lunchbox snacks, Gluten-Free Groceries, Cookies, Snacks, Plant-Based Lifestyles, Game Day Snacks, Snack cookies, Perishables OIH, Snacks under $5, Bakery & Prepared Foods, Bread and bakery, OIH_breads&bakery, Sundae Store All, New to Fresh Snacks, Bakery_baked goods & sweets, Pastries & Bakery, Organic Bread and Bakery Items, Shop & Save Terms & Conditions","B0D92TQP1V"
"New England Coffee Peppermint Bark Medium Roast Ground Coffee, 11oz Bag (Pack of 1)","Ground Coffee, Packaged Coffee, Cozy up with coffee, Coffee & Tea, Coffee, Save on Coffee & Tea, Gluten-Free Groceries, Beverages, Coffee Grounds, Coffee & creamer, Main Coffee Base Shoveler, Coffee & Tea","B0D185RNRS"
