"Title","Categories: Sub","ASIN"
"C4 Smart Energy Drinks Variety Pack Bundle (24 Pack) | 4 Flavor Tropical Oasis Variety 12 Pack + 4 Flavor Berry Breeze Variety 12 Pack","Energy Drinks, Beverages, Energy Drinks, Energy drinks","B0CVN626P5"
"Icelandic Glacial Natural Spring Water, Unflavored, 330 ml / 11.1 Fl Oz (Pack of 24)","Still Water, Beverages, Beverages, Beverages, Beverages, Water, Beverages, CSD and Water, BBQ Beverages, Springtime Beverages","B0BFPMNYDD"
"Big Train Mocha Blended Ice Coffee Beverage Mix, 3.5 Pound (Pack of 1)","Instant Coffee, Cozy up with coffee, Coffee & Tea, Tea, Coffee, Save on Coffee & Tea, d963aedb-8e7e-493c-80e7-b70e3c253824_4001, Beverages, Coffee & creamer, Main Coffee Base Shoveler, Coffee & Tea, Instant Coffee","B00Z1DFHH2"
"LIFE SAVERS Wint-O-Green Breath Mint Bulk Hard Candy, Party Size, 44.93 oz Bag (Pack of 2)","Mints, f2acaa74-dfe3-426c-b654-a431ad2c4e38_946602, Candy & Chocolate, Restaurant and Bulk Food Supply, Canned, Packaged & Baking, All Candy Coupons, Snacks, Movie Night Coupons, Non-chocolate candy","B09YT6N6VQ"
"Instant Mushroom Coffee Dark Roast Organic (60 Servings) With 10 Mushrooms (Lions Mane, Cordyceps, Turkey Tail & Other) Mixed With Gourmet 100% Arabica Instant Coffee for Focus & Gut Health Support","Ground Coffee, Packaged Coffee, Cozy up with coffee, Organic Groceries, Coffee & Tea, Coffee, Save on Coffee & Tea, Beverages, Coffee Grounds, Coffee & creamer, Main Coffee Base Shoveler, Coffee & Tea, Instant Coffee","B0DFHPP2DC"
"Sparkling Ice STARBURST Watermelon, Zero Sugar Flavored Sparkling Water, with Vitamins and Antioxidants, Low Calorie Beverage, 17 fl oz Bottles (Pack of 12)","Flavored Water, Beverages, Beverages, Beverages, Water, Beverages, CSD and Water, BBQ Beverages, Springtime Beverages, Beverages for Summer","B0DNNVHJ5V"
"Horizon Organic Shelf-Stable 1% Low Fat Milk Boxes with DHA Omega-3, Chocolate, 8 fl oz, 72 Pack","Dairy Milk, Dairy & dairy alternatives, APS Test, Local Dairy, Cheese & Eggs, Dairy & dairy alternatives, Dairy, eggs, & plant based alternatives, APS Test 2, Breakfast Dairy, Save on Dairy, Cheese & Eggs, OIH_DCE, Cereal and milk, Dairy Thanksgiving/Holiday Cooking, DCE_milk and cream (+ND), Perishables OIH, Dairy milk, NYNY Dairy Essentials, Fresh | Dairy promotion, Dairy Milk & Non Dairy Milk, Milk & Cream, Homemade ice cream, 10% off DCE","B0DTYTXWN1"
"Wonderful Pistachios No Shells, Jalapeño Lime Nuts, 0.75 Ounce Bags (Pack of 14), Protein Snacks, Gluten Free, On-the-Go, Individually Wrapped Healthy Snack","Pistachios, Snacks & produce IA, Paleo-friendly foods, Game day snacks & dips, Snacks, Salty snacks, Snacks Under 5$, 15% off coupon terms and conditions, Snacks, Gluten-Free Groceries, Add toppings, Nuts, Seeds, Dried Fruits & Vegetables, d963aedb-8e7e-493c-80e7-b70e3c253824_9301, Snacks, Snacks, Game Day Snacks, Canned, Packaged & Baking, Gluten-free ingredients, Snacks under $5, Chips and Snacks, New to Fresh Snacks, Other cheese pairings, Nuts & Trail Mix, Shop & Save Terms & Conditions","B0CXRN6KK3"
"GIN GINS Sweet Ginger Gummies – Natural Fresh Ginger Candy by The Ginger People – Sweet Ginger Gummies Flavor – Large 1 lb Bag (16oz) – Pack of 2","Ginger Candy, Candy & Chocolate, Gluten-Free Groceries, d963aedb-8e7e-493c-80e7-b70e3c253824_9301, Canned, Packaged & Baking, All Candy Coupons, Movie Night Coupons","B0DGZFG46F"
"Mountain Dew Kickstart Strawberry Start-Up (16 Ounce Cans, Pack of 12)","Soft Drinks, Soda and cocktail mixers, Beverages, Beverages, Bebidas, Drinks, Quench your thirst, Beverages, Soda, Beverages, CSD and Water, BBQ Beverages, Movie Night Coupons, Soft Drinks, Soft Drinks, Springtime Beverages, Beverages for Summer","B0BV17ZQDN"
"Cinnamon Toast Crunch Breakfast Cereal, Crispy Cinnamon Cereal, Family Size, 18.8 oz Cereal Box","Cold Cereal, Breakfast foods, Breakfast Deals, Canned, Packaged & Baking, Breakfast foods, Cereal and milk, Easter Selection, Fuel your day, 2023 Ready for school, Celebrate Easter with brunch this year, Breakfast Coffee, Mothers Day Breakfast Brunch 2023 Shoveler HOUSE, Holiday Shop 2023 ASINs, Morning 1, Tier 1 Morning Fav","B08X66YKQX"
"Cirkul Squeeze Lemonade Flavor Cartridge Variety Pack with B vitamins, 6-Pack (2 Classic, 2 Strawberry, 2 Raspberry)","Powdered Drink Mixes & Flavorings","B0DCDPZLDD"
"Essentia Water LLC , 99.9% Pure, Infused with Electrolytes for a Smooth Taste, pH 9.5 or Higher; Ionized Alkaline Water, Black, 42.3 Fl Oz (Pack of 12)","Still Water, Beverages, Beverages, SNAP Beverages, Cold beverages, Beverages, Beverages, Water, Beverages, CSD and Water, BBQ Beverages, Springtime Beverages","B094S6BCZK"
"Peet's Coffee, Dark Roast Decaf Keurig K-Cup Pods - Decaf House Blend 88 Count (4 Boxes of 22 K-Cup Pods)","Single-Serve Capsules & Pods, Packaged Coffee, Cozy up with coffee, Coffee & Tea, Breakfast Deals, Coffee, Save on Coffee & Tea, 1, Beverages, Coffee & creamer, Main Coffee Base Shoveler, Coffee & Tea, Cups/Pods","B09WJ7XKTR"
"Traditional Medicinals Tea, Organic Smooth Move, Relieves Occasional Constipation, Senna, 16 Tea Bags + Smooth Move Senna Laxative Capsules, Natural Herbal Constipation Relief, 50 Capsules (Pack of 1)","Herbal, Organic Groceries, Coffee & Tea, Tea, Save on Coffee & Tea, Coffee & Tea","B0DG4WWMJ8"
"Tropicana 100% Strawberry Kiwi Juice, Single Serve, 10 Fl Oz Bottles (Pack of 24) - Real Fruit Juice, Vitamin C, B & E Rich, No Added Sugars, No Artificial Flavors","Fruit Juice, Fruit juice, Refreshing beverages, Bebidas, Quench your thirst, Morning beverages, Beverages, Beverages, Beverages for Summer, Juice","B0D9VRMF7L"
"Nestle Coffee mate Coffee Creamer, Abuelita Mexican Style Chocolate Flavored, Concentrated Liquid Pump Bottle, Non Dairy, No Refrigeration, 50.7 fl oz (Pack of 2)","Plant-Based Coffee Creamers, Local Dairy, Cheese & Eggs, OIH_DCE, Coffee & creamer, Plant-based creamer, Perishables OIH, Non-Dairy, Dairy and Non-Dairy Creamers, Under $5 dairy, 10% off DCE","B0DKNVGMNX"
"Nature Valley Granola Bars, Sweet and Salty Nut, Dark Chocolate Peanut and Almond, 18 Bars, 21.6 OZ","Granola, Snacks & produce IA, Game day snacks & dips, Snacks, Snacks Under 5$, 15% off coupon terms and conditions, Snacks, Lunchbox snacks, SNAP Snacks, Snacks, Snacks, Game Day Snacks, Canned, Packaged & Baking, Snacks under $5, New to Fresh Snacks, Granola Bars, Granola Bar, Shop & Save Terms & Conditions","B09GJBDV3W"
"Eight O'Clock Coffee The Original, 21 Ounce, Medium Roast Ground Coffee 100% Arabica, Sweet, Fruity & Well Balanced","Ground Coffee, Packaged Coffee, Cozy up with coffee, Coffee & Tea, Breakfast Deals, Coffee, Save on Coffee & Tea, Beverages, Coffee Grounds, Coffee & creamer, Main Coffee Base Shoveler, Coffee & Tea","B0BBK6JBXP"
"Albanese World's Best Watermelon Gummi Bears, 5 Pound Bag","Gummy Candy, Candy & Chocolate, Gluten-Free Groceries, Restaurant and Bulk Food Supply, Canned, Packaged & Baking, All Candy Coupons, Movie Night Coupons, Non-chocolate candy","B08SBPQT9G"
"Guayakí Yerba Mate, Organic Energy Drink Alternative, Variety Pack, 150mg Natural Plant Based Caffeine, Better for You Energy & Focus, No Jitters or Crash, 15.5 Oz (Pack of 12) (Packaging May Vary)","Energy Drinks, Same-Day New Year Grocery, Beverages, Energy drinks","B0CFM69Z8Y"
"GIN GINS Sweet Ginger Gummies – Natural Fresh Ginger Candy by The Ginger People – Sweet Ginger Gummies Flavor – Large 1 lb Bag (16oz) – Pack of 1","Ginger Candy, Candy & Chocolate, Gluten-Free Groceries, Grocery, d963aedb-8e7e-493c-80e7-b70e3c253824_9301, Plant-Based Lifestyles, Canned, Packaged & Baking, All Candy Coupons, Movie Night Coupons","B08TLQ8KP7"
"PLANTERS Salted Mixed Nuts, Party Snacks, Plant-Based Protein, 27 Oz Canister (Pack of 2)","Mixed Nuts, Snacks & produce IA, Paleo-friendly foods, Game day snacks & dips, Snacks, Salty snacks, Snacks Under 5$, 15% off coupon terms and conditions, Snacks, Snacks, Add toppings, Nuts, Seeds, Dried Fruits & Vegetables, Snacks, Snacks, Game Day Snacks, Canned, Packaged & Baking, Snacks under $5, Chips and Snacks, New to Fresh Snacks, Other cheese pairings, Nuts & Trail Mix, Shop & Save Terms & Conditions","B0D14YJVW2"
"Starbucks Whole Bean Coffee, Dark Roast Coffee, Caffè Verona, 100% Arabica, 1 bag (18 oz)","Roasted Coffee Beans, Packaged Coffee, Cozy up with coffee, Coffee & Tea, Breakfast Deals, Coffee, Save on Coffee & Tea, Beverages, OTC, Coffee & creamer, Main Coffee Base Shoveler, Coffee & Tea, Whole Beans, all coffee and tea","B0935ZP5X8"
"Jordan's Skinny Mixes Sugar Free Syrup, Cherry Flavor, Fruit Flavored Water Enhancer, Drink Mix for Ice Tea, Lemonade & More, Zero Calorie Flavoring, Keto Friendly, 25.4 Fl Oz, 1 Pack","Syrups, Beverages","B0CKM2NYGC"
"RXBAR Protein Bars, 12g Protein, Gluten Free Snacks, Chocolate Sea Salt (6 Boxes, 30 Bars)","High Protein, Snacks & produce IA, Game day snacks & dips, Snacks, Snacks Under 5$, 15% off coupon terms and conditions, Snacks, Lunchbox snacks, Gluten-Free Groceries, Granola & Nutrition Bars Sample Credit, Snacks, Snacks, Game Day Snacks, Canned, Packaged & Baking, Snacks under $5, New to Fresh Snacks, Granola Bars, Shop & Save Terms & Conditions","B0BJXW16DL"
"Starbucks Whole Bean Coffee, Dark Roast Coffee, Espresso Roast, 100% Arabica, 1 bag (18 oz)","Roasted Coffee Beans, Packaged Coffee, Cozy up with coffee, Coffee & Tea, Breakfast Deals, Coffee, Save on Coffee & Tea, SNAP Coffee, SNAP Beverages, Beverages, OTC, Coffee & creamer, Main Coffee Base Shoveler, Coffee & Tea, Whole Beans, all coffee and tea","B09369VYBL"
"Post Malone OREO Cookies, Limited Edition, 10.68 oz","Sandwich, Snacks & produce IA, Game day snacks & dips, Snacks, Snacks Under 5$, 15% off coupon terms and conditions, Snacks, Lunchbox snacks, Cookies, Snacks, Game Day Snacks, Snack cookies, Perishables OIH, Snacks under $5, Bakery & Prepared Foods, Bread and bakery, OIH_breads&bakery, Sundae Store All, New to Fresh Snacks, Bakery_baked goods & sweets, Cookies and Sweets - Variety Packs, Pastries & Bakery, Organic Bread and Bakery Items, Shop & Save Terms & Conditions","B0DGVNJZH8"
"Crystal Light Fruit Punch On-The-Go, 0.09 Ounce (Pack of 20)","Soft Drink Mixes","B0CW77FRZ2"
"Caribou Coffee Bou-Yah, Keurig Single Serve K-Cup Pods, 22 Count","Single-Serve Capsules & Pods, Packaged Coffee, Cozy up with coffee, Coffee & Tea, Breakfast Deals, Coffee, Save on Coffee & Tea, 1, Beverages, Coffee & creamer, Main Coffee Base Shoveler, Coffee & Tea, Cups/Pods","B09WJMWJF3"
"Blue Diamond Almonds Snack Nut Variety Pack for Kids, Office, School, On-the-go, 0.75 oz Gluten Free Individual Packs, Wasabi & Soy Sauce, Lightly Salted, and Smokehouse (Pack of 6,144 Count Total)","Almonds, Snacks & produce IA, Paleo-friendly foods, Game day snacks & dips, Snacks, Salty snacks, Snacks Under 5$, 15% off coupon terms and conditions, Snacks, Gluten-Free Groceries, Add toppings, The rights fats, Nuts, Seeds, Dried Fruits & Vegetables, d963aedb-8e7e-493c-80e7-b70e3c253824_9301, Snacks, Keto-friendly foods, Snacks, Game Day Snacks, Canned, Packaged & Baking, Gluten-free ingredients, Snacks under $5, Chips and Snacks, New to Fresh Snacks, Other cheese pairings, Nuts & Trail Mix, Shop & Save Terms & Conditions","B0CJMRF1YF"
"bubly Sparkling Water, 3 Flavor Variety Pack (Bellini, Strawberry Sunset, Coconut Pineapple), Zero Sugar & Zero Calories, 12 Fl Oz Cans (Pack of 18)","Carbonated Water, Sparkling water, Sparkling Water, Soda and cocktail mixers, Beverages, Sparkling water, Sparkling water, Drinks, Sparkling Water, Baverages, Beverages, Beverages, Water, Sparkling Water, Beverages, CSD and Water, BBQ Beverages, All Sparkling Water, Springtime Beverages, Beverages for Summer, Sparkling  Water","B0CS511T7M"
"Rockstar Energy Drink, Pure Zero Silver Ice, 12oz Sleek Cans (Pack of 8)","Energy Drinks, Beverages, Energy Drinks, Energy drinks","B09DTBF2VM"
"Newman's Own Organic French Roast Coffee, Keurig Single Serve K-Cup Pods, Dark Roast Coffee, 60 Count, (6 Packs of 10)","Single-Serve Capsules & Pods, Packaged Coffee, Cozy up with coffee, Organic Groceries, Coffee & Tea, Coffee, Save on Coffee & Tea, 1, Beverages, Coffee & creamer, Main Coffee Base Shoveler, Coffee & Tea, Cups/Pods","B0CZF78H3D"
"Sun-Maid Vanilla Yogurt Coated Raisins - (12 Pack) 8 oz Resealable Bag - Yogurt Covered Dried Fruit Snack for Lunches and Snacks","Fruit Snacks, Snacks & produce IA, Game day snacks & dips, Fruit Snacks, Snacks, Seasonal Snacks, Snacks Under 5$, 15% off coupon terms and conditions, Snacks, Fresh, Snacks, Fruit Snacks Shov, Game Day Snacks, Canned, Packaged & Baking, Fruit Snacks, Snacks under $5, Fruit  Snacks, New to Fresh Snacks, Other cheese pairings, Fruit Snacks & Dried Fruit, Shop & Save Terms & Conditions","B0BC2G5T83"
"Illy Coffee K Cups - Coffee Pods For Keurig Coffee Maker – Classico Roast - Caramel, Orange Blossom & Jasmine - Mild, Flavorful & Balanced Flavor Pods of Coffee - No Preservatives – 72 Count","Single-Serve Capsules & Pods, Packaged Coffee, Cozy up with coffee, Coffee & Tea, Coffee, Save on Coffee & Tea, 1, Beverages, Coffee & creamer, Main Coffee Base Shoveler, Coffee & Tea, Cups/Pods","B0D46FF36Q"
"La Tourangelle Avocado Oil, Handcrafted from Premium Avocados, Great for Cooking, as Butter Substitute, and for Skin and Hair, 169 fl oz","Avocado, Oils, Fats and oils, Gluten-Free Groceries, The rights fats, d963aedb-8e7e-493c-80e7-b70e3c253824_9301, Canned, Packaged & Baking, Gluten-free ingredients","B09K9HCR2M"
"Maison Perrier Forever Lime Flavored Sparkling Water, 11.15 Fl Oz Cans, 8 Count, 3 Pack","Water, Beverages, Beverages, Beverages, Water, Beverages, CSD and Water, BBQ Beverages, Springtime Beverages","B0CQ9PQ85X"
"Snapple Diet Peach Tea, 16 fl oz recycled plastic bottle, 6 pack","Iced Tea, Beverages, Bulk beverages, Buy in bulk, Tea, Save on Coffee & Tea, Gluten-Free Groceries, Quench your thirst, Beverages, d963aedb-8e7e-493c-80e7-b70e3c253824_9301, Stock up with bulk items, Beverages, Summer Store 2024, RTD Coffee and Tea multipacks, Coffee & Tea, ALL BEVS MULTIPACKS (no packaged c&t), BBQ Beverages, RTD coffee and tea, Springtime Beverages, all coffee and tea, Super Bowl (Multi-Category), Beverages_Summer Store 2024","B08VPTG1HL"
"Rice Krispies Treats Crispy Rice Squares, Kids Snacks, Snack Bars, Chocolatey Peanut Butter, 10.8oz Box (14 Bars)","Breakfast Foods, Cereal, Snacks & produce IA, Game day snacks & dips, Snacks, Snacks Under 5$, 15% off coupon terms and conditions, Lauren test cereal, Snacks, Lunchbox snacks, Snacks, Snacks, Quick Meals & Snacks, Game Day Snacks, Canned, Packaged & Baking, Snacks under $5, New to Fresh Snacks, Shop & Save Terms & Conditions","B0DJN1VBZR"
"Tillamook Country Smoker Keto Friendly Zero Sugar Smoked Sausages, Original, 12 Ounce Tall Jar, 17 Count","Jerky, Snacks & produce IA, Game day snacks & dips, Snacks, Salty snacks, Snacks Under 5$, 15% off coupon terms and conditions, Snacks, Game Day Snacks, Canned, Packaged & Baking, OTC, Snacks under $5, New to Fresh Snacks, Other cheese pairings, Shop & Save Terms & Conditions","B08Z5TPFJ8"
"Wonderful Pistachios No Shells, Sea Salt & Vinegar Nuts, 5.5 Ounce Resealable Bag, Protein Snacks, Vegan Snacks, Healthy Snacks for Adults","Pistachios, Pantry, Snacks & produce IA, Paleo-friendly foods, Game day snacks & dips, Pantry, Snacks, Salty snacks, Snacks Under 5$, 15% off coupon terms and conditions, Snacks, Snacks, Save on Mediterranean top picks, Nuts & seeds, Gluten-Free Groceries, Pantry 2, Pantry, Add toppings, Plant-Based Deals, Nuts & Seeds, Pantry, Nuts, Seeds, Dried Fruits & Vegetables, d963aedb-8e7e-493c-80e7-b70e3c253824_9301, Snacks, Fresh, Snacks, Plant-Based Lifestyles, Grains, Nuts, and Seeds, Nuts & seeds, Game Day Snacks, Canned, Packaged & Baking, OTC, Gluten-free ingredients, Snacks under $5, Chips and Snacks, New to Fresh Snacks, Hiking and Camping, Other cheese pairings, Nuts & Trail Mix, Shop & Save Terms & Conditions","B08NVTZLNK"
"Honey Nut Cheerios Cereal, Limited Edition Happy Heart Shapes, Heart Healthy Cereal With Whole Grain Oats, Mega Size, 29.4 oz","Cold Cereal, Breakfast Deals, Canned, Packaged & Baking, Cereal and milk, Fresh Grocery Coupons, Breakfast Coffee, Mothers Day Breakfast Brunch 2023 Shoveler HOUSE","B09HZQB2C9"
"Torani Puremade Sauce Variety Pack (with Extra Caramel), 16.5 Ounces Bottle (Set of 4)","Syrups, Baking Extracts & Flavoring, Beverages","B0C2DFPK15"
"Nespresso Capsules Original Line, Vaniglia, Medium Roast Espresso Coffee, 50 Count Espresso Coffee Pods","Single-Serve Capsules & Pods, Packaged Coffee, Cozy up with coffee, Coffee & Tea, Breakfast Deals, Coffee, Save on Coffee & Tea, Gluten-Free Groceries, d963aedb-8e7e-493c-80e7-b70e3c253824_9301, 1, Beverages, Coffee & creamer, Main Coffee Base Shoveler, Coffee & Tea, Cups/Pods","B0BZJVQZG7"
"GoGo squeeZ Fruit & veggieZ Applesauce and Puree Variety Pack, Pedal Peach and Boulder Berry, 3.2 oz (Pack of 20), Unsweetened Snacks for Kids, BPA Free Pouches","Applesauce, Snacks & produce IA, Game day snacks & dips, Snacks, Snacks Under 5$, 15% off coupon terms and conditions, Snacks, Gluten-Free Groceries, d963aedb-8e7e-493c-80e7-b70e3c253824_9301, Snacks, Game Day Snacks, Canned, Packaged & Baking, Snacks under $5, New to Fresh Snacks, Shop & Save Terms & Conditions","B097CQX6DM"
"Torani Sugar Free Syrup, Green Apple Flavoring for Drinks, Zero Calorie, Pump Included, 25.4 Fl Oz","Flavoring Syrup, Baking Extracts & Flavoring, Canned, Packaged & Baking","B0DTMQ32GC"
"Gatorade Thirst Quencher Zero Sugar Sports Drink, Cool Blue, 20oz Bottles, 8 Pack, Electrolytes for Rehydration","Sports Drinks, Refreshing beverages, Beverages, Quench your thirst, Beverages, Beverages, Memorial Day Coupons, Sports drinks, OTC, Sports Drinks, NYNY_ENHANCED, 2023 Ready for school, ALL BEVS MULTIPACKS (no packaged c&t), Drinks - Sandwich Store, 2023 NYE, Sports Drinks Multipacks, Drinks, Football beverages 2023, Springtime Beverages, Beverages for Summer","B08LHFKJSB"
"McCafe Irish Mocha, Keurig Single Serve K-Cup Pods, Flavored Coffee, 72 Count (6 Packs of 12)","Single-Serve Capsules & Pods, Packaged Coffee, Cozy up with coffee, Coffee & Tea, Breakfast Deals, Coffee, Save on Coffee & Tea, 1, Beverages, Coffee & creamer, Main Coffee Base Shoveler, Coffee & Tea, Cups/Pods","B09QG2RY3K"
"TAZO Organic Refresh Mint Herbal Tea Bags, Caffeine Free, 16 Total Tea Bags","Herbal, Coffee & Tea, Tea, Save on Coffee & Tea, Coffee & Tea","B0CJL3YTGH"
"Purely Elizabeth Vanilla Chocolate Chip Granola, Made with Organic Oats and Ancient Grains, Gluten-Free, Non-GMO (3 Ct, 12oz Bags)","Granola, Breakfast Deals, Gluten-Free Groceries, d963aedb-8e7e-493c-80e7-b70e3c253824_9301, Quick Meals & Snacks, Canned, Packaged & Baking, Granola","B095QCS8B6"
"Skittles Singles To Go Variety Pack, Powdered Drink Mix, Zero Sugar, Low Calorie, Includes 4 Flavors: Green Apple, Strawberry, Grape, Orange, 1 Box (30 Single Servings)","Soft Drink Mixes","B0BDCQT67Z"
"Death Wish Coffee Co. Blue and Buried, Fair Trade, Ground Blueberry Coffee, 12 oz","Ground Coffee, Packaged Coffee, Cozy up with coffee, Coffee & Tea, Breakfast Deals, Coffee, Save on Coffee & Tea, Beverages, Coffee Grounds, Coffee & creamer, Main Coffee Base Shoveler, Coffee & Tea","B09ZVNJLH6"
"Bragg Nutritional Yeast Seasoning Variety Pack - (2 Pack) 3 oz - Dairy-Free Parmesan Cheese Substitute - Perfect for Salads, Pastas, Popcorn, and More","Nutritional Yeast, Dairy alternatives, Dairy alternatives, Dairy-free, Breakfast Deals, Plant-Based Lifestyles, Canned, Packaged & Baking, OIH_DCE, Perishables OIH, Non-Dairy, Plant-based cheese, DCE_cheese, Under $5 dairy, 10% off DCE","B09R37C1G7"
"Quest Nutrition Tortilla Style Protein Chips, Hot & Spicy, 19g of Protein, 4g Net Carbs, Gluten Free, 1.1 Ounce (Pack of 12)","Tortilla, Snacks & produce IA, Game day & Cheese LP IA, Game day snacks & dips, Snacks, Snack favorites, Seasonal Snacks, Salty snacks, Snacks Under 5$, 15% off coupon terms and conditions, Chips, Appetizers and snacks, Snacks, Lunchbox snacks, Snacks, Chips, Game Day Snacks, Canned, Packaged & Baking, Chips, Chips, Snacks under $5, Chips & more, New to Fresh Snacks, Snacks, Shop & Save Terms & Conditions","B0BRYS3QNV"
"Bragg Organic Apple Cider Vinegar, Raw, Unfiltered, With The Mother, 128 oz (4 Pack)","Apple Cider, Organic Groceries, Canned, Packaged & Baking","B0B1QSMJJ6"
"Amazon Brand - Happy Belly Nuts, Chocolate & Dried Fruit, Trail Mix, 16 Ounce (Pack of 2)","Snack & Trail Mixes, Nuts & Seeds, Snacks & produce IA, Paleo-friendly foods, Game day snacks & dips, Snacks, Snack favorites, Salty snacks, Snacks Under 5$, 15% off coupon terms and conditions, Happy Belly, Snacks, Nuts & Trail Mix by Happy Belly, an Amazon Brand, Snacks, Snacks, Prime foods at just-right prices, Game Day Snacks, Canned, Packaged & Baking, Snacks under $5, Chips and Snacks, New to Fresh Snacks, Snacks, Other cheese pairings, Nuts & Trail Mix, Shop & Save Terms & Conditions","B0C89762H1"
"Slate Milk - High Protein Milk Shake - French Vanilla - Lactose Free, 20g Protein, 1g Sugar, 100 Calories, 1g Net Carbs, No Added Sugar - Natural, Breakfast Boost, Post Workout - 11 fl oz, 12 Cans","Protein Drinks, Beverages, Protein drinks","B0BPJPCW3B"
"Bundle of PLANTERS Cashews Dill Pickle, 5 Oz Bag + Salt and Vinegar, 5 Oz Bag","Cashews, Salad toppings, Snacks & produce IA, Paleo-friendly foods, Game day snacks & dips, Snacks, Salty snacks, Snacks Under 5$, 15% off coupon terms and conditions, Salads, Snacks, Add toppings, Nuts, Seeds, Dried Fruits & Vegetables, Snacks, Snacks, Game Day Snacks, Canned, Packaged & Baking, Snacks under $5, Chips and Snacks, New to Fresh Snacks, Other cheese pairings, Nuts & Trail Mix, Shop & Save Terms & Conditions","B0CZ9QR6VS"
"Traditional Medicinals Organic Herbal Tea Variety Pack for Stress and Sleep Support, 6 Flavors, Lavender, Chamomile, Lemon & Valerian Root, 96 Tea Bags, (6 Pack)","Herbal, Coffee & Tea, Tea, Save on Coffee & Tea, Coffee & Tea","B09CFX5FNM"
"Peet's Coffee, Dark Roast Whole Bean Coffee - Major Dickason's Blend 36 Ounces (2 Bags of 18 Ounces)","Roasted Coffee Beans, Packaged Coffee, Cozy up with coffee, Organic Groceries, Coffee & Tea, Coffee, Save on Coffee & Tea, Beverages, Coffee & creamer, Main Coffee Base Shoveler, Coffee & Tea, Whole Beans","B0DP2W7R8J"
"Nature Valley Granola Bars, Sweet and Salty Nut, Variety Pack, 24 Bars, 28.8 OZ","Granola, Snacks & produce IA, Game day snacks & dips, Snacks, Snacks Under 5$, 15% off coupon terms and conditions, Snacks, Lunchbox snacks, Snacks, Snacks, Game Day Snacks, Canned, Packaged & Baking, OTC, Snacks under $5, New to Fresh Snacks, Granola Bars, Granola Bar, Shop & Save Terms & Conditions","B08NGF28ZL"
"Crave Beverages Coffee Lovers - Flavored and Non Flavored Coffee Pods, for Keurig K Cup Brewers, 40 Count","Single-Serve Capsules & Pods, Packaged Coffee, Cozy up with coffee, Coffee & Tea, Breakfast Deals, Coffee, Save on Coffee & Tea, Gluten-Free Groceries, d963aedb-8e7e-493c-80e7-b70e3c253824_9301, 1, Beverages, OTC, Coffee & creamer, Main Coffee Base Shoveler, Coffee & Tea, Cups/Pods","B08ZR49TY5"
"Maud's Vanilla Ube Flavored Coffee Pods, 18 ct, Medium Roast Flavored Coffee in Recyclable Single Serve Pods – 100% Arabica Coffee, Compatible with Keurig K Cups Maker","Single-Serve Capsules & Pods, Packaged Coffee, Cozy up with coffee, Coffee & Tea, Coffee, Save on Coffee & Tea, 1, Beverages, Coffee & creamer, Main Coffee Base Shoveler, Coffee & Tea, Cups/Pods","B0DJ3LGVCQ"
"Le Marinier French Sea Salt Grey Coarse Sea Salt, 1.1lb - 18oz Pack of 2. Mineral Rich Unrefined French Sea Salt 100% Natural, Hand Harvested Mineral Sea Salt, Sel Gris (1.1lb Grey Coarse - Pack of 2)","Sea Salt, Condiments & sauces, Salts, Pantry Staples","B0DDYQQ855"
"Blue Diamond Almonds, BOLD Korean BBQ Snack Almonds, 6 Ounce Can","Almonds, Snacks & produce IA, Paleo-friendly foods, Game day snacks & dips, Snacks, Salty snacks, Snacks Under 5$, 15% off coupon terms and conditions, Snacks, Add toppings, The rights fats, Nuts, Seeds, Dried Fruits & Vegetables, Snacks, Fresh, Keto-friendly foods, Snacks, Game Day Snacks, Canned, Packaged & Baking, Snacks under $5, Chips and Snacks, New to Fresh Snacks, Other cheese pairings, Nuts & Trail Mix, Shop & Save Terms & Conditions","B0B2KVXZQ4"
"Diamond Crystal Kosher Salt – Full Flavor, No Additives and Less Sodium - Pure and Natural Since 1886-3 LB (Full Case of 9)","Kosher Salt, f2acaa74-dfe3-426c-b654-a431ad2c4e38_946602, Condiments & sauces, Restaurant and Bulk Food Supply, Pantry Staples","B0CB9CKQMB"
"Tim Hortons Dark Roast Coffee, Single-Serve K-Cup Pods Compatible with Keurig Brewers, 32ct K-Cups,Red","Single-Serve Capsules & Pods, Packaged Coffee, Cozy up with coffee, Coffee & Tea, Breakfast Deals, Coffee, Save on Coffee & Tea, 1, Beverages, OTC, Coffee & creamer, Main Coffee Base Shoveler, Coffee & Tea, Cups/Pods","B08Q8PGKDY"
"Amos Peelable Gummy Grape, Peelerz Gummy Grape Peeling Candy,Resealable 2.19oz Bag Fruit Gummies(Pack of 3)","Gummy Candy, Candy & Chocolate, Canned, Packaged & Baking, All Candy Coupons, Movie Night Coupons, Non-chocolate candy","B0D12BR271"
"Javvy Coffee Concentrate - Cold Brew Coffee, Perfect for Instant Iced Coffee, Cold Brewed Coffee and Hot Coffee, 35 Servings - Original Decaf","Iced Coffee & Cold-Brew, Coffee & Tea, Breakfast Deals, Coffee, Save on Coffee & Tea, Morning beverages, Beverages, OTC, Cold Brew/Iced Coffee, Coffee & creamer, Main Coffee Base Shoveler, Coffee & Tea, Protein drinks","B08SHHV9GN"
